idx	las	src	tgt	las_score_dbl	src_gt_8_words	tgt_gt_8_words
69387	[[0.9280345]]	A list of panel object IDs. Each ID identifies an individual panel object (e.g. an applet, launcher, action button or menu button/bar). The settings for each of these objects are stored in /apps/panel/objects/$(id).	পেনেল অবজেক্ট ID ৰ এটা তালিকা । প্ৰত্যেক ID ৰ দ্বাৰা এটা পেনেল অবজেক্ট (উদাহৰণ, লঞ্চাৰ, কৰ্ম নিৰ্দেশক বুটাম বা মেনু বুটাম/বাৰ) চিহ্নিত কৰা হ'ব । এই সমস্ত এপ্লেটেৰ বৈশিষ্ট্য /apps/panel/objects/$(id) ত লিখা আছে ।	0.9280345	True	True
69702	[[0.9045626]]	He had been ill for the last few days.	বিগত কিছুদিন ধৰি তেওঁ দুৰাৰোগ্য ৰোগত আক্ৰান্ত হৈ আছিল।	0.9045626	True	True
69759	[[0.92800254]]	Failed to connect to IMAP server %s in secure mode:	IMAP চাৰ্ভাৰ %s লে সুৰক্ষিত অৱস্থাত সংযোগ কৰিবলে ব্যৰ্থ:	0.92800254	True	True
69777	[[0.91115624]]	Would you like to update your credit card with this new information?	আপুনি এই নতুন তথ্যৰে আপোনাৰ ক্ৰেডিট কাৰ্ড আপডেট কৰিবলৈ বিচাৰে নেকি?	0.91115624	True	True
69815	[[0.937944]]	The type of subpixel antialiasing (none, rgb, bgr, vrgb, vbgr)	উপপিক্সেল এন্টিএলিয়াচিংৰ ধৰণ (কোনো নহয়, rgb, bgr, vrgb, vbgr)	0.937944	True	True
69837	[[0.904189]]	Afghanistan is bordered by Pakistan to the east and south. Iran to the west. Turkmenistan, Uzbekistan, and Tajikistan to the north. and China to the northeast.	আফগানিস্তানৰ পূব আৰু দক্ষিণে পাকিস্তান, পশ্চিমে ইৰাণ, উত্তৰে তুৰ্কমেনিস্তান, উজবেকিস্তান আৰু তাজিকিস্তান, উত্তৰ-পূবত চীন অৱস্থিত।	0.904189	True	True
69877	[[0.90687275]]	Narendra Singh Tomar: Minister of Agriculture and Farmers Welfare, Rural Development & Panchayati Raj	নৰেন্দ্ৰ সিং টোমৰ : কৃষি আৰু কৃষক কল্যাণ, গ্ৰামীণ বিকাশ আৰু পঞ্চায়তীৰাজ মন্ত্ৰণালয়	0.90687275	True	True
69941	[[0.9060224]]	Cabinet approves signing of revised Air Services Agreement between India and Nigeria	ভাৰত আৰু নাইজেৰিয়াৰ মাজত সংশোধিত বিমান সেৱা চুক্তি স্বাক্ষৰলৈ কেবিনেটৰ অনুমোদন	0.9060224	True	True
70026	[[0.9375786]]	This enables H.239 capability for additional video roles.	ই অতিৰিক্ত ভিডিঅ' ভূমিকাসমূহৰ বাবে H.239 ক্ষমতা সামৰ্থবান কৰে।	0.9375786	False	True
70063	[[0.92571557]]	The year-wise number of children approved and benefitted under Mid Day Meal Scheme is as under:	মধ্যাহ্ন ভোজন আঁচনিৰ অধীনত অনুমোদিত আৰু উপকৃত শিশুৰ সংখ্যা বছৰভিত্তিত তলত উল্লেখ কৰা ধৰণৰ:	0.92571557	True	True
70112	[[0.922221]]	$BrandShortName has been installed before. Lets get you a new copy.	$BrandShortName আগতে ইনষ্টল কৰা হৈছিল। আপোনাক এটা নতুন কপি দিওঁ আহক।	0.922221	True	True
70299	[[0.93011385]]	No databases found on dictionary server at '%s'	'%s' ত উপস্থিত অভিধান সেৱকত কোনো ডাটাবেস পোৱা নাযায়	0.93011385	False	True
70345	[[0.900404]]	It's not yet clear how the fire broke out.	কেনেকৈ এই অগ্নিকাণ্ডৰ সূত্ৰপাত হ’ল সেয়া এতিয়াও জানিব পৰা হোৱা নাই।	0.900404	True	True
70350	[[0.912869]]	Your organization has blocked access to this page or website.	আপোনাৰ সংগঠনে এই পৃষ্ঠা বা ৱেবছাইটত প্ৰৱেশ নিষেধ কৰিছে।	0.912869	True	True
70356	[[0.9018582]]	Your stored web and email passwords, form data, and private keys will not be protected.	আপোনাৰ সংৰক্ষিত ৱেব আৰু ইমেইলৰ পাছৱাৰ্ড, ফৰ্মৰ তথ্য আৰু ব্যক্তিগত কি' সংৰক্ষিত ন'হ'ব।	0.9018582	True	True
70413	[[0.90977657]]	To add a new option, enter its name in the box below and click to add.	নতুন বিকল্প যোগ কৰাৰ বাবে নিম্নলিখিত বাক্সে সেটিৰ নাম লিখে যোগ কৰক ক্লিক কৰক ।	0.90977657	True	True
70420	[[0.920066]]	As the EDID cannot be updated, it has no expiry date.	যিহেতু EDID ক আপডেইট কৰিব নোৱাৰি, ইয়াৰ কোনো অৱসানৰ তাৰিখ নাই।	0.920066	True	True
70429	[[0.93472916]]	This process may take several hours to complete, depending on the speed of your internet connection and the options selected.	এই প্ৰক্ৰিয়া সম্পূৰ্ণ হবলে বহু ঘন্টা লাগিব পাৰে, আপোনাৰ ইন্টাৰনেট গতি আৰু নিৰ্বাচন কৰা বিকল্পসমূহৰ উপৰত নিৰ্ভৰ কৰি।	0.93472916	True	True
70661	[[0.9236437]]	If you remove the device, you will have to set it up again before next use.	ডিভাইচ আঁতৰুৱা হ'লে, পৰবৰ্তী ব্যৱহাৰৰ পূৰ্বে আপুনি ইয়াক পুনৰ সংস্থাপন কৰিব লাগিব।	0.9236437	True	True
70782	[[0.9301646]]	Use of DOMExceptions code attribute is deprecated. Use name instead.	DOMException ৰ ক'ড বৈশিষ্টৰ ব্যৱহাৰ স্খলিত। ইয়াৰ পৰিৱৰ্তে নাম ব্যৱহাৰ কৰক।	0.9301646	True	True
70788	[[0.9242427]]	The winners of the competition will be awarded with cash prizes.	প্ৰতিযোগিতাত বিজয়ীসকল নগদ ধন সহ পুৰস্কাৰ প্ৰদান কৰা হ’ব।	0.9242427	True	True
70908	[[0.95326376]]	Help reach { NUMBER($hours) } hours in { $language } with a personal goal	ব্যক্তিগত লক্ষ্য এটাৰে { $language }ত { NUMBER($hours) } ঘণ্টালৈ গৈ পোৱাত সহায় কৰক	0.95326376	True	True
71188	[[0.90819967]]	He distinguished two kingdoms of living things: Regnum Animale ('animal kingdom') and Regnum Vegetabile ('vegetable kingdom', for plants).	তেওঁ জীৱসমূহ দুখন ৰাজ্যত ভাগ কৰিছিল: ৰেগ্নাম এনিমেল (Regnum Animale ,'প্ৰাণী জগৎ') আৰু ৰেগ্নাম ভেজিটেবিল (Regnum Vegetabile ,'শাকপাঁচলি জগৎ' অৰ্থাৎ উদ্ভিদ )।	0.90819967	True	True
71305	[[0.9012301]]	He encouraged the athletes to perform to the best of their ability in the worlds biggest sporting arena.	তেওঁ খেলুবৈসকলক বিশ্বৰ ক্ৰীড়া ক্ষেত্ৰৰ সৰ্ববৃহৎ ইভেণ্টটোত সাধ্য অনুসৰি প্ৰদৰ্শন আগবঢ়াবলৈ উৎসাহ যোগায়।	0.9012301	True	True
71467	[[0.9118668]]	He said that the energy and courage of youth had played an important role in the countrys freedom struggle.	তেওঁ কয় যে যুৱ সম্প্ৰদায়ৰ শক্তি আৰু সাহসে দেশৰ স্বাধীনতা অর্জনত গুৰুত্বপূৰ্ণ ভূমিকা পালন কৰিছিল।	0.9118668	True	True
71487	[[0.92657]]	India imports huge quantities of oil from Iran.	ইৰানৰ পৰা ভাৰতে বৃহৎ পৰিমানৰ খাৰুৱা তেল আমদানি কৰে।	0.92657	False	True
71620	[[0.93175864]]	Changing advanced configuration preferences can impact { -brand-short-name } performance or security.	অগ্ৰণী কনফিগাৰেশ্যন পছন্দসমূহ সালসলনি কৰিলে { -brand-short-name }-ৰ কাৰ্যক্ষমতা বা নিৰাপত্তাত প্ৰভাৱ পৰিব পাৰে।	0.93175864	True	True
71968	[[0.92301786]]	KDE is translated into many languages thanks to the work of the translation teams all over the world. For more information on KDE internationalization visit http: / /l10n. kde. org	বিশ্বব্যাপী বিভিন্ন অনুবাদক দলৰ অৱিৰত প্ৰয়াসত বিশ্বৰ বিভিন্ন ভাষাত KDE অনুবাদ কৰা হৈছে । KDE ৰ আন্তৰ্জাতীয়কৰণৰ সম্বন্ধে অধিক জনাৰ বাবে http: // l10n. kde. org চাওক ।	0.92301786	True	True
72004	[[0.92086625]]	The injured were taken to the Assam Medical College in Dibrugarh.	আহত লোকজনক ডিব্ৰুগড়ৰ অসম চিকিৎসা মহাবিদ্যালয় হাস্পতালত ভৰ্তি কৰোৱা হৈছে।	0.92086625	True	True
72168	[[0.94094104]]	You can purchase targets from well-known vendors like KODAK, X-Rite and LaserSoft in various online shops.	আপুনি লক্ষ্যবোৰ বিভিন্ন অনলাইন দোকানৰ পৰা বিখ্যাত বিক্ৰেতা যেনে KODAK, X-Rite আৰু LaserSoft ৰ পৰা কিনিব পাৰিব।	0.94094104	True	True
72264	[[0.91951656]]	End the selected process %s (PID: %u)?	নিৰ্বাচিত প্ৰক্ৰিয়া »%s« (PID: %u) সমাপ্ত কৰা হ'ব কি?	0.91951656	False	True
72306	[[0.9043139]]	Pi Day is an annual celebration of the mathematical constant (pi).	পাই দিৱস হ'ল গাণিতিক ধ্ৰুবক পাই (π)ৰ এটি বাৰ্ষিক উদযাপন।	0.9043139	True	True
72314	[[0.91439056]]	This document contains non-embedded fonts that are not from the PDF Standard 14 fonts. If the substitute fonts selected by fontconfig are not the same as the fonts used to create the PDF, the rendering may not be correct.	এই দস্তাবেজে নন-এমবেডেড ফন্টসমূহ অন্তৰ্ভুক্ত কৰে যি PDF প্ৰামাণিক ১৪ ফন্টসমূহৰ পৰা নহয়। যদি fontconfig দ্বাৰা নিৰ্বাচন কৰা প্ৰতিস্থাপন ফন্টসমূহ PDF সৃষ্টি কৰিবলে ব্যৱহাৰ কৰা ফন্টৰ সৈতে একে নহয়, ৰেণ্ডাৰিং সঠিক নহবও পাৰে।	0.91439056	True	True
72457	[[0.90997994]]	Unable to rename file '%s' to '%s': %s	'%s' নথিপত্ৰৰ নাম '%s' ত পৰিবৰ্তন কৰিবলৈ ব্যৰ্থ: %s	0.90997994	False	True
72461	[[0.91560036]]	If set, the name of the symbolic icon to use in the device in the user interface [x-gvfs-symbolic-icon=]	যদি সংহিত, ব্যৱহাৰকাৰী আন্তঃপৃষ্ঠত ডিভাইচত ব্যৱহাৰ কৰিব লগিয়া সাংকেতিক আইকনৰ নাম [x-gvfs-symbolic-icon=]	0.91560036	True	True
72503	[[0.91777205]]	NSS could not shutdown. Objects are still in use.	NSS বন্ধ হব পৰা নাই। অবজেক্টসমূহ এতিয়াও ব্যৱহাৰ হৈ আছে।	0.91777205	True	True
72576	[[0.904853]]	Teachers Day is a special occasion for both teachers and students alike.	ছাত্রছাত্রী আৰু শিক্ষক শিক্ষয়ত্ৰীৰ ওচৰত শিক্ষক দিৱস এটা বিশেষ দিন।	0.904853	True	True
72724	[[0.9247925]]	Congrats! Youre using the latest version of Firefox.	অভিনন্দন! আপুনি Firefox ৰ শেহতীয়া সংস্কৰণ ব্যৱহাৰ কৰি আছে।	0.9247925	False	True
72735	[[0.954976]]	My provider uses GSM technology (GPRS, EDGE, UMTS, HSPA)	মোৰ সেৱা উপলব্ধকৰ্তা দ্বাৰা GSM প্ৰযুক্তি ব্যৱহাৰ কৰা হয় (GPRS, EDGE, UMTS, HSPA)	0.954976	True	True
72741	[[0.94502467]]	"""Display options for the notification icon. Valid options are """"never"""", """"low"""", """"critical"""", """"charge"""", """"present"""" and """"always""""."""	"""বিজ্ঞপ্তিৰ আইকন প্ৰদৰ্শন সংক্ৰান্ত বিকল্প । বৈধ বিকল্পসমূহ হ'ল """"never"""", """"low"""", """"critical"""", """"charge"""", """"present"""" আৰু """"always"""" ।"""	0.94502467	True	True
72825	[[0.9119736]]	Authentication is required to modify the OLED image for a Wacom tablet	এটা Wacom টেবলেটৰ বাবে OLED ছবি পৰিবৰ্তন কৰিবলৈ প্ৰমাণীকৰণৰ প্ৰয়োজন	0.9119736	True	True
72959	[[0.9088498]]	But this mood cannot last for too long.	কিন্তু এই মনোভাৱ বেছি দিন ধৰি ৰখা সম্ভৱ নহ’ল।	0.9088498	False	True
72960	[[0.90017414]]	The injured have been referred to a hospital in critical condition.	আহত লোক জনক সংকটজনক অৱস্থাত চিকিৎসালয়ত ভৰ্তি কৰোৱা হয়।	0.90017414	True	True
73005	[[0.93247116]]	The disk will be partitioned and a %s partition will be created	ডিস্ক বিভাজন কৰা হ'ব আৰু এটা %s বিভাজন নিৰ্মাণ কৰা হ'ব	0.93247116	True	True
73028	[[0.94405806]]	"""Save changes to image """"%s"""" before closing?"""	"""বন্ধ কৰাৰ আগতে পৰিবৰ্তনসমূহ """"%s"""" ছবিলে সংৰক্ষণ কৰিব নে?"""	0.94405806	False	True
73080	[[0.93915236]]	This functionality is typically used by GNOME Control Center from the color panel although can be used on its own.	এই কাৰ্য্যকৰিতা সাধাৰণত GNOME Control Center ৰ দ্বাৰা ৰঙৰ পেনেলৰ পৰা ব্যৱহাৰ কৰা হয় যদিও ইয়াক নিজস্বভাৱে ব্যৱহাৰ কৰিব পাৰি।	0.93915236	True	True
73085	[[0.95920676]]	He worked as journalist before entering politics.	ৰাজনীতিত প্ৰৱেশ কৰাৰ আগতে তেওঁ সাংবাদিক হিচাপে কাম কৰিছিল।	0.95920676	False	True
73108	[[0.90127313]]	The development of trade and the rise of business were among the major causes of the Industrial Revolution.	বেপাৰ-বাণিজ্যৰ বিকাশ আৰু ব্যৱসায়ৰ উত্থানেই আছিল শিল্প বিপ্লৱ ঘটাৰ প্ৰধান কাৰণ।	0.90127313	True	True
73242	[[0.93002117]]	Changes are not applied instantly, this button applies all changes	পৰিবৰ্তনসমূহ তৎক্ষনাৎ প্ৰয়োগ কৰা নহয়, এই বুটামে সকলো পৰিৱৰ্তন প্ৰয়োগ কৰে	0.93002117	True	True
73515	[[0.9515486]]	Use of document.createAttributeNS() is deprecated. Use element.setAttributeNS() instead.	document.createAttributeNS() ৰ ব্যৱহাৰ স্খলিত। তাৰ পৰিৱৰ্তে element.setAttributeNS() ব্যৱহাৰ কৰক।	0.9515486	False	True
73604	[[0.91812956]]	The name Phek comes from the word Phekrekedze, meaning watch tower.	ফেক নামৰ উৎস হৈছে Phekrekedze শব্দটো যাৰ অৰ্থ হৈছে নিৰীক্ষণ স্তম্ভ (watch tower)।	0.91812956	True	True
73726	[[0.9283151]]	Please install 'Tracker' then restart the application.	অনুগ্ৰহ কৰি 'Tracker' ইনস্টল কৰক আৰু এপ্লিকেচন পুনাৰম্ভ কৰক।	0.9283151	False	True
73824	[[0.9219286]]	The radio broadcast recorded messages from Gandhi and other prominent leaders across India.	ৰেডিঅ' সম্প্ৰচাৰে সমগ্ৰ ভাৰতৰ গান্ধী আৰু অন্যান্য বিশিষ্ট নেতাসকলৰ পৰা বাৰ্তা বাণীবন্ধন কৰিছিল।	0.9219286	True	True
73846	[[0.91224444]]	"""Her work on 'chaos-based' hardware (so-called """"Chaos computing"""") is being developed commercially by the US-based company Chaologix."""	"""তেখেতে """"বিশৃংখলাভিত্তিক হাৰ্ডৱেৰ"""" (chaos-based' hardware, so-called """"Chaos computing"""") সম্পৰ্কে কৰা গৱেষণা-কাৰ্যক ব্যৱসায়িক দিশত বিকাশ সাধন কৰিছে আমেৰিকান কোম্পানী কাউলোজিক্সে(Chaologix)।"""	0.91224444	True	True
73885	[[0.924255]]	LED screens also change over time, but a much slower rate than TFTs.	LED পৰ্দাসমূহ সময়ৰ সৈতে পৰিবৰ্তন হয়, কিন্তু TFTs ৰ তুলনাত বহুত লেহেম হাৰত।	0.924255	True	True
74018	[[0.9019464]]	Fortunately, no one died in the incident.	অৱশ্যে , ঘটনাটোত কোনো লোক হতাহতি হোৱা নাই ।	0.9019464	False	True
74086	[[0.9393568]]	You've successfully signed up for contributing to { $language }. Thank you.	{ $language }ত অৱদান দিবলৈ আপুনি সফলভাৱে ছাইন আপ কৰিলে। ধন্যবাদ।	0.9393568	True	True
74164	[[0.92063165]]	"""The document """"%s"""" already exists. Would you like to replace it?"""	"""""""%s"""" দস্তাবেজটো ইতিমধ্যে উপস্থিত আছে। আপুনি ইয়াক প্ৰতিস্থাপন কৰিব বিচাৰে নে?"""	0.92063165	True	True
74287	[[0.90944237]]	Create a video DVD or a (S)VCD from the currently opened movie	বৰ্তমানে চলমান চলচিত্ৰৰ পৰা ভিডিঅ' DVD অথবা (S)VCD সৃষ্টি কৰক	0.90944237	True	True
74443	[[0.9445803]]	Drag or click on the page to select a region. Press ESC to cancel.	অঞ্চল এটা বাছনি কৰিবলৈ পৃষ্ঠাখনত ধৰি টানক বা ক্লিক কৰক। বাতিল কৰিবলৈ ESC হেঁচক।	0.9445803	True	True
74625	[[0.91839194]]	It is easy to take the name of Gandhiji, but it is tough to follow his path.	ক’লেঃ গান্ধীজীৰ নাম লোৱাতো সহজ, কিন্তু তেওৰ ৰাস্তাৰে যোৱাতো কঠিন।	0.91839194	True	True
74653	[[0.90314436]]	"""""""Tri"""" means three, """"Pura"""" means fortress, castle, city, town, etc."""	"""""""ত্ৰি"""" অৰ্থ তিনিটা, """"পুৰ"""" অৰ্থ দুৰ্গ, চহৰ, নগৰ ইত্যাদি।"""	0.90314436	True	True
74938	[[0.90965605]]	%S could not be saved, because the file name was too long.\n\nTry saving with a shorter file name.	%S সংৰক্ষণ কৰিব পৰা নগল, কাৰণ ফাইলৰ নামৰ বৰ দীঘল।\n\nএটা সৰু নামেৰে সংৰক্ষণ কৰিবলৈ চেষ্টা কৰক।	0.90965605	True	True
74969	[[0.91874826]]	"""Usernames may only be letters, numbers, """"."""" and """"-""""."""	"""ব্যৱহাৰকাৰীনাম কেৱল বৰ্ণ, সংখ্যা, """"."""" আৰু """"-"""" হ'ব পাৰে।"""	0.91874826	True	True
75113	[[0.9070959]]	Educational Qualification: Candidate should posses Any Degree From Recognized University.	শিক্ষাগত অৰ্হতা : প্ৰাৰ্থী স্বীকৃতিপ্ৰাপ্ত বিশ্ববিদ্যালয়ৰ পৰা স্নাতক ডিগ্ৰীধাৰী হ’ব লাগিব ।	0.9070959	True	True
75364	[[0.922305]]	The Ministry of Water Resources, River Development and Ganga Rejuvenation (WR,RD&GR) has been envisaging bilateral cooperation with other countries in water resources development and management.	পটভুমিঃ জলসম্পদ, নদী উন্নয়ন আৰু গংগা পুনৰুজ্জীৱিতকৰণ মন্ত্ৰালয়ে (WR,RD&GR) অন্য দেশৰ সৈতে জলসম্পদৰ বিকাশ আৰু ব্যৱস্থাপনাৰ ক্ষেত্ৰত দ্বিপাক্ষিক সহযোগিতাৰ সন্দৰ্ভত চিন্তা-চৰ্চা কৰি আহিছে।	0.922305	True	True
75398	[[0.91984814]]	No video will be displayed on your machine during this call	এই কল চলি থকা সময়ত আপোনাৰ মেচিনত কোনো ভিডিঅ' দেখুৱা নহব	0.91984814	True	True
75489	[[0.9360315]]	requested position/size for CRTC %d is outside the allowed limit: position=(%d, %d), size=(%d, %d), maximum=(%d, %d)	CRTC %d-ৰ বাবে অনুৰোধ কৰা অবস্থান/মাপ সীমাবহিৰ্ভূত: অবস্থান=(%d, %d), মাপ=(%d, %d), সৰ্বাধিক=(%d, %d)	0.9360315	True	True
75500	[[0.95740676]]	The third deceased could not been identified yet.	নিহত তৃতীয়জনক এতিয়ালৈকে চিনাক্ত কৰিবলৈ সক্ষম হোৱা নাই আৰক্ষীয়ে।	0.95740676	False	True
75616	[[0.900301]]	Locate files based on file name and type. Save your searches for later use.	ফাইল নাম আৰু ধৰণৰ উপৰত ভিত্তি কৰি ফাইলসমূহ অৱস্থিত কৰক। আপোনাৰ সন্ধান পৰৱৰ্তী ব্যৱহাৰৰ বাবে সংৰক্ষিত ৰাখক।	0.900301	True	True
75649	[[0.9004363]]	Youths, Are You Building for the Future?	যুৱক - যুৱতীসকল, আপোনালোকে ভৱিষ্যতৰ বাবে নিৰ্ভৰযুক্ত আধাৰ গঢ়ি তুলিছেনে?	0.9004363	False	True
75671	[[0.93023926]]	The first country to receive a World Bank loan was France.	বিশ্ব বেংকৰ পৰা ঋণ লাভ কৰা প্ৰথম দেশ আছিল ফ্ৰাঞ্চ।	0.93023926	True	True
76108	[[0.9569802]]	But no action has been taken yet.	কিন্তু এতিয়ালৈকে কোনো পদক্ষেপ গ্ৰহণ কৰা পৰিলক্ষিত হোৱা নাই।	0.9569802	False	True
76320	[[0.91991013]]	If you're sure that you entered the correct but you still can't successfully connect to a wireless network, try some of the following:	যদি আপুনি সঠিক সুমুৱাইছে বুলি নিশ্চিত কিন্তু তথাপিও আপুনি এটা বেতাঁৰ নেটৱাৰ্কৰ সৈতে সফলভাৱে সংযোগ কৰিব পৰা নাই, নিম্নলিখিতৰ কিছুমান চেষ্টা কৰি চাওক:	0.91991013	True	True
76324	[[0.904868]]	The Prime Minister, Shri Narendra Modi, today inaugurated the Bahadurgarh-Mundka Metro Line via video conference.	প্ৰধানমন্ত্ৰী শ্ৰী নৰেন্দ্ৰ মোদীয়ে আজি ভিডিঅ’ কনফাৰেন্সযোগে বাহাদুৰগড়-মুণ্ডকা মেট্ৰো ৰে’ল লাইনৰ শুভাৰম্ভ কৰে।	0.904868	True	True
76421	[[0.9559709]]	Please sign in to reconnect { $email }	পুনৰ সংযোগ কৰিবলৈ অনুগ্ৰহ কৰি ছাইন ইন কৰক { $email }	0.9559709	False	True
76482	[[0.9037213]]	Two other persons involved in the incident are still at large.	ঘটনাটোত জড়িত আন দুজন প্ৰবঞ্চক বৰ্তমানেও পলাতক অৱস্থাত আছে ।	0.9037213	True	True
