idx	las	src	tgt	las_score_dbl	src_gt_8_words	tgt_gt_8_words
88	[[0.94008607]]	An additional program is required to open this type of file:	এই ধৰণৰ ফাইল খোলাৰ বাবে এটা অতিৰিক্ত এপ্লিকেচনৰ প্ৰয়োজন:	0.94008607	True	True
130	[[0.92354065]]	Permission denied for (document.domain=) to set property %2$S.%3$S on (document.domain=).	(document.domain=) ত সম্পত্তি %2$S.%3$S সংহতি কৰিবলে (document.domain=) ক অনুমতি নাকচ কৰা হৈছে।	0.92354065	True	True
275	[[0.9518236]]	Is this website storing information on my computer?	এই ৱেবছাইটটোৱে মোৰ কম্পিউটাৰত তথ্য সঞ্চয় কৰি আছে নেকি?	0.9518236	False	True
318	[[0.9370712]]	These rules will remain in force until the area is declared safe under the regulations of the Ministry of Health and Family Welfare, Government of India.	ভাৰত চৰকাৰৰ স্বাস্থ্য আৰু পৰিয়াল কল্যাণ মন্ত্ৰালয়ৰ নিয়মাৱলীৰ আধাৰত এই এলেকা সুৰক্ষিত বুলি ঘোষণা নোহোৱা পৰ্যন্ত এই নিয়ম সমূহ বাহাল থাকিব ৷	0.9370712	True	True
464	[[0.9106775]]	{ -screenshots-brand-name } is disabled in Private Browsing Mode	ব্যক্তিগত ব্ৰাউজিং ম'ডত { -screenshots-brand-name } নিষ্ক্ৰিয় কৰা হয়	0.9106775	True	True
467	[[0.9070334]]	His father was Abdul Rahman Khan from Kandahar, Afghanistan while his mother was Iqbal Begum from Pishin, British India (now in Balochistan, Pakistan).	তেওঁৰ পিতৃ আব্দুল ৰহমান খান কান্দাহাৰ আৰু মাতৃ ইকবাল বেগম ব্ৰিটিছ ভাৰতৰ পিশ্বীনৰ (বৰ্তমান পাকিস্তানৰ বেলুচিস্থান) আছিল।	0.9070334	True	True
610	[[0.9130446]]	Your computer must be restarted in order to complete the installation of $BrandFullNameDA. Do you want to reboot now?	$BrandFullNameDA ৰ ইনস্টল সম্পূৰ্ণ কৰিবলৈ আপোনাৰ কমপিউটাৰ পুনাৰম্ভ কৰিব লাগিব। আপুনি এতিয়া পুনাৰম্ভ কৰিব বিচাৰে নে?	0.9130446	True	True
710	[[0.900047]]	There is not sufficient memory to complete the action you requested.\n\nQuit some applications and try again.	আপুনি অনুৰোধ কৰা কাৰ্য্য সম্পূৰ্ণ কৰিবলৈ পৰ্যাপ্ত স্মৃতিশক্তি নাই।\n\nকিছুমান এপ্লিকেচন বাতিল কৰি পুনঃ চেষ্টা কৰক।	0.900047	True	True
724	[[0.9035099]]	The High Speed Railway cooperation between India and Japan is a shining example of the strength of our cooperation.	ভাৰত-জাপানৰ মাজত দ্ৰুত গতিৰ ৰে’লপথৰ সহযোগিতা, আমাৰ শক্তিশালী সহযোগিতাৰ এক উজ্জল নিদৰ্শন।	0.9035099	True	True
826	[[0.9036701]]	"""The action to take when the system hibernate button is pressed. Possible values are """"suspend"""", """"hibernate"""", """"interactive"""", """"shutdown"""" and """"nothing""""."""	"""সিস্টেম নিদ্ৰাৰ বুটাম টেপা হ'লে সঞ্চালনৰ বাবে নিৰ্ধাৰিত কৰ্ম । সম্ভাব্য মান হ'ল """"suspend"""", """"hibernate"""", """"interactive"""", """"shutdown"""" আৰু """"nothing"""" ।"""	0.9036701	True	True
851	[[0.91137]]	In his address, the Prime Minister congratulated all the members of the committee for creative and practical suggestions.	ভাষণত প্ৰধানমন্ত্ৰীয়ে কমিটিৰ সকলো সদস্যক তেওঁলোকৰ সৃষ্টিশীল আৰু ব্যৱহাৰিক পৰামৰ্শসমূহৰ বাবে অভিনন্দন জ্ঞাপন কৰে৷	0.91137	True	True
939	[[0.9084884]]	MAPI folders can be created only within mailbox of the logged user	MAPI ফোল্ডাৰসমূহ কেৱল লগ কৰা ব্যৱহাৰকাৰীজনৰ মেইলবাকচৰ মাজত সৃষ্টি কৰিব পাৰি	0.9084884	True	True
1009	[[0.93731403]]	Do you want to create a new archive with these files?	এই ফাইলসমূহ সহ এটা নতুন আৰ্কাইভ সৃষ্টি কৰিব নেকি ?	0.93731403	True	True
1016	[[0.9362377]]	It also grants the right to proper medical treatment and care.	তাৰ লগতে সঠিক চিকিৎসা তথা যত্ন লাভ কৰাৰ অধিকাৰো প্ৰদান কৰে ।	0.9362377	True	True
1161	[[0.9184231]]	It's not yet clear how the fire broke out.	অগ্নিকাণ্ডৰ সূত্ৰপাত কেনেকৈ ঘটিল সেয়া এতিয়াও জানিব পৰা হোৱা নাই।	0.9184231	True	True
1176	[[0.9150374]]	The Prime Minister said that India, and especially the Ministry of External Affairs, has done significant humanitarian work in the last two years.	প্ৰধানমন্ত্ৰীয়ে কয় যে ভাৰতে আৰু বিশেষকৈ বৈদেশিক পৰিক্ৰমা মন্ত্ৰালয়ে বিগত দুবছৰত কেতবোৰ গুৰুত্বপূৰ্ণ মানৱতাবাদী কাৰ্য সম্পাদন কৰিছে।	0.9150374	True	True
1211	[[0.90130484]]	I call upon the youth, the trading community, and farmers to connect with BHIM as much as possible.	মই যুৱপ্ৰজন্ম, ব্যৱসায়ী সমাজ আৰু কৃষকসকলক এই বি এইচ আই এমৰ সৈতে যিমান পাৰে সিমান জড়িত হ’বলৈ আহ্বান জনাইছো।	0.90130484	True	True
1213	[[0.94911724]]	Copy one or more files from SOURCE to DEST.	এটা বা অধিক ফাইলসমূহ SOURCE ৰ পৰা DEST লে কপি কৰক।	0.94911724	True	True
1224	[[0.9354011]]	Cannot get LUKS cleartext slave from path `%s'	`%s' পথৰ পৰা LUKS cleartext স্লেইভ প্ৰাপ্ত কৰা নাযায়	0.9354011	False	True
1320	[[0.9211308]]	An unknown error occurred. This is most likely a problem with bug-buddy. Please report this problem manually at bugzilla.gnome.org	অজ্ঞাত সমস্যা উৎপন্ন হৈছে । সম্ভৱত এইটো bug-buddy সম্বন্ধীয় কোনো সমস্যা। অনুগ্ৰহ কৰি bugzilla.gnome.org ত এই সমস্যা সম্পৰ্কে স্বয়ং সূচনা প্ৰদান কৰক	0.9211308	True	True
1357	[[0.9244492]]	"""and added, """"I hope that her immortal voice will motivate other artists to practice the right Punjabi folk music tradition""""."""	"""আৰু যোগ দিছিল, """"মই আশা কৰোঁ তেওঁৰ অমৰ কণ্ঠ অন্যান্য শিল্পীসকলোৰ সঠিক পঞ্জাবী লোক সংগীতৰ ঐতিহ্য অনুশীলন কৰিবলৈ অনুপ্ৰাণিত কৰিব।"""	0.9244492	True	True
1445	[[0.9436426]]	"""Name of the font to use for the page footer (e.g. """"Monospace 10"""")"""	"""পৃষ্ঠাৰ ফুটাৰৰ বাবে ব্যবহৃত ফন্টৰ নাম (যেনে """"Monospace 10"""")"""	0.9436426	True	True
1753	[[0.9372356]]	Sorry, that didn't work. Please try again.	ক্ষমা কৰিব, সেয়া কাম নকৰিলে। অনুগ্ৰহ কৰি পুনৰ চেষ্টা কৰক।	0.9372356	False	True
1791	[[0.91134906]]	You should have received a copy of the GNU Lesser General Public License along with this program. if not, write to the Free Software Foundation, Inc., 51 Franklin Street, Fifth Floor, Boston, MA 02110-1301, USA.	আপুনি হৈতো ইতিমধ্যে এই প্ৰগ্ৰামৰ সৈতে GNU Lesser General Public License ৰ কপি এটা পাইছে. যদি নহয়, তেন্তে Free Software Foundation, Inc., 51 Franklin Street, Fifth Floor, Boston, MA 02110-1301, USA লে লিখক।	0.91134906	True	True
1847	[[0.92197275]]	"""The search mode used by default. Options are """"name"""", """"details"""", or """"file""""."""	"""অবিকল্পিতভাৱে ব্যৱহাৰ কৰা সন্ধান অৱস্থা। বিকল্পসমূহ হল """"name"""", """"details"""", অথবা """"file""""।"""	0.92197275	True	True
1855	[[0.91449594]]	We plant and water, but God makes it grow	আমি শস্য ৰোৱা আৰু পানী দিয়া কাৰ্য্য কৰোঁ, কিন্তু ঈশ্বৰহে ইয়াক বৃদ্ধি কৰে	0.91449594	True	True
2018	[[0.90956473]]	The chosen sound will be played when a new voice mail is received, if enabled	নিৰ্বাচিত ধ্বনি নতুন ভইচ মেইল আহিলে বজোৱা হ'ব, যদি সক্ৰিয়	0.90956473	True	True
2297	[[0.9130849]]	is a for your web browser which allows you to watch videos and use interactive web pages on some websites. Some websites won't work without Silverlight.	আপোনাৰ ৱেব ব্ৰাউছাৰৰ বাবে এটা যি আপোনাক কিছুমান ৱেবছাইটত ভিডিঅ' চোৱাৰ আৰু ভাৱবিনিময়ী ৱেব পৃষ্ঠাসমূহ ব্যৱহাৰ কৰাৰ অনুমতি দিয়ে। কিছুমান ৱেবছাইট Silverlight ৰ অবিহনে কাম নকৰে।	0.9130849	True	True
2351	[[0.921361]]	NAWADCO had signed MoU with National Building Construction Corporation (NBCC) on 8-9-2014 for developing properties.	ৰাষ্ট্ৰীয় ৱাকফ উন্নয়ন নিগমে এই সম্পত্তিসমূহৰ উন্নয়নৰ বাবে বিগত 8-9-2014 তাৰিখে National Building Construction Corporation (NBCC) ৰ সৈতে এক বুজাবুজিৰ চুক্তিত স্বাক্ষৰো কৰিছে৷	0.921361	True	True
2406	[[0.9174291]]	Allows you to share your desktop so other people can view it or provide remote assistance.	আপোনাৰ ডেস্কটপ অংশীদাৰী কৰাৰ অনুমতি দিয়ে যাতে অন্য মানুহে ইয়াক দৰ্শন কৰিব পাৰে অথবা দূৰৱৰ্তী সহায় প্ৰদান কৰিব পাৰে।	0.9174291	True	True
2408	[[0.90822995]]	The update could not be installed. Please make sure there are no other copies of %S running on your computer, and then restart %S to try again.	আপডেইট ইনস্টল কৰিব পৰা নাযায়। নিশ্চিত কৰক যে আপোনাৰ কমপিউটাৰত %S ৰ কোনো কপি চলি থকা নাই, আৰু তাৰ পিছত পুনঃ চেষ্টা কৰিবলৈ %S পুনাৰম্ভ কৰক।	0.90822995	True	True
2462	[[0.90868735]]	Cannot find home directory: not set in /etc/passwd and no value for $HOME in environment	ঘৰ ডাইৰেকটৰিৰ সন্ধান পোৱা নগল: /etc/passwd ফাইলত উল্লেখ নাই আৰু পৰিবেশত $HOME ৰ কোনো মান নাই	0.90868735	True	True
2637	[[0.9397954]]	Font size (as a multiple of PANGO_SCALE, eg. 12*PANGO_SCALE for a 12pt font size)	ফন্টৰ আকাৰ (PANGO_SCALE ৰ গুণক হিচাপে, যেনে 12*PANGO_SCALE এটা ১২pt ফন্ট আকাৰৰ কাৰণে)	0.9397954	True	True
3082	[[0.908819]]	The MoU will be signed between Ministry of Water Resources, River Development and Ganga Rejuvenation, Government of India and the Ministry of Interior, Government of Hungary.	ভাৰত চৰকাৰৰ জল সম্পদ, নদী উন্নয়ন আৰু গংগা পুনৰুজ্জীৱিতকৰণ মন্ত্ৰালয় আৰু হাংগেৰীৰ আভ্যন্তৰীণ মন্ত্ৰালয়ৰ মাজত এই বুজাবুজি চুক্তি স্বাক্ষৰিত হ’ব।	0.908819	True	True
3325	[[0.90722334]]	After you computer turns off, switch it back on. Did your open applications re-open?	আপোনাৰ কমপিউটাৰ বন্ধ হোৱাৰ পিছত, ইয়াক পুনৰ আৰম্ভ কৰিব। আপোনাৰ খোলা এপ্লিকেচনসমূহ আকৌ খোলিছিল নেকি?	0.90722334	True	True
3522	[[0.90442836]]	Hitesh Kakati is a retired teacher who lives with his wife Manorama Kakati happily in a small town.	অৱসৰপ্ৰাপ্ত শিক্ষক হিতেশ কাকতিয়ে তেখেতৰ পত্নী মনোৰমা ককতিৰ সৈতে সৰু চহৰ এখনত সুখেৰে বসবাস কৰে।	0.90442836	True	True
3524	[[0.9064249]]	Number of rows in newly created terminal windows. Has no effect if use_custom_default_size is not enabled.	নতুনকে সৃষ্টি কৰা টাৰ্মিনেল উইন্ডোসমূহত শাৰীসমূহৰ সংখ্যা। কোনো প্ৰভাৱ নেপেলায় যদি use_custom_default_size সামৰ্থবান নাথাকে।	0.9064249	True	True
3604	[[0.90345395]]	The four historical traditions in geographical research are spatial analyses of natural and the human phenomena, area studies of places and regions, studies of human-land relationships, and the Earth sciences.	ভূগোলৰ গৱেষণাৰ চাৰিটা পৰম্পৰাগত ভাগ হৈছে প্ৰকৃতি আৰু মানৱ পৰিঘটনাৰ বিশ্লেষণ, ভূমি অধ্যয়ন (স্থান), মানুহ-ভূমিৰ সম্পৰ্কৰ অধ্যয়ন, আৰু ভূ বিজ্ঞানৰ গৱেষণা।	0.90345395	True	True
3657	[[0.91498685]]	Selection Process: The selection will be on the basis of interview.	নিৰ্বাচন প্ৰক্ৰিয়া : প্ৰাৰ্থীক সাক্ষাৎকাৰৰ জৰিয়তে নিৰ্বাচন কৰা হ’ব ।	0.91498685	True	True
3852	[[0.91421545]]	SSL received a record with an incorrect Message Authentication Code.	SSL এ এটা ভুল বাৰ্তা প্ৰমাণীকৰণ কোডৰ সৈতে সংবাদ গ্ৰহণ কৰিছে।	0.91421545	True	True
3872	[[0.9078745]]	Netscape.cfg/AutoConfig failed. Please contact your system administrator. \n Error: %S failed:	Netscape.cfg/AutoConfig ব্যৰ্থ। আপোনাৰ চিস্টেমৰ প্ৰশাসকক সংযোগ কৰক। \n ত্ৰুটি: %S ব্যৰ্থ:	0.9078745	True	True
3909	[[0.90991724]]	We have to remember that, despite all the resources at our disposal, whenever Indian society has been divided, whenever there have been internal conflicts, external enemies have taken advantage.	আমি মনত ৰাখিব লাগিব যে আমাৰ ইমান সম্পদ থকা সত্ত্বেও যেতিয়াই ভাৰতীয় সমাজত বিভাজন দেখা দিছে, যেতিয়াই আমি আভ্যন্তৰীণ সংঘাতত লিপ্ত হৈছো, তেতিয়াই বহিৰাগত শত্রুসকলে তাৰ সুবিধা লৈছে।	0.90991724	True	True
3915	[[0.9172681]]	The custom filesystem type to create e.g. btrfs, xfs or swap	সৃষ্টি কৰিবলে স্বনিৰ্বাচিত নথিপত্ৰপ্ৰণালী ধৰণ উদাহৰণস্বৰূপ btrfs, xfs অথবা swap	0.9172681	True	True
4288	[[0.900953]]	Excerpts of the PM's inaugural address in eleventh Inter-State Council Meeting at New Delhi	নতুন দিল্লীত একাদশ আন্তঃৰাজ্যিক পৰিষদীয় বৈঠকত প্ৰধানমন্ত্ৰীৰ উদ্বোধনী ভাষণৰ বক্তব্য	0.900953	True	True
4332	[[0.90398]]	It is important for us to know the answers to these questions.	আমাৰ বাবে এই প্ৰশ্নসমূহৰ উত্তৰ জনাটো অতি আৱশ্যক ।	0.90398	True	True
4505	[[0.9232039]]	"""Which type of background should be used for this panel. Possible values are """"gtk"""" - the default GTK+ widget background will be used, """"color"""" - the color key will be used as background color or """"image"""" - the image specified by the image key will be used as background."""	"""এই পেনেলৰ বাবে ব্যৱহৃত পটভূমিৰ প্ৰকৃতি । সম্ভাব্য মান হ'ল """"gtk"""" - অবিকল্পিত GTK+ উইজেট‌ পটভূমি ব্যৱহৃত হ'ব, """"color (ৰঙ)"""" - বাচি লোৱা ৰঙ পটভূমিত ব্যৱহৃত হ'ব বা """"image (ছবি)"""" - নিৰ্বাচিত ছবি পটভূমিতে ব্যৱহৃত হ'ব ।"""	0.9232039	True	True
4555	[[0.90084004]]	"""Mouse button to activate the """"Forward"""" command in browser window"""	"""ব্ৰাউজাৰ উইন্ডোত """"আগলৈ"""" কমান্ড সক্ৰিয় কৰাৰ বাবে মাউছ বুটাম"""	0.90084004	True	True
4569	[[0.90879995]]	Websites prove their identity via certificates, which are issued by certificate authorities. Most browsers no longer trust certificates issued by GeoTrust, RapidSSL, Symantec, Thawte, and VeriSign. { $hostname } uses a certificate from one of these authorities and so the websites identity cannot be proven.	ৱেবছাইটসমূহে প্ৰমাণপত্ৰৰ জৰিয়তে নিজৰ পৰিচয় প্ৰমাণ কৰে যিবোৰ প্ৰমাণপত্ৰ প্ৰাধিকাৰীসমূহৰ দ্বাৰা জাৰি কৰা হয়। বেছিভাগ ব্ৰাউজাৰে GeoTrust, RapidSSL, Symantec, Thawte আৰু VeriSign দ্বাৰা জাৰি কৰা প্ৰমাণপত্ৰসমূহত এতিয়া আৰু বিশ্বাস নকৰে। { $hostname }-এ ইয়াৰে কোনো এটা প্ৰাধিকাৰীৰ প্ৰমাণপত্ৰ ব্যৱহাৰ কৰে আৰু সেয়েহে ৱেবছাইটৰ পৰিচয় প্ৰমাণিত কৰিব নোৱাৰি।	0.90879995	True	True
4591	[[0.91584]]	It is suspected that due to food poisoning, the vultures died.	সন্দেহ কৰা মতে খাদ্যত হোৱা বিষক্ৰিয়াৰ বাবে হাতীজনীৰ মৃত্যু হৈছে।	0.91584	True	True
4763	[[0.90825224]]	Our capacities and needs in the fields of vocational, technical and professional education complement each other, and can benefit both our people.	বৃত্তিমুলক, কাৰিকৰী আৰু প্রযুক্তিগত তথা পেশাদাৰিত্বমূলক শিক্ষাৰ ক্ষেত্ৰত আমাৰ চাহিদা আৰু ক্ষমতা পৰস্পৰৰ পৰিপূৰক আৰু সেইটোৰ পৰা দয়ো দেশৰ জনসাধাৰণেই লাভবান হ’ব পাৰিব।	0.90825224	True	True
4777	[[0.9395727]]	Unable to get the '%s' key inside the dictionary source definition: %s	অভিধান উৎসেৰ সংজ্ঞাত '%s' চাবি প্ৰাপ্ত কৰিবলৈ ব্যৰ্থ: %s	0.9395727	True	True
4999	[[0.94636405]]	Sorry! There are no results in any sections for { $searchTerms }	দুঃখিত! “{ $searchTerms }”ৰ বাবে কোনো বিভাগতে ফলাফল নাই	0.94636405	True	True
5546	[[0.9101193]]	Color target files are needed to convert the image to a color profile.	ছবিটোক এটা ৰঙৰ আলেখ্যলে পৰিবৰ্তন কৰিবলে ৰঙৰ লক্ষ্য ফাইলসমূহৰ প্ৰয়োজন।	0.9101193	True	True
5627	[[0.9305217]]	Other treatment options include pregabalin, tricyclic antidepressants, buspirone, moclobemide, and sertraline, among others.	অন্য চিকিৎসাৰ বিকল্পসমূহ হৈছে: pregabalin, tricyclic antidepressants, buspirone, moclobemide, আৰু seratriline ইত্যাদি।	0.9305217	True	True
5641	[[0.92792666]]	No oFono object manager running, so the oFono backend will be inactive. Either oFono isnt installed or the service cant be started.	কোনো oFono অবজেক্ট ব্যৱস্থাপক চলি থকা নাই, সেয়েহে oFono বেকএণ্ড নিষ্ক্ৰিয় হব। oFono ইনস্টল নাই অথবা সেৱা আৰম্ভ কৰিব নোৱাৰি।	0.92792666	True	True
5686	[[0.9103563]]	Following the war, researchers became interested in a variety of social problems, including issues of gender and racial prejudice.	যুদ্ধৰ পিছত, গৱেষকসকলে বিভিন্ন সামাজিক সমস্যাৰ প্ৰতি আগ্ৰহী হ'ব ধৰিলে, যাৰ ভিতৰত আছে লিঙ্গ আৰু জাতিগত বৈষম্যৰ বিষয়।	0.9103563	True	True
5881	[[0.95043457]]	The actual cause of the fire is still not known.	বৰ্তমানেও জানিব পৰা হোৱা নাই অগ্নিকাণ্ডৰ প্ৰকৃত কাৰণ ৷	0.95043457	True	True
5938	[[0.90463233]]	You can rename the file by changing this field. You can also rename a file outside the properties window. See .	আপুনি এই ফিল্ড পৰিবৰ্তন কৰি ফাইলক পুনৰ নামকৰণ কৰিব পাৰিব। আপুনি এটা ফাইলক বৈশিষ্ট্যসমূহ উইন্ডোৰ বাহিৰতো পুনৰ নামকৰণ কৰিব পাৰিব। চাওক।	0.90463233	True	True
6007	[[0.929319]]	No data was received (please try again)	কোনো তথ্য পোৱা নগল (অনুগ্ৰহ কৰি আকৌ চেষ্টা কৰক)	0.929319	False	True
6022	[[0.9070435]]	"""Select the search option """"Show hidden files and folders"""""""	"""অনুসন্ধান কৰ্মৰ """"আড়াল কৰা নথিপত্ৰ আৰু ফোল্ডাৰ প্ৰদৰ্শন কৰা হ'ব"""" বিকল্প নিৰ্বাচন কৰক"""	0.9070435	True	True
6157	[[0.9123479]]	Your first name and surname will be used when connecting to other VoIP and videoconferencing software.	অন্যান্য VoIP ও ভিডিও-কনফাৰেন্স সফ্টওয়্যাৰেৰ সৈতে সংযোগ কৰাৰ সময় আপোনাৰ নাম ও পদবি ব্যবহাৰ কৰা হ'ব ।	0.9123479	True	True
6257	[[0.9424318]]	Ekiga is full-featured SIP and H.323 compatible VoIP, IP-Telephony and Videoconferencing application that allows you to make audio and video calls to remote users with SIP and H.323 hardware or software.	Ekiga সম্পূৰ্ণ-বৈশিষ্ট্যৰ SIP আৰু H.323 সংগত VoIP, IP-Telephony আৰু ভিডিঅ' কনফাৰেঞ্চিং এপ্লিকেচন যি আপোনাক SIP আৰু H.323 হাৰ্ডৱেৰ অথবা চফ্টৱেৰৰ সৈতেদূৰৱৰ্তী ব্যৱহাৰকাৰীসমূহলৈ অডিঅ' আৰু ভিডিঅ' কল কৰাৰ অনুমতি দিয়ে।	0.9424318	True	True
6283	[[0.9188322]]	Unable to get the '%s' key inside the dictionary source definition file: %s	অভিধান উৎসেৰ সংজ্ঞাৰ নথিপত্ৰত '%s' চাবি প্ৰাপ্ত কৰিবলৈ ব্যৰ্থ: %s	0.9188322	True	True
6284	[[0.9397876]]	Main window size and position in the form (width, height, xpos, ypos)	ফৰ্মত মূখ্য উইন্ডোৰ আকাৰ আৰু অৱস্থান (প্ৰস্থ, উচ্চতা,xpos, ypos)	0.9397876	True	True
