idx	las	src	tgt	las_score_dbl	src_gt_8_words	tgt_gt_8_words
50894	[[0.9466852]]	The VPN connection '%s' failed because the VPN service stopped unexpectedly.	VPN সেৱা অপ্ৰত্যাশিতভাবে বন্ধ হোৱাৰ ফলত VPN সংযোগ '%s' বিফল হৈছে।	0.9466852	True	True
51068	[[0.9235804]]	You have deleted your Primary Password. { pp-empty-warning }	আপুনি আপোনাৰ প্ৰাথমিক পাছৱৰ্ড মচি পেলাইছে। { pp-empty-warning }	0.9235804	True	True
51221	[[0.9175548]]	The deceased could not be identified as yet.	আনহাতে নিহত এজনক এতিয়ালৈ চিনাক্ত কৰিব পৰা হোৱা নাই।	0.9175548	False	True
51282	[[0.9164337]]	The cause of his death is not known.	অৱশ্যে তেওঁৰ মৃত্যুৰ কাৰণ জানিব পৰা হোৱা নাই ৷	0.9164337	False	True
51473	[[0.9183645]]	The STUN server to use for STUN Support. STUN is a technology that permits passage through some types of NAT gateway	STUN সমৰ্থনৰ কাৰণে ব্যৱহাৰ কৰিব লগা STUN চাৰ্ভাৰ। STUN এটা প্ৰযুক্তিবিদ্যা যি কিছু NAT গেইটৱেৰ মাজেদি যাব দিয়ে	0.9183645	True	True
51586	[[0.90978277]]	The Constitution Amendment Bill needs to be approved by two-third majority of both Houses of Parliament.	অৱশ্যে সংবিধান সংশোধনী বিধেয়ক খন সংসদৰ উভয় সদনত দুই তৃতীয়াংশ সংখ্যাগৰিষ্ঠতাৰে গৃহীত কৰিব লাগিব।	0.90978277	True	True
51589	[[0.924732]]	Use the button on the toolbar to add more world locations	অধিক বিশ্বৰ অৱস্থানসমূহ যোগ কৰিবলৈ টুলবাৰত বুটাম ব্যৱহাৰ কৰক	0.924732	True	True
51690	[[0.90915954]]	Renewal of Agreement for Scientific and Technological Cooperation between Government of India and the European Union	ভাৰত চৰকাৰ আৰু ইউৰোপীয় ইউনিয়নৰ মাজত বিজ্ঞান আৰু প্ৰযুক্তিবিদ্যাৰ ক্ষেত্ৰত সহযোগিতাৰ বাবে কৰা চুক্তি নবীকৰণ	0.90915954	True	True
52025	[[0.95258605]]	Log In / Sign Up with { $company } email	{ $company } ইমেইলেৰে লগ ইন / ছাইন আপ কৰক	0.95258605	True	True
52147	[[0.9006367]]	It includes built-in search. The bar at the top of the help browser is a , and relevant results will start appearing as soon as you start typing.	ই বিল্ট-ইন সন্ধান অন্তৰ্ভুক্ত কৰে। সহায় ব্ৰাউছাৰৰ ওপৰত থকা বাৰ হল এটা , আৰু আপুনি টাইপ কৰা আৰম্ভ কৰাৰ লগে লগে প্ৰাসংগিক ফলাফলসমূহ উপস্থিত হোৱা আৰম্ভ হব।	0.9006367	True	True
52271	[[0.9233615]]	Internally used to store the last session presence status for the user. The value here is from the GsmPresenceStatus enumeration.	ব্যৱহাৰকাৰীৰ বাবে সৰ্বশেষ অধিবেশন উপস্থিতি অৱস্থা সংৰক্ষণ কৰাৰ বাবে অভ্যন্তৰীয়ভাৱে ব্যৱহৃত। ইয়াত থকা মান GsmPresenceStatus ইনুমাৰেষণৰ পৰা উপলব্ধ।	0.9233615	True	True
52280	[[0.90777504]]	Do you want to add this file to the current archive or open it as a new archive?	এই নথিপত্ৰক বৰ্তমান আৰ্কাইভত যোগ কৰিব নে তাক নতুন আৰ্কাইভ ৰূপে খোলিব বিচাৰে?	0.90777504	True	True
52368	[[0.93083745]]	Today on this occasion the scientists have been conferred with the National Award.	আজি এই উপলক্ষে বৈজ্ঞানিকসকলক ৰাষ্ট্ৰীয় পুৰষ্কাৰ প্ৰদান কৰি সন্মানিত কৰা হৈছে।	0.93083745	True	True
52385	[[0.9129258]]	"""List of active plugins. It doesn't contain the """"Location"""" of the active plugins. See the .eog-plugin file for obtaining the """"Location"""" of a given plugin."""	"""সক্ৰিয় প্লাগিনসমূহৰ তালিকা। ইয়াত সক্ৰিয় প্লাগিনৰ """"অৱস্থান"""" নাথাকে। এটা প্লাগিনৰ """"অৱস্থান""""ৰ কাৰণে .eog-plugin নথিপত্ৰ চাওক।"""	0.9129258	True	True
52484	[[0.90722704]]	Narendra Singh Tomar: Minister of Agriculture and Farmers Welfare, Rural Development & Panchayati Raj	নৰেন্দ্ৰ সিং টোমৰ : কৃষি আৰু কৃষক কল্যাণ, গ্ৰামীণ বিকাশ আৰু পঞ্চাতীৰাজ মন্ত্ৰণালয়	0.90722704	True	True
52517	[[0.9496665]]	On Android this is an alternative name for appBuildID.	Android ত ই appBuildID ৰ বাবে এটা বিকল্প নাম।	0.9496665	True	True
52662	[[0.90694785]]	Connect to a remote computer or shared disk	দূৰবৰ্তী কমপিউটাৰ অথবা শেয়াৰ কৰা ডিস্কেৰ সৈতে সংযোগ কৰক	0.90694785	False	True
52767	[[0.9243984]]	From the list of available Wi-Fi networks, select the network you want to connect to, and click to confirm.	উপলব্ধ Wi-Fi নেটৱাৰ্কসমূহৰ তালিকাৰ পৰা, আপুনি সংযোগ কৰিব বিচৰা নেটৱাৰ্ক বাছক, আৰু সুনিশ্চিত কৰিবলৈ ক্লিক কৰক।	0.9243984	True	True
52936	[[0.9232253]]	This build of gdk-pixbuf does not support saving the image format: %s	gdk-pixbuf ৰ এই নিৰ্মাণে ছবিৰ বিন্যাস সংৰক্ষণ কৰাৰ সমৰ্থন নিদিয়ে: %s	0.9232253	True	True
53036	[[0.9351108]]	The GtkActionGroup this GtkAction is associated with, or NULL (for internal use).	এই GtkAction-টো যি GtkActionGroup ৰ সৈতে সংশ্লিষ্ট, বা NULL (ভিতৰুৱা ভাবে ব্যৱহাৰ কৰিব লগা) ।	0.9351108	True	True
53055	[[0.9142724]]	Dead and injured persons are yet not identified.	বৰ্তমানলৈকে নিহত আৰু আহত ব্যক্তিৰ পৰিচয় জানিব পৰা হোৱা নাই।	0.9142724	False	True
53078	[[0.90453756]]	Permission denied for (document.domain=) to set property %2$S.%3$S on (document.domain has not been set).	(document.domain সংহতি কৰা হোৱা নাই) ত সম্পত্তি %2$S.%3$S সংহতি কৰিবলে (document.domain=) ক অনুমতি নাকচ কৰা হৈছে।	0.90453756	True	True
53114	[[0.9308164]]	There is not enough room on the disk to save %S.\n\nRemove unnecessary files from the disk and try again, or try saving in a different location.	%S সংৰক্ষণ কৰিবলৈ ডিষ্কত পৰ্যাপ্ত স্থান নাই।\n\nপ্ৰয়োজন নোহোৱা ফাইলক ডিষ্কৰ পৰা আঁতৰাই পুনঃ চেষ্টা কৰক, বা অন্য স্থানত সংৰক্ষণ কৰাৰ চেষ্টা কৰক।	0.9308164	True	True
53140	[[0.91419137]]	You have been asked to trust a new Certificate Authority (CA).	আপোনাক এটা নতুন প্ৰমাণপত্ৰৰ কৰ্ত্তৃপক্ষক (CA) বিশ্বাস কৰিবলৈ অনুৰোধ কৰা হৈছে।	0.91419137	True	True
53363	[[0.9484547]]	The newspaper was published in Gujarati, Hindi, Tamil and English.	বাতৰি কাকতখন গুজৰাটী, হিন্দী, তামিল আৰু ইংৰাজীত প্ৰকাশিত হৈছিল।	0.9484547	True	True
53370	[[0.9127553]]	But no one has been arrested so far.	কিন্তু আৰক্ষীয়ে বৰ্তমানলৈ ইয়াৰে কোনো এজনক গ্ৰেপ্তাৰ কৰা নাই।	0.9127553	False	True
53400	[[0.9179563]]	%1$S has been disabled due to security or stability issues.	%1$S ক সুৰক্ষা অথবা স্থিৰতা বিষয়সমূহৰ কাৰণে অসামৰ্থবান কৰা হৈছে।	0.9179563	True	True
53438	[[0.90133214]]	The mole (symbol: mol) is the unit of measurement for amount of substance in the International System of Units (SI).	ম'ল (ইংৰাজী: mole) হৈছে আন্তৰ্জাতিক একক পদ্ধতিত (SI) কোনো বস্তুত থকা পদাৰ্থৰ পৰিমানৰ আধাৰ একক।	0.90133214	True	True
53440	[[0.90225077]]	PM thanks members of all parties on the passage of GST Bill in Rajya Sabha	ৰাজ্যসভাত জিএছটি বিধেয়ক অনুমোদিত হোৱাত সকলো দলৰ সাংসদকে প্ৰধানমন্ত্ৰীৰ ধন্যবাদ জ্ঞাপন	0.90225077	True	True
53517	[[0.90350926]]	%1$S automatically sends some data to %2$S so that we can improve your experience.	%1$S এ স্বচালিতভাৱে কিছুমান তথ্য %2$S লে পঠায় যাতে আমি আপোনাৰ অনুভৱ উন্নত কৰিব পাৰো।	0.90350926	True	True
53531	[[0.9031642]]	If enabled, gnome-session will prompt the user before ending a session.	সক্ৰিয় থাকিলে, অধিবেশন সমাপ্ত কৰাৰ আগতে gnome-session এ ব্যৱহাৰকৰ্তাক প্ৰমপ্ট কৰিব ।	0.9031642	True	True
53638	[[0.91403395]]	"""Find an _item to add to """"%s"""":"""	"""""""%s"""" লৈ যোগ কৰাৰ বাবে এটা বস্তু অনুসন্ধান কৰক (_i):"""	0.91403395	False	True
53667	[[0.9257913]]	You have added a security exception for this site.	আপুনি এই ছাইটৰ বাবে এটা সুৰক্ষা ব্যতিক্ৰম যোগ কৰিছে।	0.9257913	True	True
53808	[[0.91101193]]	It was initially a small private residence but grew bigger during the construction.	প্ৰথমাৱস্থাত এইটো আছিল এটা সৰু ব্যক্তিগত বাসগৃহ, কিন্তু নিৰ্মাণৰ সময়ছোৱাত ই ডাঙৰ হৈ পৰে।	0.91101193	True	True
53814	[[0.92310333]]	No person has been arrested so far in the case.	ঘটনা সন্দৰ্ভত বৰ্তমানলৈ কোনো ব্যক্তিক আটক কৰা হোৱা নাই।	0.92310333	True	True
53823	[[0.91966146]]	The deceased have not been identified yet.	নিহত লোক কেইজনক বৰ্তমানো চিনাক্ত কৰিব পৰা হোৱা নাই ।	0.91966146	False	True
53845	[[0.90455735]]	More than 150 Indian companies are operating in South Africa.	১৫০ৰো অধিক ভাৰতীয় কোম্পানীয়ে দক্ষিণ আফ্ৰিকাত কাম কৰি আছে৷	0.90455735	True	True
53909	[[0.9382733]]	You should have received a copy of the GNU General Public License along with Evince. if not, write to the Free Software Foundation, Inc., 51 Franklin Street, Fifth Floor, Boston, MA 02110-1301 USA	আপুনি Evince -ৰ সৈতে GNU General Public License -ৰ এটা কপি পাব লাগে. যদি নাই পোৱা, Free Software Foundation, Inc., 51 Franklin Street, Fifth Floor, Boston, MA 02110-1301 USA -লে লিখক	0.9382733	True	True
53995	[[0.9071188]]	Then in a pan heat oil and put mustard.	তাৰপিছত কেৰাহী এটা গেছত গৰম হবলৈ দিব আৰু তাত তেল দি দিব।	0.9071188	True	True
54075	[[0.91059667]]	India never started a war with Pakistan, he says.	পাকিস্তানে ভাৰতৰ সৈতে কেতিয়াও যুদ্ধ আৰম্ভ নকৰে বুলিও খানে উল্লেখ কৰে।	0.91059667	True	True
54089	[[0.9323647]]	"""The type of this panel object. Possible values are """"drawer-object"""", """"menu-object"""", """"launcher-object"""", """"bonobo-applet"""", """"action-applet"""" and """"menu-bar""""."""	"""পেনেলৰ বস্তুৰ প্ৰকৃতি । এই সম্ভাব্য মান """"drawer-object"""", """"menu-object"""", """"launcher-object"""", """"bonobo-applet"""", """"action-applet"""" আৰু """"menu-bar""""."""	0.9323647	True	True
54125	[[0.9238057]]	The driver and conductor of the truck fled from the spot after the accident.	দুৰ্ঘটনা সংঘটিত হোৱাৰ পিছতে ট্ৰাকখনৰ চালক আৰু হেণ্ডিমেনে ঘটনাস্থলীৰ পৰা পলায়ন কৰে।	0.9238057	True	True
54254	[[0.912016]]	Sometimes this can be dangerous.	‌ কেতিয়াবা এই অৱস্থা অতিশয় বিপদজনক হ’ব পাৰে ।	0.912016	False	True
54322	[[0.9196191]]	They cannot eat any meat and alcohol is totally prohibited.	তেওঁলোকে কোনো ধৰণৰ মাংস খাৱলৈ নোৱাৰে আৰু মদ্যপান তেওঁলোকৰ বাবে সম্পূৰ্ণ নিষিদ্ধ।	0.9196191	True	True
54324	[[0.94362086]]	"""The file """"%s"""" was previously saved as plain text and will now be saved using compression."""	"""""""%s"""" ফাইলটো পূৰ্বতে সমতল লিখনী হিচাপে সংৰক্ষণ কৰা হৈছিল আৰু এতিয়া সংকোচন ব্যৱহাৰ কৰি সংৰক্ষণ কৰা হ'ব।"""	0.94362086	True	True
54421	[[0.9031324]]	He also appealed everyone to maintain social distancing.	লগতে তেওঁ সকলোকে সামাজিক দূৰত্ব বৰ্তাই ৰাখিবলৈও আহ্বান জনায়।	0.9031324	False	True
54439	[[0.90814346]]	Lookup failed for hostname '%s': no suitable resources found	হস্টনাম '%s' সন্ধান কৰিবলৈ ব্যৰ্থ: উপযুক্ত সম্পদ পোৱা নাযায়	0.90814346	True	True
54517	[[0.92102706]]	System is restarting, please wait ...	ব্যৱস্থাপ্ৰণালী পুনৰায় আৰম্ভ কৰা হচ্ছে, অনুগ্ৰহ কৰে অপেক্ষা কৰক ...	0.92102706	False	True
54519	[[0.93992203]]	"""Toolbar style. Allowed values are """""""" (use GNOME default style), """"both"""" (text and icons), """"both-horiz"""" (text besides icons), """"icons"""", and """"text""""."""	"""টুলবাৰ শৈলী। অনুমোদিত মানসমূহ হল """""""" (GNOME অবিকল্পিত শৈলী ব্যৱহাৰ কৰক), """"both"""" (লিখনী আৰু আইকনসমূহ), """"both-horiz"""" (আইকনৰ লগতে লিখনী), """"আইকনসমূহ"""", আৰু """"লিখনী"""""""	0.93992203	True	True
54567	[[0.9112557]]	The music industry includes the individuals who create new songs and musical pieces (such as songwriters and composers), individuals who perform music (which include orchestra, jazz band and rock band musicians, singers and conductors), individuals who record music (music producers and sound engineers), individuals who organize concert tours, and individuals who sell recordings, sheet music, and scores to customers.	সংগীত শিল্পত এনে ব্যক্তিসকলৰ অন্তৰ্ভুক্ত আছে যিসকল নতুন গীত বা বাদ্যযন্ত্ৰ তৈয়াৰ কৰে (যেনে গীতিকাৰ আৰু সুৰকাৰ), সংগীত পৰিৱেশনকাৰী ব্যক্তি (যাৰ মাজত অৰ্কেষ্ট্ৰা, জাজ বেণ্ড আৰু ৰক বেণ্ড সংগীতশিল্পী, গায়ক আৰু কণ্ডাক্টৰ অন্তৰ্ভুক্ত), সংগীত ৰেকৰ্ডকাৰী ব্যক্তি (সংগীত প্ৰযোজক আৰু শব্দ অভিযন্তা), কনচাৰ্ট ভ্ৰমণৰ ব্যৱস্থা কৰে আৰু গ্ৰাহকসকলৰ ওচৰত ৰেকৰ্ডিং, শীট সংগীত আৰু স্কোৰ বিক্ৰী কৰে।	0.9112557	True	True
54600	[[0.9010657]]	It takes less than a minute and feels great.	ই এক মিনিটতকৈও কম সময় লয় আৰু অনুভুতিও সুখকৰ।	0.9010657	True	True
54749	[[0.92057526]]	MoU between India and Bangladesh on cooperation in the field of Fisheries	মৎস্য ক্ষেত্ৰৰ সহযোগিতাৰ সন্দৰ্ভত ভাৰত আৰু বাংলাদেশৰ মাজত বুজাবুজি চুক্তি স্বাক্ষৰ	0.92057526	True	True
54896	[[0.9211527]]	"""Name of the font to use for the text body (e.g. """"Monospace 10"""")"""	"""লিখনী অংশৰ বাবে ব্যৱহাৰ কৰিব লগিয়া ফন্টৰ নাম (যেনে """"Monospace 10"""")"""	0.9211527	True	True
55200	[[0.90953916]]	Our government has taken several steps to improve the business environment.	আমাৰ চৰকাৰে বাণিজ্যিক পৰিবেশ উন্নত কৰাৰ বাবে বিভিন্ন ধৰণৰ পদক্ষেপ গ্রহণ কৰিছে।	0.90953916	True	True
55352	[[0.9120625]]	If no connection information is listed in the list, or if you want to set up a new connection, click .	যদি তালিকাত কোনো সংযোগ তথ্য নাই, অথবা আপুনি এটা নতুন সংযোগ সংস্থাপন কৰিব বিচাৰে, ক্লিক কৰক।	0.9120625	True	True
55436	[[0.93514484]]	Conflicting options: --window and --area should not be used at the same time.	দ্বন্দ্বপূৰ্ণ বিকল্প: --window আৰু --area বিকল্প দুটা একেলগে ব্যৱহাৰ কৰা নাযাব ।	0.93514484	True	True
55470	[[0.9474173]]	fault: no request found for PDA %d, request %d	fault: PDA %d ৰ কোনো অনুৰোধ পোৱা নাযায়, অনুৰোধ %d	0.9474173	True	True
55605	[[0.9078036]]	No untoward incident was reported.	কোনো ধৰণৰ অপ্ৰীতিকৰ ঘটনা ঘটাৰ বাতৰি পোৱা হোৱা নাই।	0.9078036	False	True
55969	[[0.94859207]]	A web application named '%s' already exists. Do you want to replace it?	'%s' নামৰ এটা ৱেব এপ্লিকেচন ইতিমধ্যে অস্তিত্ববান। আপুনি ইয়াক প্ৰতিস্থাপন কৰিব বিচাৰে নে?	0.94859207	True	True
55984	[[0.93379664]]	Wi-Fi needs to be turned on in order to connect to a network.	এটা নেটৱাৰ্কৰ সৈতে সংযোগ কৰিবলে Wi-Fi অন কৰিব লাগিব।	0.93379664	True	True
55991	[[0.92245424]]	If true, newly created terminal windows will have custom size specified by default_size_columns and default_size_rows.	যদি সত্য, নতুনকে সৃষ্টি কৰা টাৰ্মিনেল উইন্ডোসমূহৰ default_size_columns and default_size_rows ৰে ধাৰ্য্য কৰা স্বনিৰ্বাচিত আকাৰ থাকিব।	0.92245424	True	True
56065	[[0.9151546]]	One person was injured in the accident.	দুৰ্ঘটনাত এজন লোকে প্ৰাণ হেৰুৱাৰ লগতে আহত হয় এজন লোক।	0.9151546	False	True
56129	[[0.9159564]]	{ -brand-short-name } is being updated by another instance	{ -brand-short-name } ক অন্য এটা উদাহৰণ দ্বাৰা আপডেইট কৰা হৈ আছে	0.9159564	True	True
56401	[[0.9288999]]	Do you want to add this file to the current archive or open it as a new archive?	এই ফাইলক বৰ্তমান আৰ্কাইভত যোগ কৰিব নে তাক নতুন আৰ্কাইভ ৰূপে খোলিব বিচাৰে?	0.9288999	True	True
56463	[[0.9172447]]	Both the countries will get benefited by joint activities and mutual exchange of scientific delegations and experts in the field of water resources development and management.	উভয় দেশেই জল সম্পদৰ উন্নয়ন আৰু ব্যৱস্থাপনা খণ্ডৰ লগত জড়িত যৌথ কাম-কাজৰ লগতে বৈজ্ঞানিক প্ৰতিনিধি আৰু বিশেষজ্ঞৰ পাৰস্পৰিক বিনিময়ৰ জৰিয়তে লাভান্বিত হ’ব।	0.9172447	True	True
56590	[[0.9111782]]	National Centre for Biological Sciences (NCBS) in Bangalore, Karnataka, is a research centre specialising in biological research.	ৰাষ্ট্ৰীয় জীৱবিজ্ঞান কেন্দ্ৰ (ইংৰাজী: National Centre for Biological Sciences), চমুকৈ NCBS,কৰ্ণাটকৰ বাংগালোৰত অৱস্থিত জীৱবিজ্ঞানৰৰ গৱেষণাৰ বাবে বিশেষীকৃত এটি গৱেষণা কেন্দ্ৰ।	0.9111782	True	True
56609	[[0.90602386]]	Besides, business leaders from BIMSTEC countries (Bangladesh, Bhutan, Myanmar, Nepal, Sri Lanka and Thailand) have been invited for meetings and discussions with the BRICS business leaders and companies at the Trade Fair.	তদুপৰি BRICS বাণিজ্য মেলাত BRICS ৰ অন্তৰ্গত দেশসমূহৰ নেতাসকলৰ লগত আলোচনাত বহিবৰ বাবে BIMSTEC (বাংলাদেশ, ভূটান, ম্যানমাৰ, নেপাল, শ্ৰীলঙ্কা আৰু থাইলেণ্ড) দেশসমূহৰ বাণিজ্যৰ লগত জড়িত নেতাসকলকো আমন্ত্ৰণ জনোৱা হৈছে।	0.90602386	True	True
56612	[[0.90269136]]	The GDM user should not be root. Aborting!	GDM ৰ ব্যৱহাৰকৰোঁতা root হ'ব নোৱাৰে । চেষ্টা বাতিল কৰা হৈছে!	0.90269136	False	True
56867	[[0.9322473]]	This organization works to promote the welfare of sexual minorities, their support and development.	এই সংগঠনটোৱে যৌন সংখ্যালঘুসকলৰ কল্যাণ, তেওঁলোকৰ সমৰ্থন আৰু বিকাশৰ প্ৰচাৰৰ বাবে কাম কৰে।	0.9322473	True	True
57048	[[0.9063979]]	Two people were killed in the accident, while 4 others sustained injuries.	দুৰ্ঘটনাত ৪জন লোকৰ মৃত্যু হোৱাৰ বিপৰীতে আন দুজন লোক গুৰুতৰভাৱে আহত হৈছিল।	0.9063979	True	True
57055	[[0.90669227]]	The crash is suspected to have been caused by mechanical issues.	যান্ত্ৰিক বিজুতিৰ বাবেই এই দুৰ্ঘটনা সংঘটিত হোৱাৰ সন্দেহ কৰা হৈছে।	0.90669227	True	True
57183	[[0.922184]]	Are you sure you want to use the disks for a RAID array?	আপুনি এটা RAID এৰেৰ বাবে ডিস্কসমূহ ব্যৱহাৰ কৰিবলে নিশ্চিত নে?	0.922184	True	True
57205	[[0.9322989]]	Knowing your IP address can help you troubleshoot network problems.	আপোনাৰ IP ঠিকনা জানিলে নেটৱাৰ্ক সমস্যাসমূহ সমাধান কৰোতে সহায় হব।	0.9322989	True	True
57219	[[0.9079722]]	His father was Manik Chandra Neog and mother Chandraprabha Neog.	তেখেতৰ পিতৃৰ নাম আছিল মাণিক চন্দ্ৰ নেওগ আৰু মাতৃৰ নাম চন্দ্ৰপ্ৰভা নেওগ।	0.9079722	True	True
