idx	las	src	tgt	las_score_dbl	src_gt_8_words	tgt_gt_8_words
16	[[0.93130046]]	The police stated a case has been registered and further investigations were on.	ପୋଲିସ ଏ ନେଇ ମାମଲା ଦାୟର କରି ଅଧିକ ତଦନ୍ତ ଜାରି ଥିବା ସୂଚନା ଦେଇଛନ୍ତି।	0.93130046	True	True
33	[[0.9079262]]	Dr Bhoodes, who was on Odisha visit, met Secretary MSME, Hemant Sharma, Principal Secretary Agriculture, Saurabh Garg and other senior officials.	ଓଡିଶା ଗସ୍ତରେ ଥିବା ଶ୍ରୀ ଭୁଦେଶ ଏମ୍‍ଏସ୍‍ଏମ୍‍ଇ ସଚିବ ହେମନ୍ତ ଶର୍ମା, କୃଷି ବିଭାଗର ପ୍ରମୁଖ ସଚିବ ସୌରଭ ଗର୍ଗ ଏବଂ ଅନ୍ୟ ବରିଷ୍ଠ ଅଧିକାରୀମାନଙ୍କୁ ଭେଟିଛନ୍ତି ।	0.9079262	True	True
115	[[0.9092449]]	The wedding was attended by only family and close friends.	ବିବାହରେ କେବଳ ପରିବାର ଲୋକ ଏବଂ କିଛି ନିକଟ ସମ୍ପର୍କୀୟ ବନ୍ଧୁ ସାମିଲ ହୋଇଥିଲେ।	0.9092449	True	True
121	[[0.9103717]]	In Myanmar even today, Ramayana is presented by the name of Yama.	ମିଆଁମାରରେ ଆଜି ମଧ୍ୟ ରାମାୟଣକୁ ୟାମା ନାଁରେ ଉପସ୍ଥାପିତ କରାଯାଉଛି ।	0.9103717	True	True
132	[[0.9012846]]	Among them were six women and children.	ସେମାନଙ୍କ ମଧ୍ୟରେ ରହିଛନ୍ତି ଛଅ ଜଣ ମହିଳା ଓ ଛଅ ଜଣ ପିଲା ।	0.9012846	False	True
171	[[0.91966283]]	He died while undergoing treatment at a private hospital in Hyderabad.	ହାଇଦ୍ରାବାଦର ଏକ ଘରୋଇ ହସ୍ପିଟାଲରେ ଚିକିତ୍ସାଧିନ ଅବସ୍ଥାରେ ତାଙ୍କର ମୃତ୍ୟୁ ଘଟିଛି।	0.91966283	True	True
198	[[0.91885495]]	No passengers were reported injured in the incident.	ଏହି ଦୁର୍ଘଟଣାରେ କୌଣସି ଯାତ୍ରୀ ଆଘାତପ୍ରାପ୍ତ ହୋଇ ନଥିବା ଜାଣିବାକୁ ମିଳିଛି।	0.91885495	False	True
288	[[0.9102241]]	I am confident that when we observe Independence Day in 2022, we will try to give a pucca home to everyone. Speaking further on provision of homes, the PM said: Interest exemption on home loans up to 1.5 lakh rupees has been provided, so that the middle class can have their homes.	ମୋର ବିଶ୍ୱାସ ଯେ 2022ରେ ଯେତେବେଳେ ଆମେ ଆମର ସ୍ୱାଧୀନତା ଦିବସ ପାଳନ କରୁଥିବା, ଆମେ ସମସ୍ତଙ୍କୁ ଏକ ପକ୍କା ଘର ପ୍ରଦାନ କରିବାର ଚେଷ୍ଟା କରିବା ।” ଘର ସମ୍ବନ୍ଧୀୟ ବ୍ୟବସ୍ଥା ଉପରେ ପୁନଶ୍ଚ ପ୍ରକାଶ କରି ପ୍ରଧାନମନ୍ତ୍ରୀ କହିଲେ, “1.5 ଲକ୍ଷ ଗୃହ ଋଣ ଉପରେ ଋଣ ମୁକ୍ତି ଉପଲବ୍ଧ କରାଯାଇଛି, ଯାହା ଫଳରେ କି ମଧ୍ୟମବର୍ଗଙ୍କ ପାଖରେ ସେମାନଙ୍କ ଘର ଥିବ ।	0.9102241	True	True
337	[[0.925013]]	He has no social media account or email id.	ତାଙ୍କର ଇ-ମେଲ୍ ଠିକଣା ନାହିଁ କି ସୋସିଆଲ ମିଡିଆରେ ଆକାଉଣ୍ଟ ନାହିଁ ।	0.925013	True	True
436	[[0.92410326]]	Chidambaram is facing probe in the INX media case by both the ED and the CBI.	ଆଇଏନଏକ୍ସ ମିଡିଆ ଦୂର୍ନୀତି ମାମଲାରେ ଚିଦାମ୍ବରମଙ୍କ ବିରୋଧରେ ଉଭୟ ଇଡି ଓ ସିବିଆଇ ତଦନ୍ତ କରୁଛନ୍ତି।	0.92410326	True	True
474	[[0.9271771]]	"""He recognised the folk arts and traditional dances as indicative of Indian culture,"""" PM said."""	“ସେ ଭାରତୀୟ ଲୋକ କଳା ଏବଂ ପାରମ୍ପରିକ ନୃତ୍ୟକୁ ସଂସ୍କୃତିର ସଂକେତ ରୂପରେ ମାନ୍ୟତା ଦେଇଛନ୍ତି”, ପ୍ରଧାନମନ୍ତ୍ରୀ କହିଥିଲେ ।	0.9271771	True	True
478	[[0.90845805]]	He is married and has a 10-year-old child.	ସେ ବିବାହିତ ଓ ତାଙ୍କର ୧୦ ବର୍ଷର ଝିଅ ବି ଅଛିି।	0.90845805	False	True
493	[[0.9085319]]	Prime Minister Shri Narendra Modi dedicated the National Salt Satyagraha Memorial at Dandi in Navsari district, Gujarat to the nation today on Mahatma Gandhis death anniversary.	ପ୍ରଧାନମନ୍ତ୍ରୀ ଶ୍ରୀ ନରେନ୍ଦ୍ର ମୋଦୀ ମହାତ୍ମା ଗାନ୍ଧୀଙ୍କ ପୁଣ୍ୟତିଥିରେ ଆଜି ଗୁଜରାଟର ନବସାରୀ ଜିଲ୍ଲାରେ ଦାଣ୍ଡିସ୍ଥିତ ରାଷ୍ଟ୍ରୀୟ ଲବଣ ସତ୍ୟାଗ୍ରହ ସ୍ମାରକୀକୁ ରାଷ୍ଟ୍ର ଉଦ୍ଦେଶ୍ୟରେ ସମର୍ପିତ କରିଛନ୍ତି ।	0.9085319	True	True
534	[[0.9015596]]	New Zealand squad: Kane Williamson (captain), Todd Astle, Trent Boult, Colin de Grandhomme, Lockie Ferguson, Martin Guptill, Matt Henry, Tom Latham, Colin Munro, Jimmy Neesham, Henry Nicholls, Ross Taylor, Mitchell Santner, Tim Southee.	ନ୍ୟୁଜିଲାଣ୍ଡ୍‌ ଦଳ: କେନ୍‌ ଓ୍ଵିଲିୟମ୍‌ସନ୍‌ (ଅଧିନାୟକ), ଟମ୍‌ ବ୍ଲଣ୍ଡେଲ୍‌ (ଓ୍ଵିକେଟ୍‌ରକ୍ଷକ), ଟ୍ରେଣ୍ଟ୍‌ ବୋଲ୍‌ଟ, ଟମ୍‌ ବ୍ରୁସ୍‌, କଲିନ୍‌ ଡି ଗ୍ରାଣ୍ଡୋମେ, ମାର୍ଟିନ୍‌ ଗପ୍ଟିଲ, ଅନାରୁ କିଚେନ୍‌, କଲିନ୍‌ ମୁନ୍‌ରୋ, ସେଥ୍‌ ରାନ୍‌ସ, ମିଚେଲ ସାଣ୍ଟ୍‌ନର୍‌, ଇଶ୍‌ ସୋଢ଼ି, ଟିମ୍‌ ସାଉଥି, ରସ୍‌ ଟେଲର, ବେନ୍‌ ହ୍ଵିଲର୍‌।	0.9015596	True	True
537	[[0.91194975]]	New Delhi: A video is getting viral on social media.	ନୂଆଦିଲ୍ଲୀ: ସୋସିଆଲ ମିଡିଆରେ ଏକ ଆଶ୍ଚର୍ଯ୍ୟଜନକ ଭିଡିଓ ଭାଇରାଲ ହେବାରେ ଲାଗିଛି।	0.91194975	True	True
573	[[0.9063891]]	The police took him into custody for further interrogation.	ଏ ନେଇ ଅଧିକ ଜେରା ପାଇଁ ପୋଲିସ ତାଙ୍କୁ ରିମାଣ୍ଡରେ ନେଇଛି।	0.9063891	True	True
577	[[0.9214439]]	Mix everything till it is well combined.	ସମସ୍ତ ଜିନିଷ ଭଲ ଭାବେ ମିକ୍ସ ହେଲା ଯାଏ ଏହାକୁ ଗୋଳାନ୍ତୁ ।	0.9214439	False	True
632	[[0.90616685]]	The truck was impounded and the driver arrested.	ଦୁର୍ଘଟଣା ଘଟାଇଥିବା ଟ୍ରକ୍‌କୁ ଜବତ କରାଯିବା ସହ ଚାଳକକୁ ଗିରଫ କରାଯାଇଛି।	0.90616685	False	True
703	[[0.9174443]]	The state Government went for appeal against this order in the Supreme Court.	ଏହି ଆଦେଶ ବିରୋଧରେ ରାଜ୍ୟ ସରକାର ସୁପ୍ରିମ୍‌ କୋର୍ଟଙ୍କ ଦ୍ୱାରସ୍ଥ ହୋଇଥିଲେ।	0.9174443	True	True
714	[[0.9032569]]	The MPs will vote on Green ballots and the MLAs will vote on pink ballots.	ସବୁଜ ରଙ୍ଗର ବାଲଟ ପେପରରେ ସାଂସଦ ଓ ଗୋଲାପୀ ରଙ୍ଗର ବାଲଟ ପେପରରେ ବିଧାୟକମାନେ ଭୋଟ ଦେବେ ।	0.9032569	True	True
724	[[0.90947187]]	FIH Goalkeeper of the Year: Rachael Lynch (Australia), Maria Ruiz (Spain), Mathilde Petriaux (France), Ayeisha McFerran (Ireland), Megumi Kageyama (Japan)	ଏଫଆଇଏଚ୍ ଗୋଲକିପର ଅଫ୍ ଦି ଇୟର୍‌: ରାଚେଲ୍ ଲିଞ୍ଚ୍ (ଅଷ୍ଟ୍ରେଲିଆ), ମାରିଆ ରୁଇଜ୍ (ସ୍ପେନ୍‌), ମାଥିଲଡେ ପିଟ୍ରିଅକ୍ସ (ଫ୍ରାନ୍ସ), ଆୟେଶା ମ୍ୟାକଫେରାନ୍ (ଆୟର୍ଲ୍ୟାଣ୍ଡ୍‌), ମେଗୁମି କାଗେୟାମା (ଜାପାନ)।	0.90947187	True	True
736	[[0.9077785]]	There is no vaccine available for either people or animals against the disease, it said.	ଏହି ରୋଗ ବିରୋଧରେ ଲୋକ କିମ୍ବା ପଶୁମାନଙ୍କ ପାଇଁ କୌଣସି ଟୀକା ଉପଲବ୍ଧ ନାହିଁ ବୋଲି ସୂଚନାରେ କୁହାଯାଇଛି।	0.9077785	True	True
779	[[0.90098286]]	Salman, along with Saif Ali Khan, Neelam, Tabu, Sonali Bendre and Dushyant Singh are all accused in the case.	ସଲମାନଙ୍କ ସହ ଏହି ମାମଲାରେ ବଲିଉଡ ଅଭିନେତା ସୈଫ ଅଲ୍ଲୀ ଖାନ, ନିଲମ, ତବୁ, ସୋନାଲି ବେନ୍ଦ୍ରେ ଓ ଦୁଷ୍ୟନ୍ତ ସିଂହ ପ୍ରମୁଖ ଅଭିଯୁକ୍ତ ଥିଲେ।	0.90098286	True	True
786	[[0.9105505]]	Friends, one is getting to see and hear of many such examples day by day.	ବନ୍ଧୁଗଣ, ଏଭଳି ଅନେକ ଉଦାହରଣ, ପ୍ରତିଦିନ ଦେଖିବାକୁ ଓ ଶୁଣିବାକୁ ମିଳୁଛି।	0.9105505	True	True
842	[[0.9057703]]	We have informed it to the higher authorities.	ଏ ସଂପର୍କରେ ଆମେ ଉଚ୍ଚ କର୍ତ୍ତୃପକ୍ଷଙ୍କୁ ଜଣାଇଛୁ ବୋଲି ପ୍ରକାଶ କରିଛନ୍ତି।	0.9057703	False	True
850	[[0.9074486]]	The film is being produced by Oberois father Suresh Oberoi and Sandip Ssingh.	ଫିଲ୍ମ କୁ ବିବେକଙ୍କ ବାପା ସୁରେଶ ଓବରାୟ ଓ ସନ୍ଦୀପ ସିଂ ପ୍ରଡ୍ୟୁସ୍‌ କରୁଛନ୍ତି।	0.9074486	True	True
859	[[0.90186274]]	She has also won several awards for her performances.	ସେ ନିଜ ଅଭିନୟ ପାଇଁ ବହୁଥର ପୁରସ୍କାର ମଧ୍ୟ ଜିତିସାରିଛନ୍ତି ।	0.90186274	True	True
899	[[0.92788154]]	Answer - Firstly, it is important for you to know that no formal initiative like NRC has been started at the national level.	ଉତ୍ତର – ସର୍ବପ୍ରଥେମ ଆପଣଙ୍କୁ ଏହା ଜାଣିବା ଦରକାର ଯେ, ରାଷ୍ଟ୍ରୀୟ ସ୍ତରରେ ଏନ୍‌ଆରସି ପରି କେୌଣସି ଔପଚାରିକ ଆରମ୍ଭ ହୋଇନାହିଁ।	0.92788154	True	True
1001	[[0.92223084]]	The State government and the temple administration are fully ready for the rath yatra.	ରଥଯାତ୍ରା ପାଇଁ ରାଜ୍ୟ ସରକାର ଏବଂ ଶ୍ରୀ ମନ୍ଦିର ପ୍ରଶାସନ ପୂରା ପ୍ରସ୍ତୁତ।	0.92223084	True	True
1030	[[0.9066949]]	There were fourteen persons, all from Maharashtra, in the boat when the incident took place.	ଦୁର୍ଘଟନା ସମୟରେ ମହାରାଷ୍ଟ୍ରରୁ ଆସିଥିବା ଚଉଦ ଜଣ ଲୋକ ଡଙ୍ଗାରେ ଥିଲେ।	0.9066949	True	True
1069	[[0.93371415]]	Rajasthan BJP president and Rajya Sabha MP Madan Lal Saini dies	ବିଜେପିର ରାଜସ୍ଥାନ ରାଜ୍ୟ ସଭାପତି ତଥା ରାଜ୍ୟସଭା ସାଂସଦ ମଦନ ଲାଲ ସୈନୀଙ୍କ ପରଲୋକ	0.93371415	True	True
1140	[[0.9572799]]	The Prime Minister, Shri Narendra Modi, today inaugurated various projects in Junagadh district.	ପ୍ରଧାନମନ୍ତ୍ରୀ ଶ୍ରୀ ନରେନ୍ଦ୍ର ମୋଦୀ ଆଜି ଜୁନାଗଡ଼ ଜିଲ୍ଲାରେ ବିଭିନ୍ନ ପ୍ରକଳ୍ପ ଉଦ୍ଘାଟନ କରିଥିଲେ ।	0.9572799	True	True
1162	[[0.9053395]]	Major Shweta Pandey will assist the Prime Minister in unfurling the National Flag.	ମେଜର ଶ୍ୱେତା ପାଣ୍ଡେ ଜାତୀୟ ପତାକା ଉତୋଳନ ସମୟରେ ପ୍ରଧାନମନ୍ତ୍ରୀଙ୍କୁ ସହାୟତା କରିବେ।	0.9053395	True	True
1192	[[0.91091645]]	Prime Minister's Office Telephonic Conversation between PM and Amir of the State of atar Prime Minister Shri Narendra Modi had a telephonic conversation today with His Highness Sheikh Tamim Bin Hamad al Thani, the Amir of the State of atar.	ପ୍ରଧାନମନ୍ତ୍ରୀଙ୍କ କାର୍ଯ୍ୟାଳୟ ପ୍ରଧାନମନ୍ତ୍ରୀ ଓ କତାରର ଅମିରଙ୍କ ମଧ୍ୟରେ ଟେଲିଫୋନ ବାର୍ତ୍ତାଳାପ ପ୍ରଧାନମନ୍ତ୍ରୀ ଶ୍ରୀ ନରେନ୍ଦ୍ର ମୋଦୀ ଆଜି (ଗୁରୁବାର ଦିନ) କତାର ରାଜ୍ୟର ଅମିର ମହାମହିମ ଶେଖ ତମିମ ବିନ ହମଦ ଅଲ ଥାନିଙ୍କ ସହ ଟେଲିଫୋନ ଯୋଗେ ଆଲୋଚନା କରିଥିଲେ ।	0.91091645	True	True
1204	[[0.9057064]]	The Prime Minister, Shri Narendra Modi, today attended a programme organized by the Banaskantha Cooperative Milk Producers Union (Banas Dairy) at Deesa in Gujarat.	ପ୍ରଧାନମନ୍ତ୍ରୀ ଶ୍ରୀ ନରେନ୍ଦ୍ର ମୋଦୀ ଆଜି (୧୦.୧୨.୨୦୧୬) ଗୁଜରାଟର ଦୀସାଠାରେ ବନସକଣ୍ଠ ସମବାୟ ଦୁଗ୍ଧ ଉତ୍ପାଦକ ୟୁନିୟନ ଦ୍ଵାରା ଆୟୋଜିତ ଏକ କାର୍ଯ୍ୟକ୍ରମରେ ଯୋଗଦେଇଥିଲେ ।	0.9057064	True	True
1264	[[0.91171753]]	Locals spotted the body in the morning and informed police.	ଆଜି ସକାଳେ ସ୍ଥାନୀୟ ଲୋକେ ମୃତଦେହ ଦେଖି ପୋଲିସକୁ ଖବର ଦେଇଥିଲେ ।	0.91171753	True	True
1315	[[0.9263437]]	They immediately informed about it to the fire brigade.	ସେମାନେ ତତକ୍ଷଣାତ ଅଗ୍ନିଶମ ବିଭାଗକୁ ଏ ସମ୍ପର୍କରେ ଖବର ଦେଇଥିଲେ ।	0.9263437	True	True
1323	[[0.9038726]]	During the scuffle, 4 policemen were also injured.	ଗୁଳି ବିନିମୟରେ ୪ ଜଣ ପୁଲିସ୍‌ କର୍ମଚାରୀ ମଧ୍ୟ ଆହତ ହୋଇଛନ୍ତି।	0.9038726	False	True
1326	[[0.9067791]]	These banks include State Bank of India, Punjab National Bank, Union Bank of India and Bank Of Baroda.	ଏହି ଋଣ ପ୍ରଦାନକାରୀ ବ୍ୟାଙ୍କଗୁଡିକରେ ପଞ୍ଜାବ ନ୍ୟାସନାଲ ବ୍ୟାଙ୍କ, ଇଣ୍ଡିଆନ ବ୍ୟାଙ୍କ, ୟୁନିଅନ ବ୍ୟାଙ୍କ ଅଫ ଇଣ୍ଡିଆ, ବ୍ୟାଙ୍କ ଅଫ ବରୋଦା, ମହାରାଷ୍ଟ୍ର ବ୍ୟାଙ୍କ ଏବଂ ବ୍ୟାଙ୍କ ଅଫ ଇଣ୍ଡିଆ ଅନ୍ତର୍ଭୁକ୍ତ ।	0.9067791	True	True
1335	[[0.91248655]]	I express my deepest condolences to his family and friends.	ତାଙ୍କ ପରିବାର ଓ ବନ୍ଧୁପରିଜନଙ୍କ ପ୍ରତି ମୋର ଗଭୀର ସମବେଦନା ରହିଛି।	0.91248655	True	True
1349	[[0.9069646]]	We built homes according to local requirements and wishes of the people.	ଆମେ ସ୍ଥାନୀୟ ଲୋକଙ୍କ ଆବଶ୍ୟକତା ଏବଂ ଜନସାଧାରଣଙ୍କ ଇଚ୍ଛା ଅନୁଯାୟୀ ଗୃହ ନିର୍ମାଣ କରିଛୁ ।	0.9069646	True	True
1360	[[0.934785]]	It also helps to reduce weight.	ଏହା ସହ ଓଜନ କମ କରିବାରେ ମଧ୍ୟ ଏହା ବେଶ ସହାୟକ ହୁଏ ।	0.934785	False	True
1418	[[0.94216955]]	Screenplay for the movie has been written by National Award winning director Hansal Mehta.	ଫିଲ୍ମଟିର ସ୍କ୍ରିପ୍ଟ, ରାଷ୍ଟ୍ରୀୟ ପୁରସ୍କାର ବିଜେତା ନିର୍ଦ୍ଦେଶକ ହଂସଲ ମେହତା ଲେଖିଛନ୍ତି ।	0.94216955	True	True
1428	[[0.9122936]]	Among others, PCC president Niranjan Patnaik and many other senior leaders were present.	ବୈଠକରେ ପିସିସି ସଭାପତି ନିରଞ୍ଜନ ପଟ୍ଟନାୟକଙ୍କ ସମେତ ଅନ୍ୟ ବରିଷ୍ଠ ଅଧିକାରୀ ଉପସ୍ଥିତ ଥିଲେ।	0.9122936	True	True
1559	[[0.9058621]]	Some efforts are being made at the government level also and steps are being taken for the same.	ଆଉ ଏଥିପାଇଁ ସରକାରଙ୍କ ସ୍ତରରେ ମଧ୍ୟ କିଛି ଚେଷ୍ଟା କରାଯାଉଛି, ପଦକ୍ଷେପ ଉଠା ଯାଉଛି ।	0.9058621	True	True
1614	[[0.9235467]]	Cabinet Committee on Economic Affairs (CCEA) Cabinet approves Minimum Support Prices for Raw Jute for 2018-19 season The Cabinet Committee on Economic Affairs, chaired by the Prime Minister Shri Narendra Modi, has given its approval for the increase in the Minimum Support Price (MSP) for Raw Jute for 2018-19 season.	ଆର୍ଥିକ ବ୍ୟାପାର ସଂକ୍ରାନ୍ତ କ୍ୟାବିନେଟ କମିଟି 2018-19 ଋତୁ ପାଇଁ ଅଶୋଧିତ ଝୋଟର ସର୍ବନିମ୍ନ ସହାୟକ ମୂଲ୍ୟ ବୃଦ୍ଧିକୁ କ୍ୟାବିନେଟ ମଞ୍ଜୁରି ପ୍ରଧାନମନ୍ତ୍ରୀ ଶ୍ରୀ ନରେନ୍ଦ୍ର ମୋଦୀଙ୍କ ଅଧ୍ୟକ୍ଷତାରେ ଅନୁଷ୍ଠିତ ଆର୍ଥିକ ବ୍ୟାପାର ସଂକ୍ରାନ୍ତ କ୍ୟାବିନେଟ କମିଟି (ସିସିଇଏ) ଆଜି 2018-19 ଋତୁ ପାଇଁ ଅଶୋଧିତ ଝୋଟର ସର୍ବନିମ୍ନ ସହାୟକ ମୂଲ୍ୟ ବୃଦ୍ଧି ପ୍ରସ୍ତାବକୁ ମଞ୍ଜୁରି ଦେଇଛନ୍ତି ।	0.9235467	True	True
1674	[[0.92430544]]	No complaint has been registered in the incident so far.	ଏଯାବତ୍‌ ଏହି ଘଟଣାକୁ ନେଇ କୌଣସି ଅଭିଯୋଗ ଥାନାରେ ହୋଇ ନାହିଁ।	0.92430544	True	True
1687	[[0.9002727]]	The Prime Minister reiterated his dream that every Indian should have a proper house by 2022, and 1.3 crore houses have been made in his tenure.	ପ୍ରତ୍ୟେକ ଭାରତୀୟଙ୍କୁ 2022 ସୁଦ୍ଧା ଉପଯୁକ୍ତ ଆବାସ ପ୍ରଦାନ କରିବା ଲାଗି ପ୍ରଧାନମନ୍ତ୍ରୀ ତାଙ୍କର ସ୍ୱପ୍ନକୁ ଦୋହରାଇଥିଲେ । ତାଙ୍କର କାର୍ଯ୍ୟକାଳ ସମୟରେ 1.3 କୋଟି ଆବାସ ନିର୍ମାଣ କରାଯାଇଥିବା ସେ କହିଥିଲେ ।	0.9002727	True	True
1736	[[0.9251622]]	Constable Guruveer Singh reportedly strangled his wife Anupriya Gautam to death at his government quarters in CRPF's 201 CoBRA battalion, a senior police officer said.	ସିଆର୍‌ପିଏଫ୍ର ୨୦୧ କୋବ୍ରା ବାଟାଲିୟାନ୍‌ର ସରକାରୀ କ୍ୱାର୍ଟର୍ସରେ କନେଷ୍ଟବଳ ଗୁରୁବୀର ସିଂହ ତାଙ୍କର ପତ୍ନୀ ଅନୁପ୍ରିୟା ଗୌତମଙ୍କୁ ଶ୍ୱାସରୁଦ୍ଧ କରି ହତ୍ୟା କରିଥିବା କଥା ଜଣେ ବରିଷ୍ଠ ପୁଲିସ ଅଧିକାରୀ କହିଛନ୍ତି।	0.9251622	True	True
1774	[[0.91250306]]	Katrina Kaif will be working opposite Akshay Kumar in the film.	କ୍ୟାଟ୍ରିନା କୈଫ୍‌ ଏହି ଫିଲ୍ମରେ ଅକ୍ଷୟ କୁମାରଙ୍କ ବିପକ୍ଷରେ ନଜର ଆସିବାକୁ ଯାଉଛନ୍ତି ।	0.91250306	True	True
1886	[[0.91375864]]	Morari Bapu announces Rs 5 cr donation for construction of Ram Temple at Ayodhya	ଅଯୋଧ୍ୟା ରାମ ମନ୍ଦିର ନିର୍ମାଣ କାର୍ଯ୍ୟ ଲାଗି ମୋରାରୀ ବାପୁଙ୍କ ୫ କୋଟି ଟଙ୍କା ଦାନ ଘୋଷଣା	0.91375864	True	True
1905	[[0.9103714]]	Hindi declared as third official court language in Abu Dhabi	ତୃତୀୟ ଅଫିସିଆଲ ଭାଷା ଭାବେ ଆବୁଧାବି ଅଦାଲତରେ ସାମିଲ ହେଲା ହିନ୍ଦୀ ଭାଷା	0.9103714	True	True
1920	[[0.91073006]]	Rapid work is underway to complete the country's first modern Inland waterway.	ଦେଶର ଏହି ପ୍ରଥମ ଆଧୁନିକ ଆଭ୍ୟନ୍ତରୀଣ ଜଳପଥକୁ ସଂପୂର୍ଣ୍ଣ ଭାବେ ପ୍ରସ୍ତୁତ କରିବା ସକାଶେ ଦ୍ରୁତ ଗତିରେ କାର୍ଯ୍ୟ ଜାରି ରହିଛି ।	0.91073006	True	True
1950	[[0.9016434]]	Former Congress president Rahul Gandhi met migrant labourers.	ନୂଆଦିଲ୍ଲୀ: କଂଗ୍ରେସର ପୂର୍ବତନ ଅଧ୍ୟକ୍ଷ ରାହୁଲ ଗାନ୍ଧୀ ପ୍ରବାସୀ ଶ୍ରମିକଙ୍କ ସହ ସାକ୍ଷାତ କରିଛନ୍ତି ।	0.9016434	False	True
1952	[[0.90872884]]	Pakistan closes its airspace to Indian flights	ଭାରତୀୟ ବିମାନ ଲାଗି ନିଜର ବାୟୁସୀମାକୁ ପୁଣି ବନ୍ଦ କରିବ ପାକିସ୍ତାନ	0.90872884	False	True
1966	[[0.92320573]]	Traffic was disrupted for some time on this road.	ଫଳରେ କିଛି ସମୟ ଧରି ଏହି ରାସ୍ତାରେ ଯାନବାହାନ ଚଳାଚଳ ବାଧାପ୍ରାପ୍ତ ହୋଇଥିଲା।	0.92320573	True	True
2026	[[0.9255223]]	The film stars Salman Khan, Sonakshi Sinha, Saiee Manjrekar, and Sudeep in prominent roles.	ଫିଲ୍ମରେ ସଲମାନ ଖାନ୍‌ଙ୍କ ସହ ସୋନାକ୍ଷୀ ସିହ୍ନା, କିଚ୍ଚା ସୁଦୀପ ଏବଂ ସାଇ ମାଞ୍ଜରେକର ପ୍ରମୁଖ କଳାକାର ମୁଖ୍ୟ ଭୂମିକାରେ ନଜର ଆସିବେ।	0.9255223	True	True
2070	[[0.90381956]]	A case has been registered at the local police station and investigations are on.	ଏ ସମ୍ପର୍କରେ ସ୍ଥାନୀୟ ଥାନାରେ ଏକ ମାମଲା ରୁଜୁ କରାଯାଇ ତଦନ୍ତ ଜାରି ରହିଛି ।	0.90381956	True	True
2086	[[0.9189993]]	Prime Minister Modi is the fourteenth recipient of this award.	ଏହି ପୁରସ୍କାରରେ ସମ୍ମାନିତ ହେବାରେ ପ୍ରଧାନମନ୍ତ୍ରୀ ମୋଦୀ ହେଉଛନ୍ତି ଚତୁର୍ଦ୍ଦଶ ବିଶିଷ୍ଟ ବ୍ୟକ୍ତି।	0.9189993	True	True
2092	[[0.9451768]]	None of the accused has however been arrested so far.	ତେବେ କୌଣସି ଜଣେ ଅଭିଯୁକ୍ତ କୁ ଏଯାଏଁ ଗିରଫ କରାଯାଇନାହିଁ ।	0.9451768	True	True
2203	[[0.9184497]]	In his remarks, Trump said Indian-American neighbours and friends have made incredible contributions to the country and to the world.	ନିଜ ମନ୍ତବ୍ୟରେ ଟ୍ରମ୍ପ୍‌ କହିଛନ୍ତି ଯେ ଭାରତୀୟ-ଆମେରିକୀୟ ପଡ଼ୋଶୀମାନେ ଏବଂ ବନ୍ଧୁମାନଙ୍କର ଦେଶ ପାଇଁ ଓ ବିଶ୍ୱ ପାଇଁ ଅବଦାନ ଅତୁଳନୀୟ।	0.9184497	True	True
2216	[[0.9207912]]	Another young man was critically injured.	ଏହା ସହିତ ଆଉ ଜଣେ ଯୁବକ ଗୁରୁତର ଭାବେ ଆହତ ହୋଇଛନ୍ତି।	0.9207912	False	True
2234	[[0.90044224]]	Democratic presidential nominee Joe Biden will be the first candidate in history to raise USD 1 billion from donors.	ଡେମୋକ୍ରାଟିକ୍ ପାର୍ଟିର ରାଷ୍ଟ୍ରପତି ପ୍ରାର୍ଥୀ ଜୋ ବିଡେନ ଇତିହାସର ପ୍ରଥମ ପ୍ରାର୍ଥୀ ହେବେ ଯାହାକି ଦାତାମାନଙ୍କଠାରୁ ୧ ବିଲିୟନ ଡଲାର ପାଇବେ।	0.90044224	True	True
2270	[[0.90808076]]	One person died on the spot and other one was seriously injured in the accident.	ଘଟଣା ସ୍ଥଳରେ ଜଣଙ୍କର ମୃତ୍ୟୁ ହୋଇଥିବା ବେଳେ ଜଣେ ଗୁରୁତର ଆହତ ହୋଇଛନ୍ତି ।	0.90808076	True	True
2276	[[0.92827326]]	The Prime Minister said that Sant Kabir represents the essence of India's soul.	ପ୍ରଧାନମନ୍ତ୍ରୀ କହିଲେ ଯେ ସନ୍ଥ କବୀର ଭାରତୀୟ ଆତ୍ମାର ସାରବତ୍ତାର ପ୍ରତିନିଧିତ୍ୱ କରୁଛନ୍ତି ।	0.92827326	True	True
2284	[[0.9276192]]	Police reached the spot and started investigation after seizing the dead body.	ପୁଲିସ୍‌ ଘଟଣାସ୍ଥଳରେ ପହଞ୍ଚି ମୃତଦେହ ଜବତ କରି ତଦନ୍ତ ଆରମ୍ଭ କରିଛି।	0.9276192	True	True
2359	[[0.9252773]]	The matter is being investigated and the accused will be arrested soon, police said.	ଘଟଣାର ତଦନ୍ତ ଚାଲିଛି, ଖୁବ୍ ଶୀଘ୍ର ଅଭିଯୁକ୍ତଙ୍କୁ ଧରାଯିବ ବୋଲି କହିଛନ୍ତି ଥାନା ଅଧିକାରୀ ।	0.9252773	True	True
