idx	las	src	tgt	las_score_dbl	src_gt_8_words	tgt_gt_8_words	ollama_trans
29982	[[0.9043234]]	Indeed, Jehovahs Witnesses believe that the Bible is a book for all people and endeavor impartially to encourage everyone they meet to peer into it to find the words of wisdom it contains.	వాస్తవానికి, బైబిలు సర్వమానవాళి కోసమైన గ్రంథమని యెహోవాసాక్షులు నమ్ముతారు, అందులో ఉన్న జ్ఞానపు పలుకులను కనుగొనేలా దాన్ని చదవమని తాము కలుసుకున్న ప్రతి ఒక్కరినీ ప్రోత్సహించడానికి నిష్పాక్షికంగా కృషిచేస్తారు.	0.9043234	True	True	నిజంగా, యెహోవా సాక్షులు బైబిల్ అనేది అందరికీ ఉన్న పుస్తకమని నమ్ముతారు, వారు ఎవరినైనా కలుసుకున్నా అందరినీ సమానంగా ప్రోత్సహిస్తూ, దానిలో ఉన్న జ్ఞాన వాక్యాలను కనుగొనేందుకు ప్రయత్నిస్తారు.
30189	[[0.91881686]]	Congress got 28.43 per cent of votes and won 19 seats while the BJP got only 6.98 per cent of votes and confined itself to one seat!	కాంగ్రెస్‌ 28.43 శాతం ఓట్లతో 19 సీట్లు, బీజేపీ 6.98 శాతం ఓట్లతో కేవలం ఒకే సీటును గెలిచిన విషయం తెలిసిందే.	0.91881686	True	True	కాంగ్రెస్ 28.43 శాతం ఓట్లు పొంది 19 సీట్లు గెలుచుకుంది, బీజేపీ 6.98 శాతం ఓట్లు పొంది ఒక్క సీటుకే పరిమితమైంది!
30225	[[0.9025601]]	The changes will enable the persons belonging to these castes/ communities in Andhra Pradesh and Telangana to avail the benefits of reservation in Government services and posts as well as in Central Educational Institutions as per extant policy.	ఈ మార్పులు ప్ర‌భుత్వ స‌ర్వీసుల‌లోను, ఉద్యోగాల‌లోను మ‌రియు కేంద్ర ప్ర‌భుత్వ విద్యా సంస్థ‌ల‌లోను ఇప్పటి విధానం ప్రకారం రిజ‌ర్వేష‌న్ తాలూకు ప్రయోజనాలను ఆంధ్ర‌ ప్ర‌దేశ్, తెలంగాణ రాష్ట్రాలలో ఆయా కులాలు/సమూహాలకు చెందిన వ్యక్తులు పొందేందుకు వీలు కల్పిస్తాయి.	0.9025601	True	True	ఈ కులాలు/సమాజాలకు చెందిన వ్యక్తులు ఆంధ్రప్రదేశ్ మరియు తెలంగాణలో ప్రభుత్వ సేవలు మరియు పోస్టుల్లోను, కేంద్ర విద్యా సంస్థల్లోను ప్రస్తుత విధానం ప్రకారం రిజర్వేషన్ ప్రయోజనాలు పొందగలుగుతారు.
30280	[[0.9038379]]	The court sentenced him to 20 years imprisonment.	ఈ నేరాల కింద కోర్టు అతడికి 20 ఏళ్ల కారాగార శిక్ష విధించింది.	0.9038379	False	True	ఆదాలతి అతనికి 20 సంవత్సరాల కారాగార శిక్ష విధించింది.
30290	[[0.91206026]]	So this is Theta, so as we go along this Theta, go from Theta is equal to 0 to 180 degree, so from the forward stagnation point to the rear stagnation point, that is Theta is equal to 0 to 180 degree and if we plot CP, okay, so this particular, it will essentially give me the variation of pressure.	కాబట్టి ఈ థెటాతో పాటు, థెటా నుండి 0 నుంచి 180 డిగ్రీ వరకు వెళ్లి, ముందుకు వెనుకకు స్తబ్ధత స్థానం నుండి వెనుక స్తబ్దత పాయింట్ వరకు, థెటా 0 నుండి 180 డిగ్రీలకు సమానంగా ఉంటుంది మరియు మేము ప్లాట్ చేస్తే CP, సరే, కాబట్టి ఈ ప్రత్యేకమైన, ఇది తప్పనిసరిగా నాకు ఒత్తిడి యొక్క వైవిధ్యాన్ని అందిస్తుంది.	0.91206026	True	True	ఇది థీటా, థీటా వెంట మేము వెళ్తున్నప్పుడు, థీటా నుండి 0 నుండి 180 డిగ్రీలకు వెళ్తుంది, అంటే ముందు స్థాగన బిందువు నుండి వెనుక స్థాగన బిందువు వరకు, అంటే థీటా 0 నుండి 180 డిగ్రీలు మరియు మేము CP ను ప్లాట్ చేస్తే, ఓకే, ఈ ప్రత్యేక విషయం నాకు పీడనం యొక్క మార్పును ఇస్తుంది.
30347	[[0.9291295]]	State Department of Agriculture, Madhya Pradesh has also undertaken control operations at 5 locations located one each in districts of Satna, Balaghat, Niwari, Raisen and Shivpuri.	మధ్యప్రదేశ్ రాష్ట్ర వ్యవసాయ శాఖ సత్నా, బాలాఘాట్, నివారి, రైసన్, శివపురి జిల్లాల్లో ఒక్కొక్కటి చొప్పున 5 ప్రదేశాలలో నియంత్రణ కార్యకలాపాలను చేపట్టింది.	0.9291295	True	True	మధ్య ప్రదేశ్ రాష్ట్ర వ్యవసాయ శాఖ కూడా సత్నా, బాలాఘాట్, నివారి, రాయిసేన్ మరియు శివ్ పురి జిల్లాల్లో ఒక్కొక్క ప్రదేశంలో నియంత్రణ ఆపరేషన్లను చేపట్టింది.
30348	[[0.9026277]]	The state government has set up a Special Investigation Team (SIT), headed by Additional DGP (CID) Amit Garg, to investigate the case.	ఈ ఘటనపై విచారణకు ఏపీ ప్రభుత్వం సీఐడీ అడిషనల్ డీజీ అమిత్‌గార్గ్ నేతృత్వంలో ప్రత్యేకదర్యాప్తు బృందం (సిట్)ను ఏర్పాటుచేసింది.	0.9026277	True	True	రాష్ట్ర ప్రభుత్వం ఈ కేసును దర్యాప్తు చేయడానికి అదనపు డీజీపీ (సీఐడీ) అమిత్ గార్గ్ నేతృత్వంలో ప్రత్యేక దర్యాప్తు బృందాన్ని ఏర్పాటు చేసింది.
30379	[[0.90042424]]	The film was directed by Ali Abbas Zafar and produced by Aditya Chopra.	అలీ అబ్బాస్ జాఫర్ దర్శకత్వం వహించిన ఈ సినిమాకు ఆదిత్య చోప్రా నిర్మాత.	0.90042424	True	True	ఆలీ అబ్బాస్ జఫర్ దర్శకత్వం వహించగా, అదిత్య చోప్రా నిర్మాణం చేశారు.
30421	[[0.92837924]]	Police said they have registered a case and are investigating the matter.	పోలీసులు ఈ మేరకు కేసు నమోదు చేసుకొని దర్యాప్తు చేస్తున్నట్లు తెలిపారు.	0.92837924	True	True	పోలీసులు ఒక కేసును నమోదు చేసి, ఈ విషయంపై దర్యాప్తు చేస్తున్నారు.
30498	[[0.92276025]]	In 1988, this park was declared as a World Heritage Site by United Nations Educational, Scientific and Cultural Organization (UNESCO)	1988 లో ఈ ఉద్యానవనంను యునైటెడ్ నేషన్స్ ఎడ్యుకేషనల్, సైంటిఫిక్ అండ్ కల్చరల్ ఆర్గనైజేషన్ (యునెస్కో) ప్రపంచ వారసత్వ ప్రదేశంగా ప్రకటించింది	0.92276025	True	True	1988లో, యునెస్కో ఈ పార్కును ప్రపంచ వారసత్వ స్థలంగా ప్రకటించింది.
30512	[[0.90296364]]	Of the total 2,636 charging stations, 1,633 charging stations will be fast-charging stations and 1,003 will feature regular charging stations	మొత్తం 2,636 ఛార్జింగ్ స్టేషన్లలో 1,633 ఫాస్ట్ ఛార్జింగ్ స్టేషన్లను కాగా, 1,003 సాధారణ ఛార్జింగ్ స్టేషన్లు	0.90296364	True	True	మొత్తం 2,636 ఛార్జింగ్ స్టేషన్లలో, 1,633 ఛార్జింగ్ స్టేషన్లు ఫాస్ట్-ఛార్జింగ్ స్టేషన్లు కాగా, 1,003 రెగులర్ ఛార్జింగ్ స్టేషన్లు ఉంటాయి.
30562	[[0.91941166]]	271 million people raised out of poverty during 2006-16	2006-16 మధ్య కాలంలో 271 మిలియన్ల మందిని పేదరికం నుంచి బయటికి తేవడం జరిగింది	0.91941166	True	True	2006-16 మధ్య 27.1 కోట్ల మంది పేదరికం నుండి బయటపడ్డారు.
30665	[[0.9271846]]	The new update also introduces new stickers featuring Mickey and Minnie Mouse, along with a new winter-themed poster.	కొత్త నవీకరణ మిక్కీ మరియు మిన్నీ మౌస్ నటించిన కొత్త స్టిక్కర్లతో పాటు, శీతాకాలపు కొత్త పోస్టర్‌ను కూడా పరిచయం చేసింది.	0.9271846	True	True	నూతన అప్డేట్ మిక్కీ మరియు మిన్నీ మౌస్ లను చూపుతున్న కొత్త స్టిక్కర్లను, ఒక కొత్త శీతాకాల థీమ్ పోస్టర్ ను పరిచయం చేస్తుంది.
30772	[[0.9141878]]	The convention in Columbus, Ohio, July 24 - 30, 1931, was truly memorable.	ఒహాయోలోని కొలంబస్‌లో, 1931 జూలై 24 - 30 వరకు జరిగిన సమావేశం నిజంగానే మరపురాని సమావేశమే.	0.9141878	True	True	కొలంబస్, ఓహియోలో జూలై 24 - 30, 1931 లో జరిగిన సమావేశం చాలా స్మరణీయంగా ఉంది.
30824	[[0.90066475]]	Harbhajan Singh, wife Geeta Basra and their daughter Hinaya were also spotted at the celebrations.	హర్భజన్‌ సింగ్ భార్య గీతా బస్రా కుమార్తె హినయాతో కలిసి ఈ వేడుకలకు హాజరైంది.	0.90066475	True	True	హర్భజన్ సింగ్, ఆయన భార్య గీతా బస్రా మరియు వారి కూతురు హినాయా కూడా సంబరాలలో కనిపించారు.
30826	[[0.93122524]]	Compiz custom (create wrapper script'compiz-kde-launcher 'to launch it)	Compiz custom (దానిని దించుటకు వ్రాపర్ స్క్రిప్‍ట్‌ 'compiz- kde- launcher' ను సృష్టించుము) Name	0.93122524	False	True	కంపిజ్ కస్టమ్ (దీన్ని ప్రారంభించడానికి 'కంపిజ్-కెడి-లాంచర్' అనే వ్రాపర్ స్క్రిప్ట్ సృష్టించండి)
30828	[[0.9234123]]	The reason for the fire is yet unknown.	ఏ కారణం చేత అగ్ని ప్రమాదం జరిగిందన్న విషయం ఇంకా తెలియరాలేదు.	0.9234123	False	True	అగ్ని కారణం ఇంకా తెలియదు.
30965	[[0.928271]]	Health food stores typically offer a wider or more specialized selection of foods than conventional grocery stores for their customers, for example athletes and bodybuilders, people with special dietary needs, such as people who are allergic to the gluten in wheat or some other substance, or have diabetes mellitus, and for people who observe vegetarian, vegan, raw food, organic, or other alternative diets.	ఆరోగ్య ఆహార దుకాణాలు సాధారణంగా తమ వినియోగదారుల కోసం సాంప్రదాయ కిరాణా దుకాణాల కంటే విస్తృతమైన లేదా ఎక్కువ ప్రత్యేకమైన ఆహారాన్ని అందిస్తుంది, ఉదాహరణకు వ్యాయమ క్రీడాకారులు, బాడీబిల్డర్లు, ప్రత్యేక ఆహార అవసరాలు కలిగిన వ్యక్తులు, గోధుమలలో గ్లూటెన్ లేదా ఇతర పదార్థాల వల్ల అలెర్జీ ఉన్నవారు లేదా డయాబెటిస్ మెల్లిటస్, శాఖాహారం, వేగన్, ముడి ఆహారం, సేంద్రీయ లేదా ఇతర ప్రత్యామ్నాయ ఆహరం కోసం అన్వేషించే వ్యక్తులకు ఈ ఆరోగ్య నిధి ఉపయోగపడుతుంది.	0.928271	True	True	ఆరోగ్య ఆహార దుకాణాలు సాధారణ కిరాణా దుకాణాల కంటే విస్తృతమైన లేదా ప్రత్యేకమైన ఆహార ఎంపికను తమ కస్టమర్లకు అందిస్తాయి, ఉదాహరణకు క్రీడాకారులు, శరీర నిర్మాణకారులు, ప్రత్యేక ఆహార అవసరాలు ఉన్నవారు, ఉదాహరణకు గోధుమ లోని గ్లూటెన్ కు అలెర్జీ ఉన్నవారు లేదా ఇతర పదార్థాలకు, లేదా డయాబెటిస్ మెల్లిటస్ ఉన్నవారు, మరియు శాఖాహారులు, వేగాన్లు, రా ఆహారులు, ఆర్గానిక్ లేదా ఇతర ప్రత్యామ్నాయ ఆహార పద్ధతులను పాటిస్తున్నవారికి.
31039	[[0.9276768]]	As the interest in Indian art has grown, paintings by Ram Kumar are getting increasing recognition in the art market.	భారతీయ కళలో ఆసక్తి పెరిగినందున, రామ్ కుమార్‌ చిత్రలేఖనాల కళకు మార్కెట్లో గుర్తింపు పెరిగింది.	0.9276768	True	True	భారతీయ కళా ఆసక్తి పెరిగినందున, రామ్ కుమార్ చిత్రాలు ఆర్ట్ మార్కెట్లో పెరుగుతున్న గుర్తింపు పొందుతున్నాయి.
31079	[[0.9632615]]	The film will be released in Tamil, Telugu and Hindi languages.	తెలుగు , తమిళం , హిందీ భాషల్లో ఈ సినిమా అక్కడ విడుదల కానున్నది.	0.9632615	True	True	చిత్రం తమిళం, తెలుగు మరియు హిందీ భాషల్లో విడుదల అవుతుంది.
31159	[[0.9310458]]	The academic area chiefly comprises the main building, various departmental annexes and auditoria.	విద్యా ప్రాంతంలో ప్రధానంగా ప్రధాన భవనం, వివిధ విభాగాల సంయోజితాలు మరియు auditoria ఉన్నాయి .	0.9310458	True	True	అకాడెమిక్ ప్రాంతం ప్రధానంగా ప్రధాన భవనం, వివిధ విభాగాల అనుబంధ భవనాలు మరియు ఆడిటోరియాలు.
31214	[[0.9288994]]	The film stars Ranbir Kapoor, Anushka Sharma and Aishwarya Rai.	ఈ చిత్రంలో ఐశ్వర్య రాయ్, రణబీర్ కపూర్, అనుష్క శర్మ ముఖ్య పాత్రల్లో నటించబోతున్నారు.	0.9288994	True	True	ఈ చిత్రంలో రణ్ బీర్ కపూర్, అనుష్కా శర్మ, ఐశ్వర్యా రాయ్ నటిస్తున్నారు.
31233	[[0.9355943]]	Additional Solicitor General Anil Singh, who appeared for the NIA, said as far as he knew, Covid-19 patients could not be permitted to meet anyone.	ఎన్‌ఐఎ తరఫున హాజరైన అదనపు సొలిసిటర్ జనరల్ అనిల్ సింగ్ వాదిస్తూ తనకు తెలిసినంత వరకు కొవిడ్-19 రోగులు ఎవరినీ కలుసుకోవడానికి అనుమతించబోరని చెప్పారు.	0.9355943	True	True	నియా తరఫున వాదించిన అదనపు సాలిసిటర్ జనరల్ అనిల్ సింగ్, తాను తెలిసినంత వరకు కోవిడ్-19 రోగులు ఎవరినీ కలుసుకోవడానికి అనుమతించబడరు.
31251	[[0.9059448]]	Banerjee said West Bengal is better placed than many other states in many macro-economic parameters like GDP growth, unemployment rate, industry growth and poverty alleviation.	జిడిపి వృద్ధి, నిరుద్యోగ శాతం తగ్గుదల, పారిశ్రామిక వృద్ధి, పేదరిక నిర్మూలన తదితర భారీ ఆర్థిక ప్రమాణాలు సాధించడంలో మిగతా రాష్ట్రాల కన్నా పశ్చిమబెంగాల్ చాలా మెరుగైన స్థానంలో ఉందని బెనర్జీ పేర్కొన్నారు.	0.9059448	True	True	బెనర్జీ పల్లె పశ్చిమ బెంగాల్ అనేక మక్రో-ఆర్థిక పరామితుల్లో జిడిపి పెరుగుదల, నిరుద్యోగ రేటు, పరిశ్రమ పెరుగుదల, పేదరిక తగ్గింపులో అనేక ఇతర రాష్ట్రాల కంటే మెరుగైన స్థితిలో ఉంది.
31257	[[0.9061012]]	The official announcement of the same will be made soon.	అతి త్వరలోనే ఇదే విషయాన్ని అధికారికంగా కూడా ప్రకటన కూడా చేయనున్నారు.	0.9061012	True	True	అదే గురించి అధికారిక ప్రకటన త్వరలో వస్తుంది.
31266	[[0.9480876]]	128 MB RAM (up from 64 MB), 95 MB available.	128 MB RAM (64 MB నుంచి మెరుగుపరిచారు), 95 MB అందుబాటులో ఉంటుంది.	0.9480876	True	True	128 MB ర్యామ్ (64 MB నుండి పెరిగింది), 95 MB అందుబాటులో ఉంది.
31279	[[0.9023697]]	Higher crude oil prices also had its impact on rupee's trading pattern.	అధిక ముడి చమురు ధరలు కూడా రూపాయి ట్రేడింగ్ సరళి పైన ప్రభావం చూపించాయి.	0.9023697	True	True	ఎక్కువ క్రూడ్ ఆయిల్ ధరలు రూపాయి వ్యాపార పద్ధతిపై తన ప్రభావాన్ని చూపించాయి.
31290	[[0.9404682]]	Unrecognised Universities in UP are Varanaseya Sanskrit Vishwavidyalaya (Varanasi), Mahila Gram Vidyapith/Vishwavidyalaya (Prayagraj), Gandhi Hindi Vidyapeeth (Varanasi), National University of Electro Complex Homeopathy (Kanpur), Netaji Subhash Chandra Bose Open University (Aligarh), Uttar Pradesh Vishwavidyalaya (Mathura), Maharana Partap Shiksha Niketan Vishwavidyalaya (Pratapgarh), and Indraprastha Shiksha Parishad (Noida).	ఉత్తర ప్రదేశ్‌లో గుర్తింపులేని యూనివర్శిటీలు వారణాశేయ సంస్కృత విశ్వవిదాలయ (వారణాసి), మహిళా గ్రామ విద్యాపీఠ్‌‌ / విశ్వవిద్యాలయ (ప్రయాగ్‌‌రాజ్), గాంధీ హిందీ విద్యాపీఠ్ (వారణాసి), నేతాజీ సుభాష్‌‌ చంద్రబోస్‌‌ ఓపెన్‌‌ యూనివర్శిటీ ( అలీగఢ్‌‌ ), నేషనల్ యూనివర్శిటీ ఆఫ్ ఎలక్ట్రో కాంప్లెక్స్ హోమియోపతి (కాన్పూర్) , ఉత్తరప్రదేశ్‌‌ విశ్వవిద్యాలయ (మధుర), మహారాణా ప్రతాప్‌‌ శిక్ష నికేతన్ విశ్వవిద్యాలయ (ప్రతాప్‌‌గఢ్‌‌), ఇంద్రప్రస్థ శిక్ష పరిషత్ (నోయిడా).	0.9404682	True	True	యుపిలో గుర్తింపు లేని విశ్వవిద్యాలయాలు వారణాసేయ సంస్కృత విశ్వవిద్యాలయం (వారణాసి), మహిళా గ్రామ విద్యాపీఠం/విశ్వవిద్యాలయం (ప్రయాగ్రాజ్), గాంధీ హిందీ విద్యాపీఠం (వారణాసి), నేషనల్ యూనివర్సిటీ ఆఫ్ ఎలెక్ట్రో కాంప్లెక్స్ హోమియోపతి (కాన్పూర్), నేతాజీ సుభాష్ చంద్ర బోస్ ఓపెన్ యూనివర్సిటీ (అలీగఢ్), ఉత్తర ప్రదేశ్ విశ్వవిద్యాలయం (మథుర), మహారాణా ప్రతాప్ శిక్షా నికేతన్ విశ్వవిద్యాలయం (ప్రతాప్గఢ్), ఇంద్రప్రస్థ శిక్షా పరిషత్ (నోయిడా).
31319	[[0.9101595]]	On the other hand, ONGC, HCL Tech, Maruti, HUL, Asian Paints and Vedanta fell up to 3.99 per cent.	మరోవైపు ఓఎన్‌జీసీ, హెచ్‌సీఎల్ టెక్, మారుతి, హెచ్‌యూఎల్, ఏసియన్ పెయింట్స్, వేదాంత 3.99 శాతం నష్టపోయాయి.	0.9101595	True	True	మరోవైపు, ఓఎన్‌జిసి, హెచ్‌సిఎల్ టెక్, మారుతి, హెచ్‌యుఎల్, ఆసియన్ పెయింట్స్ మరియు వేదాంత వరకు 3.99 శాతం పడిపోయాయి.
31333	[[0.92602575]]	"""""""Are you going through, like, a """"""""womany"""""""" hormone situation or something?"""""""	"""""""మీకు ద్వారా వెళుతున్నారా, ఒక """"""""womany"""""""" హార్మోన్ పరిస్థితి లేదా ఏదో?"""""""	0.92602575	True	True	మీరు ఏదైనా స్త్రీలకు సంబంధించిన హార్మోన్ పరిస్థితిలో ఉన్నారా లేదా ఏదైనా ఇలాంటిదే?
