idx	las	src	tgt	las_score_dbl	src_gt_8_words	tgt_gt_8_words	ollama_trans
25	[[0.9318145]]	However, there has been no official statement on this yet.	అయితే ఈ విషయమై ఆయన నుండి ఇప్పటి వరకు ఎలాంటి అధికారిక ప్రకటన కూడా వెలువడలేదు.	0.9318145	True	True	అయితే, ఇంకా ఈ విషయంపై అధికారిక ప్రకటన రాలేదు.
102	[[0.91648906]]	Rajasthan Sports University (Hindi: ) is a newly established first public sports university situated in the Jhunjhunu Town of the Indian state Rajasthan to promote the sports education in state Rajasthan.	రాజస్థాన్ క్రీడా విశ్వవిద్యాలయం, రాజస్థాన్‌ రాష్ట్రంలో క్రీడా విద్యను ప్రోత్సహించడానికి ఝున్‌ఝును పట్టణంలో కొత్తగా స్థాపించబడిన మొదటి ప్రభుత్వ క్రీడా విశ్వవిద్యాలయం.	0.91648906	True	True	రాజస్థాన్ స్పోర్ట్స్ యూనివర్సిటీ (హిందీ: ) రాజస్థాన్ రాష్ట్రంలోని ఝున్ఝును పట్టణంలో ఉన్న కొత్తగా స్థాపించబడిన మొదటి ప్రభుత్వ స్పోర్ట్స్ యూనివర్సిటీ, రాజస్థాన్ రాష్ట్రంలో క్రీడా విద్యను ప్రోత్సహించడానికి.
440	[[0.9048451]]	In fulfillment of Isaiah 21: 8, what watchman has God had in our time?	యెషయా 21: 8 నెరవేర్పులో, మన కాలంలో ఏ “కావలివాడు ” దేవునికి ఉన్నాడు?	0.9048451	True	True	ఇసая 21: 8 లో పూర్తి కావడానికి, మన కాలంలో దేవుడు ఏ వీక్షకుడిని కలిగి ఉన్నాడు?
508	[[0.919876]]	In 1995 Bavaria introduced direct democracy on the local level in a referendum.	1995లో బవేరియా ప్రత్యక్ష ప్రజాస్వామ్యాన్ని ప్రజాభిప్రాయ సేకరణలోని స్థానిక స్థాయిలో ప్రవేశపెట్టింది.	0.919876	True	True	1995లో బవేరియా స్థానిక స్థాయిలో ప్రత్యక్ష ప్రజాస్వామ్యాన్ని ఒక రేఫరెండం ద్వారా ప్రవేశపెట్టింది.
520	[[0.93472356]]	However, an official announcement in this regard is yet to be made.	అయితే ఇందుకు సంబంధించిన అధికారిక ప్రకటన మాత్రం ఇంకా వెలువడాల్పి ఉంది.	0.93472356	True	True	అయితే, ఈ సందర్భంలో అధికారిక ప్రకటన ఇంకా వెలువడలేదు.
531	[[0.90108675]]	Of those interviewed, 89 percent said that it takes good health. 79 percent mentioned a satisfying marriage or partnership. 62 percent pointed to the rewards of parenthood. and 51 percent thought a successful career was needed for happiness.	అలా ఇంటర్వ్యూ చేయబడినవారిలో 89 శాతం మంది సంతోషంగా ఉండాలంటే మంచి ఆరోగ్యం అవసరం అన్నారు. 79 శాతం మంది సంతృప్తికరమైన కుటుంబ జీవితం లేక భాగస్వామ్యం అన్నారు. 62 శాతం మంది తల్లిదండ్రులవడం ద్వారా లభించే ప్రతిఫలాలు అన్నారు. 51 శాతం మంది విజయవంతమైన జీవనోపాధి మార్గం అవసరం అన్నారు.	0.90108675	True	True	ఇంటర్వ్యూ చేసిన వారిలో, 89 శాతం మంది ఆరోగ్యం ఉండాలని చెప్పారు. 79 శాతం మంది సంతోషకరమైన వివాహం లేదా భాగస్వామ్యం ఉండాలని చెప్పారు. 62 శాతం మంది పిల్లల సంతోషం ఉండాలని చెప్పారు. మరియు 51 శాతం మంది సఫల కెరీర్ ఉండాలని చెప్పారు.
536	[[0.93838733]]	More details about the film will be revealed soon.	ఈ సినిమా గురించి మరిన్ని వివరాలను త్వరలో రివీల్ చెయ్యబోతున్నారు .	0.93838733	True	True	చిత్రం గురించి మరిన్ని వివరాలు త్వరలో బహిర్గతం అవుతాయి.
585	[[0.92177737]]	Teach your children Bible truth whenever possible (See paragraph 10)	అవకాశం దొరికినప్పుడల్లా మీ పిల్లలకు బైబిలు సత్యాన్ని బోధించండి (10వ పేరా చూడండి)	0.92177737	True	True	మీ పిల్లలకు సాధ్యమైనంత వరకు బైబిల్ సత్యాన్ని బోధించండి (పేరా 10 చూడండి)
621	[[0.92643976]]	Argentina's per capita income was 70% higher than Italy's, 90% higher than Spain's, 180% higher than Japan's and 400% higher than Brazil's.	అర్జెంటీనా తలసరి ఆదాయం ఇటలీ కంటే 70% అధికం, స్పెయిన్ కంటే 90% అధికం, జపాన్ కంటే 180% అధికం, బ్రెజిల్ కంటే 400% అధికం.	0.92643976	True	True	ఆర్జెంటీనా తలసరి ఆదాయం ఇటలీ కంటే 70% ఎక్కువ, స్పెయిన్ కంటే 90% ఎక్కువ, జపాన్ కంటే 180% ఎక్కువ, బ్రెజిల్ కంటే 400% ఎక్కువ.
623	[[0.9450819]]	Vaibhav Pichad is from Akole tehsil in Ahmednagar district and is the son of former NCP minister Madhukar Pichad.	అహ్మద్‌నగర్‌ జిల్లాలోని అఖోలె మండలానికి చెందిన వైభవ్‌ పిచాడ్‌ ఎన్‌సీపీ మాజీ మంత్రి మధుకర్‌ పిచాడ్‌ తనయుడు.	0.9450819	True	True	వైభవ్ పిచ్చాడ్ అహ్మద్నగర్ జిల్లాలోని ఆకోలే తహసీల్ నుండి వచ్చినవాడు, మాజీ ఎన్సీపీ మంత్రి మాధుకర్ పిచ్చాడ్ కుమారుడు.
675	[[0.93178946]]	Book Four appeared in 1742, and a complete revision of the whole poem in the following year.	నాల్గవ పుస్తకం 1742లో ప్రచురించబడింది మరియు తర్వాత సంవత్సరంలో మొత్తం పద్యం యొక్క ఒక సంపూర్ణ సవరణ ప్రచురించబడింది.	0.93178946	True	True	నాలుగో పుస్తకం 1742లో వెలువడింది, తరువాతి సంవత్సరంలో పూర్తి కావ్యానికి సంశ్లేషణ జరిగింది.
711	[[0.90550685]]	Assam: In Assam during the last 24 hours 169 cases of COVID-19 detected out of 25225 tests conducted.	అస్సాం: గత 24 గంటలలో అస్సాంలో 25225 కోవిడ్ పరీక్షలు జరపగా 169 కొత్త కేసులు బైటపడ్దాయి.	0.90550685	True	True	ఆస్సాం: ఆస్సాంలో గత 24 గంటల్లో 169 కేసులు కోవిడ్-19 పరీక్షల్లో 25225 పరీక్షలు జరిపినవి.
727	[[0.9058394]]	It is powered by the Qualcomm Snapdragon 855+ processor and comes with 12GB of RAM and 256GB of storage.	ఇది 12GB RAM మరియు 256GB ఇంటర్నల్ స్టోరేజీ తో క్వాల్కమ్ స్నాప్ డ్రాగన్ 855 చిప్సెట్ హ్యాండ్సెట్ తో నడుస్తుంది.	0.9058394	True	True	క్వాల్కామ్ స్నాప్‌డ్రాగన్ 855+ ప్రాసెసర్ ద్వారా శక్తినిచ్చి, 12GB ర్యామ్ మరియు 256GB స్టోరేజ్ తో వస్తుంది.
775	[[0.92951196]]	The bill was cleared in Rajya Sabha by 125 votes in favour and 61 votes against it.	రాజ్యసభలో బిల్లుకు అనూకూలంగా 125, వ్యతిరేకంగా 61 ఓట్లు రావడంతో బిల్లులకు సభామోదం లభించింది.	0.92951196	True	True	రాజ్యసభలో 125 అనుకూల ఓట్లు, 61 వ్యతిరేక ఓట్లతో బిల్లు ఆమోదించబడింది.
788	[[0.9070734]]	It is already installed at two checkposts in the State of Sikkim - Rangpo Checkposts, East Sikkim, and Melli checkposts, South Sikkim.	ఇది ఇప్పటికే సిక్కిం రాష్ట్రంలోని రెండు చెక్‌పోస్టులలో - రంగ్‌పో చెక్‌పోస్టులు, తూర్పు సిక్కిం, దక్షిణ సిక్కింలోని మెల్లి చెక్‌పోస్టులు ఏర్పాటు చేశారు The Vehicle Disinfectant Bay deployed at Rangpo Checkposts, East Sikkim	0.9070734	True	True	సిక్కిం రాష్ట్రంలో ఇప్పటికే రెండు చెక్ పోస్టుల్లో స్థాపించబడింది - తూర్పు సిక్కింలోని రంగ్పో చెక్ పోస్టు, దక్షిణ సిక్కింలోని మెల్లి చెక్ పోస్టు.
832	[[0.9203818]]	A case has been registered against Prasad at Sitanagar police station under section 74/2019 and section 324 of Indian Penal Code (IPC).	దీంతో ప్రసాద్‌పై సీతానగరం పోలీస్‌స్టేషన్‌లో 74/2019, ఐపీసీ 324 సెక్షన్‌ కింద కేసు నమోదు చేశారు.	0.9203818	True	True	ప్రసాద్ పై సీతానగర్ పోలీస్ స్టేషన్ వద్ద 74/2019 సెక్షన్, ఐపీసీ 324 సెక్షన్ కింద కేసు నమోదు చేయబడింది.
991	[[0.9293503]]	Union ministers Radha Mohan Singh and Subhash Bhamre and Maharashtra minister Girish Mahajan were also present during talks with Hazare.	హజారేతో జరిపిన చర్చల్లో కేంద్ర మంత్రులు రాధా మోహన్ సింగ్, సుభాష్ భమ్రే, మహారాష్ట్ర మంత్రి గిరీష్ మహాజన్ పాల్గొన్నారు.	0.9293503	True	True	హజారేతో చర్చల్లో రాధా మోహన్ సింగ్, సుభాష్ భామ్రే అనే కేంద్ర మంత్రులు, మహారాష్ట్ర మంత్రి గిరీష్ మహాజన్ కూడా పాల్గొన్నారు.
1032	[[0.90927553]]	The entire domain name may not contain more than 253 characters.	పూర్తి డొమైన్ పేరు 253 అష్టపదుల కంటే ఎక్కువ పొడవును కలిగి ఉండరాదు.	0.90927553	True	True	పూర్తి డొమెయిన్ పేరు 253 అక్షరాల కంటే ఎక్కువ ఉండకూడదు.
1084	[[0.92770374]]	The Union Cabinet chaired by the Prime Minister Shri Narendra Modi has given its approval for introduction of the Payment of Gratuity (Amendment) Bill, 2017 in the Parliament.	ప్ర‌ధాన మంత్రి శ్రీ న‌రేంద్ర మోదీ అధ్య‌క్ష‌త‌న స‌మావేశ‌మైన కేంద్ర మంత్రివ‌ర్గం గ్రాట్యుటీ చెల్లింపు (స‌వ‌ర‌ణ‌) బిల్లు, 2017ను పార్ల‌మెంటులో ప్ర‌వేశ‌పెట్ట‌డానికి త‌న ఆమోదాన్ని తెలిపింది.	0.92770374	True	True	ప్రధాన మంత్రి శ్రీ నరేంద్ర మోదీ అధ్యక్షతన కేంద్ర మంత్రిమండలి పార్లమెంటులో 2017 సంవత్సరపు గ్రాట్యుటీ చెల్లింపు (సవరణ) బిల్లును ప్రవేశపెట్టడానికి తన ఆమోదం తెలిపింది.
1089	[[0.90862596]]	The video of the incident has gone viral on WhatsApp.	ఈ ఘటనకు సంబంధించిన వీడియో వాట్సాప్ లో వైరల్ గా మారడంతో విషయం వెలుగులోకి వచ్చింది.	0.90862596	True	True	ఆ సంఘటన వీడియో వాట్సాప్ లో వైరల్ అయింది.
1102	[[0.9048918]]	So if you take first station as 1 and the 2nd station as 2, so Delta P is P1 minus P2, so P2 is less than P1, so P1 minus P2 because there is a frictional loss, so P1 minus P2 is basically the Delta P.	మీరు మొదటి స్టేషన్ను 1 మరియు రెండో స్టేషన్ 2 గా తీసుకుంటే, డెల్టా పి P1 మైనస్ P2 కాబట్టి P2 కంటే P1 కంటే తక్కువగా ఉంటుంది, కాబట్టి P1 మైనస్ P2 కాబట్టి ఘర్షణ నష్టం ఉంది కాబట్టి P1 మైనస్ P2 ప్రధానంగా డెల్టా P మరియు P1 మైనస్ P2 సానుకూలంగా ఉంటుంది, ఎందుకంటే ఈ పీడన నష్టం ప్రతికూలంగా ఉంటుంది, ఎందుకంటే ఒత్తిడి, మీరు X దిశలో కదులుతుంటే అప్పుడు ఒత్తిడి తగ్గుతుంది, కాబట్టి ప్రవణత ప్రతికూలంగా ఉంటుంది, ఇక్కడ వ్యక్తీకరించబడుతుంది.	0.9048918	True	True	అందుకే మొదటి స్టేషన్ ను 1గా తీసుకుంటే, 2వ స్టేషన్ ను 2గా తీసుకుంటే, డెల్టా పి అనగా పి1 నుండి పి2 తీసివేయడం, పి2 పి1 కంటే తక్కువ, పి1 నుండి పి2 తీసివేయడం ఘర్షణ నష్టం కారణంగా, పి1 నుండి పి2 తీసివేయడం అనగా డెల్టా పి అనేదే.
1141	[[0.9075049]]	Nelson was eventually exiled during the late 1920s and early 1930s, but he continued to assist the organisation financially and politically.	నెల్సన్ చివరికి 1920ల ముగింపు మరియు 1930ల ప్రారంభంలో బహిష్కరించబడ్డాడు, కాని అతను సంస్థకు ఆర్థిక పరంగా మరియు రాజకీయ పరంగా సహాయాన్ని కొనసాగించాడు.	0.9075049	True	True	నెల్సన్ 1920ల చివరి దశాబ్దం, 1930ల ఆరంభ దశాబ్దంలో చివరకు పారిపోయాడు, కానీ ఆర్థికంగా, రాజకీయంగా సంస్థకు సహాయం చేస్తూనే ఉన్నాడు.
1213	[[0.9130517]]	Best Writing- Thiagararajan Kumararaja, Nalan Kumaraswamy, Mysskin, Neelan K Sekar (Super Deluxe)	ఉత్తమ రచయిత – త్యాగరాజన్ కుమారరాజా, నలన్ కుమారస్వామి, మిస్కిన్, నీలం కె శేఖర్(సూపర్ డీలక్స్)	0.9130517	True	True	ఉత్తమ రచన - తియాగరాజన్ కుమారరాజా, నాలన్ కుమారస్వామి, మైస్కిన్, నీలన్ కె శేకర్ (సూపర్ డెలుక్స్)
1331	[[0.93651915]]	Senior Supreme Court advocate Jagdeep Dhankhar was appointed as the new Governor of West Bengal, replacing Keshari Nath Tripathi.	కేసరినాథ్ త్రిపాఠి స్థానంలో పశ్చిమ బెంగాల్ గవర్నర్ గా సుప్రీంకోర్టు సీనియర్ న్యాయవాది జగదీప్ ధన్‌ఖర్ నియమితులయ్యారు.	0.93651915	True	True	పార్లమెంటు సభ్యుడు జగదీప్ ధన్ఖర్ ను పశ్చిమ బెంగాల్ గవర్నరుగా నియమించారు, కేశరి నాథ్ త్రిపాఠిని భర్తీ చేస్తూ.
1479	[[0.90020317]]	Chief Justice of India Ranjan Gogoi has written three letters to Prime Minister Narendra Modi seeking to increase the number of judges in the Supreme Court.	దిల్లీ: సుప్రీంకోర్టులో న్యాయమూర్తుల సంఖ్యను పెంచాలని కోరుతూ భారత ప్రధాన న్యాయమూర్తి జస్టిస్‌ రంజన్‌ గొగొయ్, ప్రధాని మోదీకి లేఖ రాశారు.	0.90020317	True	True	భారత ప్రధాన న్యాయమూర్తి రంజన్ గోగోయ్ ప్రధానమంత్రి నరేంద్ర మోదీకి సుప్రీం కోర్టులో న్యాయమూర్తుల సంఖ్యను పెంచాలని మూడు లేఖలు వ్రాశారు.
1509	[[0.9044242]]	About three million years ago the oceans could have been up to 50 m (165 ft) higher.	దాదాపు మూడు మిలియన్ల సంవత్సరాల క్రితం మహాసముద్రాలు దాదాపు 165 అడుగులు (50 మీ)ఎత్తులో ఉండేవి.	0.9044242	True	True	సుమారు మూడు మిలియన్ సంవత్సరాల క్రితం సముద్రాలు 50 మీ (165 అడుగులు) ఎత్తుగా ఉండవచ్చు.
1523	[[0.9134934]]	It is pretty close to what people approximated here they said 1 million is about four times the size.	1 million is about four times ఎక్కువ అని వారు చెప్పిన ఇక్కడ ప్రజలు అంచనా వేసిన దానికి ఇది చాలా దగ్గరగా ఉంది.	0.9134934	True	True	ఇది ఇక్కడ ప్రజలు అంచనా వేసిన దానికి చాలా దగ్గరగా ఉంది, వారు చెప్పినట్లు 1 మిలియన్ దాదాపు నాలుగు రెట్లు పరిమాణంలో ఉంది.
1551	[[0.9554082]]	The film will also be released in Hindi, Tamil, Telugu, and Malayalam.	ఈ మూవీ తెలుగుతో పాటు త‌మిళ‌, మ‌ల‌యాళ‌, హిందీ, ఇంగ్లిష్ భాష‌ల్లోనూ విడుదల కానుంది.	0.9554082	True	True	ఈ చిత్రం హిందీ, తమిళం, తెలుగు, మలయాళంలో కూడా విడుదల అవుతుంది.
1572	[[0.9313957]]	From then until 1972, my wife and I visited nearly all the congregations of Jehovahs people in eastern and midwestern Nigeria.	అప్పటినుండి 1972 వరకు నేను, నా భార్య కలిసి దాదాపు తూర్పు, మధ్య పశ్చిమ నైజీరియాలో ఉన్న యెహోవా ప్రజల సంఘాలన్నింటినీ సందర్శించాం.	0.9313957	True	True	1972 వరకు, నేను మరియు నా భార్య నైజీరియాలోని తూర్పు మరియు మధ్య పశ్చిమ ప్రాంతాలలోని యెహోవా ప్రజల సమావేశాలను సమీపించాము.
1642	[[0.91128695]]	Directed by Anil Ravipudi, the film is produced by Dil Raju under Sri Venkateswara Creations banner.	శ్రీ వెంకటేశ్వర క్రియేషన్స్‌పతాకం పై అనిల్‌ రావిపూడి రచన దర్శకత్వం లో దిల్‌ రాజు సమర్పణలో శిరీష్‌ ఈ చిత్రాన్ని నిర్మించారు .	0.91128695	True	True	అనిల్ రావిపూడి దర్శకత్వంలో, శ్రీ వెంకటేశ్వర క్రియేషన్స్ బ్యానర్ కింద దిల్ రాజు నిర్మాణంలో ఈ చిత్రం ఉంది.
1704	[[0.90673816]]	A special PMLA court granted bail to Shah terming the arrest by ED was illegal.	ఇడి అరెస్టును ‘చట్టవిరుద్ధం’ అని పేర్కొంటూ షాకు ప్రత్యేక పిఎంఎల్‌ఎ కోర్టు బెయిల్ మంజూరు చేసింది.	0.90673816	True	True	ఈడీ ద్వారా జరిగిన అరెస్టు చట్టవిరుద్ధమని పిఎంఎల్‌ఏ కోర్టు షాకు బెయిల్ మంజూరు చేసింది.
1820	[[0.91379607]]	There were 150 passengers onboard the plane.	ఈ ప్రమాదం చోటుచేసుకున్న సమయంలో విమానంలో 150 మంది ప్రయాణికులు ఉన్నారు.	0.91379607	False	True	ఆ విమానంలో 150 మంది ప్రయాణీకులు ఉన్నారు.
1953	[[0.9002925]]	With Tillerson, Jaishankar discussed bilateral strategic relationship as well as the situation in Afghanistan and the Asia Pacific region.	ఇరు దేశాల మధ్య ద్వైపాక్షిక వ్యూహాత్మక సంబంధాలతోపాటు అఫ్గానిస్తాన్, ఆసియా పసిఫిక్ ప్రాంతంలో నెలకొన్న పరిస్థితిపై టిల్లెర్సన్‌తో జైశంకర్ చర్చించారు.	0.9002925	True	True	టిల్లర్సన్ తో జైశంకర్ బైలాటరల్ స్ట్రాటజిక్ సంబంధం మరియు ఆఫ్ఘనిస్తాన్, ఆసియా పసిఫిక్ ప్రాంతంలో పరిస్థితి గురించి చర్చించారు.
1974	[[0.949093]]	However, there has not been any official announcement regarding the film.	అయితే ఇప్పటి వరకు ఆ సినిమా గురించిన అధికారిక ప్రకటన అయితే రాలేదు.	0.949093	True	True	అయితే, ఆ సినిమా గురించి అధికారిక ప్రకటన ఏదీ జరగలేదు.
2007	[[0.9275273]]	India lead the three-match T20I series 1-0.	మూడు మ్యాచ్‌ల టీ20 సిరీస్‌లో భారత్ 1-0 తో పై చేసి సాధించింది.	0.9275273	False	True	భారత్ మూడు మ్యాచ్‌ల టీ20ఐ సిరీస్‌లో 1-0 తో ఆధిక్యంలో ఉంది.
