idx	las	src	tgt	las_score_dbl	src_gt_8_words	tgt_gt_8_words	ollama_trans
46646	[[0.934294]]	There are 672 candidates in fray for 70 Assembly seats in Delhi.	ఢిల్లీ అసెంబ్లీ ఎన్నికల్లో మొత్తం 70 స్థానాలకు 672 మంది అభ్యర్థులు పోటీ పడుతున్నారు.	0.934294	True	True	ఢిల్లీలోని 70 అసెంబ్లీ సీట్లకు 672 మంది అభ్యర్థులు పోటీలో ఉన్నారు.
46663	[[0.90184927]]	Santal from Cuttack, Dhalbhum, Birbhum, Manbhum, Hazaribagh migrated and started cultivating these lands as peasants.	కటక్, ధల్భం, బిర్భుం, మంభం, హజారిబాగ్ నుండి సంతాలు ప్రజలు వలస వచ్చి ఈ భూములను రైతులుగా సాగు చేయడం ప్రారంభించారు.	0.90184927	True	True	కటక్, ధల్భుం, బీర్భుం, మన్భుం, హజారీబాగ్ నుండి సంతాలు వలస వచ్చి ఈ భూములను రైతులుగా సాగుచేశారు.
46696	[[0.9155912]]	He said employment opportunities have to be created not just in big cities but in smaller towns too.	ఉపాధి అవ‌కాశాలను ఒక్క పెద్ద న‌గ‌రాల‌లో మాత్ర‌మే కాకుండా, చిన్న ప‌ట్ట‌ణాల‌లో కూడా క‌ల్పించాల‌ని ఆయ‌న అన్నారు.	0.9155912	True	True	అతను చెప్పాడు, పెద్ద నగరాల్లో కాకుండా చిన్న పట్టణాల్లో కూడా ఉద్యోగ అవకాశాలు సృష్టించాలి.
46738	[[0.9061153]]	US President Donald Trump's daughter, Ivanka Trump arrives in Ahmedabad.	అమెరికా అధ్యక్షుడు డొనాల్డ్ ట్రంప్ కూతురు ఇవాంక ట్రంప్ హైదరాబాద్ రానున్నారు.	0.9061153	True	True	యుఎస్ అధ్యక్షుడు డొనాల్డ్ ట్రంప్ కుమార్తె ఇవాంకా ట్రంప్ అహ్మదాబాద్ చేరుకుంది.
46928	[[0.912031]]	AIADMK has 37 MPs in Lok Sabha and 13 in Rajya Sabha.	లోక్‌స భలో అన్నాడిఎ ంకె సభ్యులు 37మంది ఉండగా, రాజ్యసభలో 13మంది ఉన్నారు.	0.912031	True	True	ఏఐఏడీఎంకె 37 ఎంపీలు లోక్ సభలో ఉండగా, 13 రాజ్య సభలో ఉన్నాయి.
46957	[[0.9131398]]	It contains antiviral, antifungal and antibacterial properties.	ఇది యాంటీ బ్యాక్టీరియల్, యాంటీ సెప్టిక్ మరియు యాంటీ ఇన్ఫ్లమేటరీ గుణాలను కలిగిఉంటుంది.	0.9131398	False	True	దీనిలో వైరస్ విరోధీ, ఫంగస్ విరోధీ మరియు బాక్టీరియా విరోధీ లక్షణాలు ఉన్నాయి.
47044	[[0.9375907]]	The Union government has proposed to set up a total of 1,023 fast-track special courts for expeditious trial of over 1.66 lakh pending cases of crime against women and children across the country.	దేశవ్యాప్తంగా మహిళలు, చిన్నారులపై నేరాలకు సంబంధించి పెండింగ్‌లోని 1.66 లక్షల కేసుల వేగవంత పరిష్కా రం కోసం కేంద్ర ప్రభుత్వం మొత్తం 1,023 ఫాస్ట్‌ట్రాక్‌ ప్రత్యేక కోర్టుల ఏర్పాటుకు ప్రతిపాదన చేసింది.	0.9375907	True	True	దేశం అంతటా మహిళలు, పిల్లలపై జరిగిన నేరాలకు సంబంధించిన 1.66 లక్షల విచారణ ఆలస్యంగా ఉన్న కేసులను వేగవంతంగా పరిష్కరించడానికి కేంద్ర ప్రభుత్వం 1,023 వేగవంతం ప్రత్యేక కోర్టులను ఏర్పాటు చేయాలని ప్రతిపాదించింది.
47063	[[0.91192424]]	Country's largest lender State Bank of India (SBI) offers various services to its account holders.	దేశీ అతిపెద్ద బ్యాంక్ స్టేట్ బ్యాంక్ ఆఫ్ ఇండియా (SBI) తన కస్టమర్లకు ఎన్నో రకాల సేవలు అందిస్తోంది.	0.91192424	True	True	భారత దేశం యొక్క అతిపెద్ద ఋణదాత స్టేట్ బ్యాంక్ ఆఫ్ ఇండియా (ఎస్బీఐ) తన ఖాతాదారులకు వివిధ సేవలను అందిస్తుంది.
47085	[[0.9108087]]	The Brihanmumbai Municipal Corporation (BMC) of the city of Mumbai in Maharashtra is the richest municipal corporation in India.	ముంబై నగరానికి చెందిన బృహన్ ముంబై మునిసిపల్ కార్పొరేషన్ (బిఎంసి) భారతదేశంలో అత్యంత ధనిక మునిసిపల్ కార్పొరేషన్.	0.9108087	True	True	మహారాష్ట్రలోని ముంబై నగరంలోని బృహన్ముంబై మునిసిపల్ కార్పొరేషన్ (బిఎంసి) భారతదేశంలో అత్యంత సంపన్నమైన మునిసిపల్ కార్పొరేషన్.
47125	[[0.90036833]]	Similarly, Syndicate Bank has decided to increase the credit risk premium if a borrowers Cibil score were to drop by more than 50 points.	రుణగ్రహీత సిబిల్ స్కోర్ 50 పాయింట్లకు మించి పడిపోతే క్రెడిట్ రిస్క్ ప్రీమియాన్ని పెంచాలని సిండికేట్ బ్యాంక్ కూడా నిర్ణయించింది.	0.90036833	True	True	అదేవిధంగా, సిండికేట్ బ్యాంక్ ఒక ఋణగ్రహీత సిబిల్ స్కోర్ 50 పాయింట్లు తగ్గితే క్రెడిట్ రిస్క్ ప్రీమియం పెంచుతుంది.
47159	[[0.92437243]]	The new Verna is powered by 1.4-litre and 1.6-litre petrol and diesel motors.	కొత్త వెర్నా కారును 1.4 లీటర్, 1.6 లీటర్ పెట్రోల్ మరియు డీజిల్ ఇంజన్లతో ఆఫర్ చేస్తున్నారు.	0.92437243	True	True	నూతన వెర్నా 1.4-లీటర్ మరియు 1.6-లీటర్ పెట్రోల్ మరియు డీజిల్ మోటార్లతో శక్తినిస్తుంది.
47264	[[0.94183314]]	The movie stars Sidharth Malhotra, Riteish Deshmukh, Rakul Preet Singh and Tara Sutaria.	ఈ చిత్రంలో సిద్ధార్థ్ మల్హోత్రా, రితేష్ దేశ్‌ముఖ్, రకుల్ ప్రీత్ సింగ్, తారా సుతారియా నటించారు.	0.94183314	True	True	సిద్ధార్థ్ మల్హోత్రా, రితేష్ దేశ్ముఖ్, రాకుల్ ప్రీత్ సింగ్, తారా సుతారియాలను ఈ సినిమాలో నటిస్తున్నారు.
47281	[[0.90412754]]	Cabinet Reforms in Homoeopathy Tenure of Central Council of Homoeopathy extended for two years from 18th May,2018Cabinet approves Homoeopathy Central Council (Amendment) Bill,2019 The Union Cabinet, chaired by the Prime Minister Shri Narendra Modi, has approved the draft Homoeopathy Central Council(Amendment) Bill, 2019.	మంత్రిమండలి హోమియోపతి లో సంస్కరణలు కేంద్రీయ హోమియోపతి మండలి పదవీకాలం 2018 మే 18వ తేదీ నుండి రెండేళ్ళ పాటు పొడిగింపు హోమియోపతి సెంట్రల్ కౌన్సిల్ ( సవరణ) బిల్లు, 2019 కి ఆమోదం తెలిపిన మంత్రివర్గం హోమియోపతి సెంట్రల్ కౌన్సిల్ (సవరణ) బిల్లు, 2019 కు ప్రధాన మంత్రి శ్రీ నరేంద్ర మోదీ అధ్యక్షత న జరిగిన కేంద్ర మంత్రివర్గ సమావేశం ఆమోదం తెలిపింది.	0.90412754	True	True	హోమియోపతిలో కేబినెట్ సంస్కరణలు సెంట్రల్ కౌన్సిల్ ఆఫ్ హోమియోపతి టెన్యూర్ ను 2018 మే 18 నుండి రెండు సంవత్సరాల పాటు పొడిగించింది. కేబినెట్ హోమియోపతి సెంట్రల్ కౌన్సిల్ (సవరణ) బిల్లు, 2019 ను ఆమోదించింది. ప్రధాన మంత్రి శ్రీ నరేంద్ర మోదీ అధ్యక్షతన జరిగిన యూనియన్ కేబినెట్, హోమియోపతి సెంట్రల్ కౌన్సిల్ (సవరణ) బిల్లు, 2019 ను ఆమోదించింది.
47301	[[0.90983754]]	Home > National > Jallikattu competition underway in Tamil Nadu	Home > జాతీయం > తమిళనాడులో ఘనంగా ప్రారంభమైన జల్లికట్టు పోటీలు	0.90983754	True	True	తమిళనాడులో జల్లికట్టు పోటీ జరుగుతోంది
47402	[[0.91929907]]	In spite of big defeats in Bihar and West Bengal, Modi has successfully established BJP govt in more than 15 states.	‘బిహార్‌, పశ్చిమ్‌ బెంగాల్‌లో ఓటమి పాలైనప్పటికీ మోదీ నేతృత్వంలోని బీజేపీ 15కు పైగా రాష్ట్రాల్లో ప్రభుత్వాలను ఏర్పాటు చేసింది.	0.91929907	True	True	బిహార్, పశ్చిమ బెంగాల్ లో పెద్ద ఓటమిలు ఉన్నప్పటికీ, మోదీ ద్వారా 15 కంటే ఎక్కువ రాష్ట్రాల్లో బీజేపీ ప్రభుత్వాన్ని సఫలంగా స్థాపించారు.
47453	[[0.93182254]]	Three persons died on the spot in the accident while four other got injured.	ఈ ప్రమాదంలో ముగ్గురు అక్కడికక్కడే మృతి చెందగా, మరో నలుగురు తీవ్రంగా గాయపడ్డారు.	0.93182254	True	True	ఆనాటి ప్రమాదంలో ముగ్గురు ప్రాణాలు కోల్పోయారు, నాలుగు ఇతరులు గాయపడ్డారు.
47455	[[0.91694224]]	Her family members had lodged a complaint with the local police in this connection.	దీంతో ఆమె కుటుంబ సభ్యులు స్థానిక పోలీస్‌ స్టేషన్‌లో ఫిర్యాదు చేశారు.	0.91694224	True	True	ఆమె కుటుంబ సభ్యులు ఈ సందర్భంలో స్థానిక పోలీసులకు ఫిర్యాదు చేశారు.
47474	[[0.9106214]]	In contemporary Persian and Urdu language, the term Hindustan has recently come to mean the Republic of India.	సమకాలీన పెర్షియన్, ఉర్దూ భాషలో, హిందూస్తాన్ అనే పదాన్ని ఇటీవలే రిపబ్లిక్ ఆఫ్ ఇండియా అనే అర్థం ఆపాదిస్తున్నారు.	0.9106214	True	True	ఆధునిక పారసీక మరియు ఉర్దూ భాషల్లో, హిందుస్తాన్ పదం ఇటీవల భారత గణరాజ్యాన్ని సూచిస్తుంది.
47505	[[0.96354395]]	In 2000, 44.2% of children ages 5 to 14 years were attending school.	2000 లో 5 నుండి 14 ఏళ్ల వయస్సులో ఉన్న 44.2% మంది పిల్లలు పాఠశాలకు హాజరయ్యారు.	0.96354395	True	True	2000లో, 5 నుండి 14 ఏళ్ళ పిల్లల్లో 44.2% పాఠశాలకు హాజరయ్యారు.
47593	[[0.90154314]]	How do you discipline or train your children without irritating them?	మీరు మీ పిల్లలకు ‘ కోపము రేపకుండా ’ వారిని ఎలా క్రమశిక్షణలో పెడతారు లేక శిక్షణనిస్తారు?	0.90154314	True	True	మీ పిల్లలను వారిని ఇబ్బంది పెట్టకుండా శిక్షణ ఇవ్వడం లేదా వారిని తరపున ఎలా చేస్తారు?
47599	[[0.9063598]]	As on today, 15 districts in the country which earlier had cases have not reported any fresh cases since the last 28 days.	గతంలో కొన్ని కేసులు నమోదైన దేశంలోని 15 జిల్లాల్లో, గత 28 రోజులు నుండీ ఈ రోజు వరకు, కొత్తగా ఒక్క కేసు కూడా నమోదు కాలేదు.	0.9063598	True	True	ఈ రోజు వరకు, దేశంలో గతంలో కేసులు ఉన్న 15 జిల్లాలు గత 28 రోజులుగా ఏ కొత్త కేసులు నమోదు కాలేదు.
47704	[[0.9103646]]	Power supply in several areas was disrupted owing to the rains.	భారీ వర్షం కారణంగా పలు మండలాల్లో విద్యుత్ సరఫరాకు అం తరాయం కలిగింది.	0.9103646	True	True	వర్షాల కారణంగా అనేక ప్రాంతాల్లో విద్యుత్ సరఫరా ఆపకం అయింది.
47799	[[0.91777]]	Out of these 3,289 ATMs are on-site while the remaining 699 ATMs are off-site.	వీటిలో 3,289 ఏటీఎంలు ఆన్-సైట్ కాగా, మిగిలిన 699 ఏటీఎంలు ఆఫ్-సైట్‌లో ఉన్నాయి.	0.91777	True	True	వీటిలో 3,289 ఎటిఎంలు సైట్ లో ఉండగా, మిగిలిన 699 ఎటిఎంలు ఆఫ్ సైట్ లో ఉన్నాయి.
48048	[[0.9099701]]	Jaipurs last attempt to gain freedom from Gwalior ended in a defeat at the Battle of Malpura.	గ్వాలియరు నుండి స్వేచ్ఛ పొందటానికి జైపూరీయులు చివరి ప్రయత్నంగా మాల్పురా యుద్ధంలో పాల్గొని ఓడిపోయారు.	0.9099701	True	True	జైపూర్ గ్వాలియర్ నుండి స్వాతంత్ర్యం పొందడానికి చివరి ప్రయత్నం మాల్పురా యుద్ధంలో ఓటమితో ముగిసింది.
48064	[[0.92482054]]	So far in the Test series against England, Kohli has accumulated 405 runs	ఇక ప్రస్తుతం ఇంగ్లాండ్‌తో జరుగుతున్న టెస్టు సిరిస్‌లో కోహ్లీ ఇప్పటి వరకు 405 పరుగులు సాధించాడు	0.92482054	True	True	ఇంగ్లాండ్ తో టెస్ట్ సిరీస్ లో ఇప్పటి వరకు కోహ్లీ 405 పరుగులు సంపాదించాడు.
48188	[[0.94713867]]	Shankaracharya Temple stands at a height of 1100 ft above the city surface of Srinagar, on the Shankaracharya Hill popularly known as Takht-e-Suleiman	శంకరాచార్య దేవాలయం తఖ్త్- ఎ-సులేమాన్ అని కూడా పిలవబడే శంకరాచార్య కొండ మీద శ్రీనగర్ నగర ఉపరితలానికి 1100 అడుగుల ఎత్తులో ఉంది	0.94713867	True	True	శంకరాచార్య ఆలయం శ్రీనగర్ నగర ఉపరితలం నుండి 1100 అడుగుల ఎత్తులో, తఖ్తే-సులైమాన్ అని ప్రసిద్ధి చెందిన శంకరాచార్య కొండపై ఉంది.
48298	[[0.9003252]]	Petrol and diesel rates are decided on a daily basis by oil-marketing companies on the basis of the rupee-dollar rate and global crude oil prices.	డాలర్‌తో రూపాయి మారకం విలువ, ప్రపంచ మార్కెట్‌లో ముడి చమురు ధరల ఆధారంగా చమురు మార్కెటింగ్ కంపెనీలు రోజువారీగా పెట్రోల్, డీజిల్ ధరలను నిర్ణయిస్తున్నాయి.	0.9003252	True	True	పెట్రోల్ మరియు డీజిల్ రేట్లు రూపాయి-డాలర్ రేటు మరియు ప్రపంచ క్రూడ్ ఆయిల్ ధరల ఆధారంగా ఆయిల్-మార్కెటింగ్ కంపెనీలు ప్రతిదినం నిర్ణయిస్తాయి.
48331	[[0.91605437]]	Police registered a case and an investigation into the incident has been taken up.	ఈ ఘటనపై కేసు నమోదు చేసుకొని దర్యాప్తు చేపట్టిన్నట్లు పోలీసులు వెల్లడించారు.	0.91605437	True	True	పోలీసు కేసు నమోదు చేసి, ఈ సంఘటనపై దర్యాప్తు ప్రారంభించారు.
48350	[[0.90354013]]	Pooja Hegde is playing the female lead in this movie under the direction of Vamsi Paidipally.	దర్శకుడు వంశీ పైడిపల్లి దర్శకత్వం వహిస్తున్న ఈచిత్రంలో పూజా హెగ్డె హీరోయిన్ గా నటింస్తోంది.	0.90354013	True	True	పూజా హెగ్డే ఈ సినిమాలో వంశీ పైడిపల్లి దర్శకత్వంలో మహిళా ప్రధాన పాత్రను పోషిస్తున్నది.
48376	[[0.91897094]]	This film starred Shraddha Kapoor and Aditya Roy Kapoor.	ఈ సినిమా మాతృక సినిమాలో ఆదిత్య రాయ్ , శ్రద్దా కపూర్ లు నటించారు.	0.91897094	True	True	ఈ చిత్రం శ్రద్ధా కపూర్ మరియు ఆదిత్యా రాయ్ కపూర్ నటించారు.
48401	[[0.9039887]]	The GDP growth fell to 4.5 per cent in July-September period.	దేశీయ స్థూల జాతీయోత్పత్తి (జిడిపి) వృద్ధి రేటు జూలై-సెప్టెంబర్ త్రైమాసికంలో 4.5 శాతానికి పడిపోయింది.	0.9039887	True	True	జూలై-సెప్టెంబర్ కాలంలో జిడిపి వృద్ధి రేటు 4.5 శాతం దిగింది.
48407	[[0.9047]]	Bollywood star Ajay Devgn will play an important role in the film.	ఇక బాలీవుడ్ నటుడు అజయ్ దేవగన్ ఓ కీలక పాత్రలో మెరుస్తారు.	0.9047	True	True	బాలీవుడ్ స్టార్ అజయ్ దేవ్గన్ ఈ సినిమాలో ముఖ్యమైన పాత్ర పోషిస్తాడు.
48425	[[0.9092601]]	Theme: SDG- 3 (Ensure healthy lives and promote well-being for all at all ages) & SDG- 5 (Achieve gender equality and empower all women and girls)	ఇతివృత్తం: ఎస్‌డీజీ- 3 (ఆరోగ్యకరమైన జీవితాలను నిర్ధారించండి మరియు అన్ని వయసుల వారి శ్రేయస్సును ప్రోత్సహించ‌డం) & ఎస్‌డీజీ- 5 (లింగ సమానత్వాన్ని సాధించండి మరియు అంద‌రు మహిళలు మరియు బాలికలను శక్తివంతం చేయండి)	0.9092601	True	True	థీమ్: SDG- 3 (అన్ని వయసుల్లో అందరికీ ఆరోగ్యం కల్పించడం మరియు సమస్త క్షేమం ప్రోత్సహించడం) & SDG- 5 (అన్ని స్త్రీలు మరియు బాలికలకు లింగ సమానత్వం సాధించడం మరియు సబలీకరణ)
48451	[[0.9177202]]	20 Indian soldiers lost lives in the incident.	కాగా ఈ ఘటనలో 20 మంది భారత సైనికులు అమరులైన విషయం విదితమే.	0.9177202	False	True	ఆ సంఘటనలో 20 మంది భారతీయ సైనికులు ప్రాణాలు కోల్పోయారు.
48469	[[0.90737975]]	There were no injuries or casualties in the incident, officials said.	ఘటనలో ఎలాంటి ప్రాణనష్టం సంభవించలేదని, ఎవ్వరికీ ఎలాంటి గాయాలు కాలేదని అధికారులు చెప్పారు.	0.90737975	True	True	సంఘటనలో గాయాలు లేవు, మరణాలు లేవు, అధికారులు చెప్పారు.
48547	[[0.912164]]	Khan has been staying in Mannat with his wife Gauri Khan and children Aryan, Suhana and AbRam.	కాగా, ‘మన్నత్’లో తన భార్య గౌరీ ఖాన్, పిల్లలు ఆర్యన్, సుహానా, అభ్‌రామ్‌తో కలిసి షారుఖ్ ఖాన్ ఉంటున్నారు.	0.912164	True	True	ఖాన్ తన భార్య గౌరీ ఖాన్, పిల్లలు ఆర్యన్, సుహానా, అబ్రామ్ తో మన్నాట్ లో ఉంటున్నాడు.
48572	[[0.9484338]]	Police made tight security arrangements to avoid any untoward incident.	ఎటువంటి అవాంఛనీయ సంఘటనలు జరగకుండా పోలీసులు కట్టుదిట్టమైన భద్రతా ఏర్పాట్లు చేశారు.	0.9484338	True	True	పోలీసు ఏదైనా అనిచ్చిత సంఘటన జరగకుండా కఠిన భద్రతా ఏర్పాట్లు చేసింది.
48597	[[0.9133366]]	The Prime Minister, Shri Narendra Modi has greeted the people of India, on the historic occasion of 1st Constitution Day.	మొట్టమొదటి రాజ్యాంగ ఆమోద దినోత్సవం సందర్భంగా ప్రధాన మంత్రి శ్రీ నరేంద్ర మోదీ దేశ ప్రజలకు శుభాకాంక్షలు తెలిపారు.	0.9133366	True	True	భారత ప్రధాన మంత్రి శ్రీ నరేంద్ర మోదీ భారత ప్రజలను 1వ రాజ్యాంగ దినోత్సవం సందర్భంగా అభినందించారు.
48742	[[0.92405534]]	This video has gone viral on social media.	ఇందుకు సంబంధించిన ఓ వీడియో సోషల్ మీడియాలో వైరల్ గా మారింది.	0.92405534	False	True	ఈ వీడియో సోషల్ మీడియాలో వైరల్ అయింది.
