idx	las	src	tgt	las_score_dbl	src_gt_8_words	tgt_gt_8_words	ollama_trans	ollama_bleu_score	ollama_f1_score	ollama_meteor_score
17332	[[0.90583634]]	The State Government has announced Rs 5 lakh reward on him.	ତା ନାମରେ ରାଜ୍ୟ ସରକାର ୫ଲକ୍ଷ ଟଙ୍କା ପୁରସ୍କାର ରାଶି ଘୋଷଣା କରିଥିଲେ।	0.90583634	True	True	ରାଜ୍ୟ ସରକାର ତାଙ୍କୁ ୫ ଲକ୍ଷ ପୁରସ୍କାର ଘୋଷଣା କରିଛି।	0.0	tensor([0.9875])	0.32206632653061223
17356	[[0.9078942]]	The police seized two motorbikes and a mobile from their possession.	ସେମାନଙ୍କ ନିକଟରୁ ଦୁଇଗୋଟି ମୋବାଇଲ ଓ ଗୋଟିଏ ଛୁରି ଦୁର୍ଘଟଣା ଗ୍ରସ୍ତ ଗାଡ଼ିକୁ ପୋଲିସ ଜବତ୍ କରିଛି ।	0.9078942	True	True	ତାଙ୍କର କବଜାରୁ ପୁଲିସ ଦୁଇଟି ମୋଟରବାଇକ ଏବଂ ଏକ ମୋବାଇଲ ଜବତ କରିଛି।	0.0	tensor([0.9880])	0.036764705882352935
17361	[[0.9171031]]	This was stated by BJP state general secretary Prithiwiraj Harichandan.	ଏନେଇ ବିଜେପି ରାଜ୍ୟ ସାଧାରଣ ସମ୍ପାଦକ ପୃଥ୍ୱୀରାଜ ହରିଚନ୍ଦନ ସୂଚନା ଦେଇଛନ୍ତି ।	0.9171031	True	True	ଏହା ବିଜେପି ରାଜ୍ୟ ସାଧାରଣ ସଚିବ ପୃଥ୍ୱୀରାଜ ହରିଚନ୍ଦନଙ୍କଦ୍ୱାରା କୁହାଯାଇଥିଲା ।	0.0	tensor([0.9956])	0.4505050505050505
17364	[[0.9120833]]	Her glamourous photos often go viral on social media.	ତାଙ୍କ ଗ୍ଲାମରସ୍‌ ଫଟୋ ସୋଶାଲ୍‌ ମିଡିଆରେ ଅନେକ ସମୟରେ ଭାଇରାଲ୍‌ ହୋଇଥାଏ।	0.9120833	True	True	ତାଙ୍କର ଗ୍ଲାମରସ ଫଟୋଗ୍ରାଫଗୁଡ଼ିକ ସୋସିଆଲ ମିଡିଆରେ ବହୁତ ଭାଇରାଲ ହୁଅନ୍ତି।	0.0	tensor([0.9956])	0.05617977528089887
17422	[[0.91196656]]	Nirmala Sitharaman: 'No Better Place To Invest Than In India'	ପୁଞ୍ଜି ନିବେଶ ପାଇଁ ଭାରତ ଠାରୁ ଭଲ ଜାଗା ନାହିଁ: ନିର୍ମଳା ସୀତାରମଣ	0.91196656	True	True	ନିର୍ମଳା ସୀତାରାମନ୍: 'ଭାରତରେ ବିନିଯୋଗ କରିବାକୁ ଅନ୍ୟ କୌଣସି ସ୍ଥାନ ନାହିଁ'	0.0	tensor([0.8888])	0.13513513513513514
17424	[[0.9282628]]	President Ram Nath Kovind and Prime Minister Narendra Modi expressed their grief on Twitter.	ରାଷ୍ଟ୍ରପତି ରାମନାଥ କୋବିନ୍ଦ ଏବଂ ପ୍ରଧାନମନ୍ତ୍ରୀ ନରେନ୍ଦ୍ର ମୋଦୀ ଟ୍ଵିଟ୍‌ କରି ଶୋକ ପ୍ରକାଶ କରିଛନ୍ତି।	0.9282628	True	True	ରାଷ୍ଟ୍ରପତି ରାମନାଥ କୋବିନ୍ଦ ଏବଂ ପ୍ରଧାନମନ୍ତ୍ରୀ ନରେନ୍ଦ୍ର ମୋଦୀ ଟ୍ୱିଟରରେ ତାଙ୍କର ଦୁଃଖ ପ୍ରକାଶ କରିଥିଲେ।	0.53	tensor([1.])	0.6614583333333333
17464	[[0.92925894]]	Prime Minister's Office Address by Prime Minister at the inaugural ceremony of the 16th India-ASEAN Summit Your Excellency Prime Minister Prayut Chan-o-Cha, Excellencies, Your Majesty, I am pleased to meet you once again at the India-ASEAN Summit format.	ପ୍ରଧାନମନ୍ତ୍ରୀଙ୍କ କାର୍ଯ୍ୟାଳୟ 16ତମ ଭାରତ-ଆସିଆନ ଶିଖର ସମ୍ମିଳନୀର ଉଦଘାଟନୀ ସମାରୋହରେ ପ୍ରଧାନମନ୍ତ୍ରୀଙ୍କ ସମ୍ବୋଧନ ମହାମହିମ ପ୍ରଧାନମନ୍ତ୍ରୀ ପ୍ରୟୁତ ଚାନ-ଓ-ଚା, ମହାମହିମ ଗଣ, ମହାଭାଗ, ଭାରତ-ଆସିଆନ ଶିଖର ସମ୍ମିଳନୀରେ ଆପଣମାନଙ୍କ ସହ ଆଉ ଥରେ ଭେଟ ହେବା ନେଇ ମୁଁ ଖୁସି ଅନୁଭବ କରୁଛି ।	0.92925894	True	True	ପ୍ରଧାନମନ୍ତ୍ରୀ କାର୍ଯ୍ୟାଳୟର ଭାଷଣ ପ୍ରଧାନମନ୍ତ୍ରୀଙ୍କଦ୍ୱାରା ୧୬ତମ ଭାରତ-ଆସିଆନ ଶୀର୍ଷକ ଉଦ୍‌ଘାଟନ ଅନୁଷ୍ଠାନରେ ମାନ୍ୟବର ପ୍ରଧାନମନ୍ତ୍ରୀ ପ୍ରୟୁତ ଚାନ-ଓ-ଚା, ମାନ୍ୟବରମାନେ, ଆପଣଙ୍କୁ ପୁନର୍ବାର ଭାରତ-ଆସିଆନ ଶୀର୍ଷକ ଫରମାଟରେ ମିଳିବାକୁ ଆନନ୍ଦିତ।	0.07	tensor([0.9729])	0.1693636034295375
17512	[[0.9285724]]	He couldnt even stand properly.	ଏପରି କି ଠିକ୍‌ ଭାବରେ ଛିଡା ବି ହୋଇ ପାରି ନଥିଲେ।	0.9285724	False	True	ସେ ସରିଥିଲେ ଠିକ୍ ଦାଢ଼ି ହେବାରେ ମଧ୍ୟ ଅସମର୍ଥ ଥିଲେ।	0.0	tensor([0.9956])	0.0
17549	[[0.90552783]]	Cabinet Cabinet approves Air Services Agreement between India and Georgia The Union Cabinet chaired by the Prime Minister Shri Narendra Modi has approved the signing of the Air Services Agreement (ASA) between India and Georgia.	Cabinet ଭାରତ-ଜର୍ଜିଆ ମଧ୍ୟରେ ବିମାନ ସେବା ଚୁକ୍ତିକୁ କ୍ୟାବିନେଟର ଅନୁମୋଦନ ପ୍ରଧାନମନ୍ତ୍ରୀ ଶ୍ରୀ ନରେନ୍ଦ୍ର ମୋଦୀଙ୍କ ଅଧ୍ୟକ୍ଷତାରେ ଅନୁଷ୍ଠିତ କ୍ୟାବିନେଟ ବୈଠକରେ ଭାରତ ଓ ଜର୍ଜିଆ ମଧ୍ୟରେ ବିମାନ ସେବା ଚୁକ୍ତିକୁ ଅନୁମୋଦନ ମିଳିଛି ।	0.90552783	True	True	ଭାରତ ଓ ଜର୍ଜିଆ ମଧ୍ୟରେ ବାୟୁ ସେବା ଆନୁମୋଦନା ପାଇଁ କେନ୍ଦ୍ରୀୟ ମନ୍ତ୍ରୀମଣ୍ଡଳ ଅନୁମୋଦନ କରିଛି ।	0.08	tensor([0.9317])	0.2569610840287532
17573	[[0.92325425]]	And, in this fiscal year, we have launched a 15 billion U.S. dollar programme, to further strengthen our higher education system.	ଏବଂ, ଏହି ଆର୍ଥିକ ବର୍ଷରେ, ଆମେ ଏକ 15 ବିଲିୟନ ଆମେରିକୀୟ ଡଲାର କାର୍ଯ୍ୟକ୍ରମ ଶୁଭାରମ୍ଭ କରିଛୁ, ଆମର ଉଚ୍ଚଶିକ୍ଷା ବ୍ୟବସ୍ଥାକୁ ଆହୁରି ସୁଦୃଢ଼ କରିବା ଉଦ୍ଦେଶ୍ୟରେ ।	0.92325425	True	True	ଏହି ଆର୍ଥିକ ବର୍ଷରେ, ଆମେ ୧୫ ବିଲିୟନ ଆମେରିକୀ ଡଲାରର ଏକ କାର୍ଯ୍ୟକ୍ରମ ଆରମ୍ଭ କରିଛୁ, ଆମ ଉଚ୍ଚ ଶିକ୍ଷା ବ୍ୟବସ୍ଥାକୁ ଅଧିକ ଶକ୍ତିଶାଳୀ କରିବା ପାଇଁ।	0.19	tensor([0.9668])	0.45416083099906623
17605	[[0.93011796]]	Indias northern border is aligned with China and the western border with Pakistan.	ଭାରତର ଉତ୍ତର ସୀମା ଚୀନ ଓ ପଶ୍ଚିମ ସୀମା ପାକିସ୍ତାନକୁ ଲାଗି ରହିଛି।	0.93011796	True	True	ଭାରତର ଉତ୍ତର ସୀମା ଚୀନ ସହିତ ଏବଂ ପଶ୍ଚିମ ସୀମା ପାକିସ୍ତାନ ସହିତ ସମାନ୍ତରାଳୀ ।	0.25	tensor([0.9977])	0.5773420479302832
17721	[[0.92467797]]	Many countries are now celebrating Baba Ambedkar Jayanti, Mahatma Gandhi Jayanti.	ବହୁ ରାଷ୍ଟ୍ର ଆଜି ବାବା ସାହେବ ଆମ୍ବେଦକର ଜୟନ୍ତୀ, ମହାତ୍ମା ଗାନ୍ଧୀ ଜୟନ୍ତୀ ପାଳନ କରୁଛନ୍ତି ।	0.92467797	True	True	ବହୁ ଦେଶ ଏବେ ବାବା ଆମ୍ବେଦକର ଜୟନ୍ତୀ, ମହାତ୍ମା ଗାନ୍ଧୀ ଜୟନ୍ତୀ ପାଳନ କରୁଛନ୍ତି।	0.46	tensor([0.9967])	0.640096618357488
17785	[[0.9064715]]	He said all medical expenses would be borne by the state government.	ଏ ସଂକ୍ରାନ୍ତ ସମସ୍ତ ଚିକିତ୍ସା ଖର୍ଚ୍ଚ ରାଜ୍ୟ ସରକାର ବହନ କରିବେ ବୋଲି ସେ କହିଛନ୍ତି।	0.9064715	True	True	ସେ କହିଲେ ରାଜ୍ୟ ସରକାର ସମସ୍ତ ଚିକିତ୍ସା ଖର୍ଚ୍ଚ ବହନ କରିବ।	0.0	tensor([0.9826])	0.5424733996162567
17806	[[0.90114415]]	Prime Minister's Office Prime Minister Modi, Chancellor Merkel co-chair 4th India Germany Inter-Govermental Consultations in Berlin The Prime Minister, Shri Narendra Modi, and German Chancellor Angela Merkel today co-chaired the 4th India Germany Inter-Govermental Consultations in Berlin.	Prime inister's Office ପ୍ରଧାନମନ୍ତ୍ରୀ ମୋଦୀ, ଚାନ୍ସେଲର ମର୍କେଲ୍ ଙ୍କ ଯୁଗ୍ମ ଅଧ୍ୟକ୍ଷତାରେ ବର୍ଲିନ୍ ଠାରେ ଅନୁଷ୍ଠିତ ହେଲା ଚତୁର୍ଥ ଭାରତ-ଜର୍ମାନୀ ଆନ୍ତଃସରକାରୀ ଆଲୋଚନା ପ୍ରଧାନମନ୍ତ୍ରୀ ଶ୍ରୀ ନରେନ୍ଦ୍ର ମୋଦୀ ଏବଂ ଜର୍ମାନୀ ଚାନ୍ସେଲର ଆଞ୍ଜେଲା ମର୍କେଲ ବର୍ଲିନ୍ ଠାରେ ମଙ୍ଗଳବାର ଦିନ ଚତୁର୍ଥ ଭାରତ-ଜର୍ମାନୀ ଆନ୍ତଃସରକାର ବିଚାର-ଆଲୋଚନା କାର୍ଯ୍ୟକ୍ରମରେ ମିଳିତ ଭାବେ ଅଧ୍ୟକ୍ଷତା କରିଥିଲେ ।	0.90114415	True	True	ପ୍ରଧାନମନ୍ତ୍ରୀ କାର୍ଯ୍ୟାଳୟ ପ୍ରଧାନମନ୍ତ୍ରୀ ମୋଦୀ, ଜର୍ମାନୀ ଚାନ୍ସେଲର୍ ମେର୍କେଲ୍ ବର୍ଲିନ୍‌ରେ ୪ର୍ଥ ଭାରତ-ଜର୍ମାନୀ ଆନ୍ତର୍ଜାତୀୟ ସରକାରୀ ପରାମର୍ଶରେ ସହ-ଅଧ୍ୟକ୍ଷତା କରିଥିଲେ ।	0.0	tensor([0.9089])	0.13169090346534654
17895	[[0.9366646]]	The meeting was chaired by BJP national president Amit Shah and Prime Minister Narendra Modi.	ବୈଠକକୁ ପ୍ରଧାନମନ୍ତ୍ରୀ ନରେନ୍ଦ୍ର ମୋଦି ଓ ବିଜେପି ରାଷ୍ଟ୍ରୀୟ ଅଧ୍ୟକ୍ଷ ଅମିତ ଶାହା ସମ୍ବୋଧିତ କରିଛନ୍ତି ।	0.9366646	True	True	ବିଜେପି ଜାତୀୟ ଅଧ୍ୟକ୍ଷ ଅମିତ ଶାହା ଏବଂ ପ୍ରଧାନମନ୍ତ୍ରୀ ନରେନ୍ଦ୍ର ମୋଦୀଙ୍କଦ୍ୱାରା ଏହି ବୈଠକଟି ଅଧ୍ୟକ୍ଷତା କରାଯାଇଥିଲା ।	0.0	tensor([0.9987])	0.48449914316871784
17928	[[0.91905254]]	The 296 Km long Expressway is expected to benefit Chitrakoot, Banda, Mahoba, Hamirpur, Jaloun, Oraiyah and Etawah districts.	296 କିଲୋମିଟର ଦୀର୍ଘ ଏକ୍ସପ୍ରେସୱେ ଚିତ୍ରକୁଟ, ବାନ୍ଦା, ମହୋବା, ହମିରପୁର, ଜାଲୌନ, ଔରୈୟା ଏବଂ ଇଟାୱା ଜିଲ୍ଲାଗୁଡିକ ପାଇଁ ଲାଭଦାୟକ ହେବ ।	0.91905254	True	True	ଏହି ୨୯୬ କିଲୋମିଟର ଦୀର୍ଘ ଏକ୍ସପ୍ରେସୱେ ଚିତ୍ରକୂଟ, ବାନ୍ଦା, ମହୋବା, ହାମିରପୁର, ଜାଲୌନ, ଓରାଇଆହ ଏବଂ ଏତାହ ଜିଲ୍ଲାଗୁଡିକୁ ଉପକୃତ କରିବାକୁ ଆଶା କରାଯାଏ ।	0.25	tensor([0.9630])	0.5689269150807611
17979	[[0.9351015]]	Swaraj was the second woman to hold the office of Minister of External Affairs of India after Indira Gandhi.	ଇନ୍ଦିରା ଗାନ୍ଧୀଙ୍କ ପରେ ସ୍ୱରାଜ ହେଉଛନ୍ତି ଦ୍ୱିତୀୟ ମହିଳା ଯିଏକି ଭାରତର ବୈଦେଶିକ ବ୍ୟାପାର ମନ୍ତ୍ରୀ ରୂପେ ଦାୟିତ୍ୱ ନେଇଥିଲେ।	0.9351015	True	True	ସ୍ୱରାଜ ଭାରତର ବାହ୍ୟ ବ୍ୟାପାର ମନ୍ତ୍ରୀ ପଦବୀରେ ଇନ୍ଦିରା ଗାନ୍ଧୀ ପରେ ଦ୍ୱିତୀୟ ମହିଳା ଥିଲେ ।	0.0	tensor([0.9930])	0.42652027027027023
18005	[[0.90376353]]	There are several unanswered questions but I am sure you would find the answers.	ଅନେକ ଅସମାହିତ ପ୍ରଶ୍ନ ରହିଥିଲା ମାତ୍ର ମୁଁ ନିଶ୍ଚିତ ଯେ ଆପଣମାନେ ଏହାର ଉତ୍ତର ପାଇବେ ।	0.90376353	True	True	ଅନେକ ଅଜବାବ ପ୍ରଶ୍ନ ଅଛି, କିନ୍ତୁ ଆପଣ ଉତ୍ତର ପାଇବେ।	0.0	tensor([0.9047])	0.11904761904761907
18022	[[0.92042434]]	After the GST was implemented, the first bill in the country was released in the Big Bazaar of Mumbai.	ଜିଏସ୍‌ଟି ଲାଗୁ ହେବା ପରେ ଦେଶର ପ୍ରଥମ ବିଲ୍‌ ମୁମ୍ବାଇର ଏକ ବିଗ୍‌ ବଜାରରେ ଦିଆଯାଇଛି।	0.92042434	True	True	ଜିଏସଟି ଲାଗୁ ହେବା ପରେ, ମୁମ୍ବାଇର ବିଗ୍ ବାଜାରରେ ଦେଶରେ ପ୍ରଥମ ବିଲ୍ ରିଲିଜ୍ ହୋଇଥିଲା।	0.0	tensor([0.9602])	0.368595041322314
18093	[[0.9049715]]	She died during treatment late last night.	ସେଠାରେ ଚିକିତ୍ସାଧୀନ ଅବସ୍ଥାରେ ଗତକାଲି ବିଳମ୍ବିତ ରାତିରେ ତା’ର ମୃତ୍ୟୁ ଘଟିଥିଲା।	0.9049715	False	True	ସେ ଗତ ରାତିରେ ଚିକିତ୍ସା ସମୟରେ ମୃତ୍ୟୁ ବରଣ କରିଥିଲେ।	0.0	tensor([0.9775])	0.09345794392523364
18206	[[0.9456193]]	After the incident local people informed the police.	ଘଟଣା ଘଟିବା ପରେ ସ୍ଥାନୀୟ ଲୋକେ ପୋଲିସକୁ ଖବର ଦେଇଥିଲେ ।	0.9456193	False	True	ଘଟଣା ପରେ ସ୍ଥାନୀୟ ଲୋକମାନେ ପୁଲିସକୁ ସୂଚନା ଦେଲେ।	0.0	tensor([0.9951])	0.29040404040404044
18271	[[0.9127953]]	In addition to this, free electricity connections to nearly 3 lakh people of Rajasthan have been given under the Saubhagya Scheme in just one year.	ଏତଦବ୍ୟତୀତ କେବଳ ବର୍ଷକ ମଧ୍ୟରେ ରାଜସ୍ଥାନର ପାଖାପାଖି 3 ଲକ୍ଷ ଜନସାଧାରଣଙ୍କୁ ସୌଭାଗ୍ୟ ଯୋଜନା ମାଧ୍ୟମରେ ମୁକ୍ତ ବିଜୁଳି ସଂଯୋଗ ପ୍ରଦାନ କରାଯାଇ ସାରିଛି ।	0.9127953	True	True	ଏହାର ଅତିରିକ୍ତ, ସୌଭାଗ୍ୟ ଯୋଜନା ଅନ୍ତର୍ଗତ ରାଜସ୍ଥାନର ପ୍ରାୟ ୩ ଲକ୍ଷ ଲୋକଙ୍କୁ ମାତ୍ର ଏକ ବର୍ଷରେ ନିଃଶୁଳ୍କ ବିଦ୍ୟୁତ୍ ସଂଯୋଗ ପ୍ରଦାନ କରାଯାଇଛି।	0.0	tensor([0.9613])	0.26900584795321636
18330	[[0.91138536]]	She was immediately brought to Sir Ganga Ram Hospital in Delhi .	ତାଙ୍କୁ ତୁରନ୍ତ ଦିଲ୍ଲୀ ସ୍ଥିତ ଶ୍ରୀ ଗଙ୍ଗାରାମ ମେଡିକାଲରେ ଭର୍ତ୍ତି କରାଯାଇଥିଲା।	0.91138536	True	True	ସେ ଦିଲ୍ଲୀରେ ସର ଗଙ୍ଗା ରାମ ହସ୍ପାତାଲକୁ ତକ୍ଷଣ ଆଣିହେଲେ ।	0.0	tensor([0.9956])	0.0
18386	[[0.9020933]]	Prime Minister Narendra Modi in an interview with Times Now has shared his views on a range of issues.	ପ୍ରଧାନମନ୍ତ୍ରୀ ଶ୍ରୀ ନରେନ୍ଦ୍ର ମୋଦୀ ଟାଇମ୍ସ ନାଓ ଚ୍ୟାନେଲକୁ ଦେଇଥିବା ଏକ ସାକ୍ଷାତକାରରେ ବିଭିନ୍ନ ପ୍ରସଙ୍ଗ ଉପରେ ନିଜର ମତ ରଖିଛନ୍ତି ।	0.9020933	True	True	ଟାଇମ୍ସ୍ ନାୱ୍ ସହିତ ଏକ ସାକ୍ଷାତ୍କାରରେ ପ୍ରଧାନମନ୍ତ୍ରୀ ନରେନ୍ଦ୍ର ମୋଦୀ ବିଭିନ୍ନ ମୁଦ୍ଦାରେ ନିଜର ମତାମତ ପ୍ରକାଶ କରିଛନ୍ତି।	0.0	tensor([0.9965])	0.25532268795741847
18463	[[0.9399159]]	Pakistan Foreign Minister Shah Mehmood Qureshi said, Prime Minister Imran Khan has reached the US.	ପାକିସ୍ତାନ ବୈଦେଶିକ ମନ୍ତ୍ରୀ ଶାହା ମହମ୍ମଦ କୁରେଶି କହିଛନ୍ତି ପ୍ରଧାନମନ୍ତ୍ରୀ ଇମ୍ରାନ ଖାନ୍ ଆମେରିକାରେ ପହଞ୍ଚିସାରିଛନ୍ତି ।	0.9399159	True	True	ପାକିସ୍ତାନ ବିଦେଶ ମନ୍ତ୍ରୀ ଶାହମହମୂଦ୍ କୁରେଶୀ କହିଲେ, ପ୍ରଧାନମନ୍ତ୍ରୀ ଇମ୍ରାନ୍ ଖାନ୍ ଆମେରିକାକୁ ପହଞ୍ଚିଛନ୍ତି।	0.0	tensor([0.9488])	0.15503875968992248
18480	[[0.9106906]]	The police handed over the body of the deceased to the family after post-mortem.	ମୃତଦେହ ବ୍ୟବଛେଦ ପରେ ପୁଲିସ ମୃତଦେହକୁ ପରିବାର ଲୋକଙ୍କୁ ହସ୍ତାନ୍ତରିତ କରିଥିଲା।	0.9106906	True	True	ମୃତକରେ ପୋଷ୍ଟମର୍ଟମ ପରେ ପୁଲିସ ପରିବାରକୁ ମୃତଦେହ ହସ୍ତାନ୍ତରିତ କରିଥିଲେ।	0.0	tensor([0.9956])	0.3546348314606741
18529	[[0.90368074]]	My heartfelt condolences to the families of the victims of the terror attack in Jalalabad city of Afghanistan.	ଆଫଗାନିସ୍ତାନର ଜଲାଲାବାଦ ସହର ଆତଙ୍କ ଆକ୍ରମଣରେ ଶିକାର ହୋଇଥିବା ବ୍ୟକ୍ତିମାନଙ୍କ ପରିବାରବର୍ଗଙ୍କୁ ମୋର ଗଭୀର ସମ୍ବେଦନା।	0.90368074	True	True	ଆଫଗାନିସ୍ଥାନର ଜାଲାଲାବାଦ ସହରରେ ଆତଙ୍କବାଦୀ ଆକ୍ରମଣର ଶିକାର ପରିବାରମାନଙ୍କୁ ମୋର ହୃଦୟର ସମବେଦନା।	0.0	tensor([0.9929])	0.0847457627118644
18539	[[0.92313755]]	About Rs 10 crore would be invested on it.	ଏଥିରେ ପ୍ରାୟ ୧୦ ହଜାର କୋଟି ଟଙ୍କା ନିବେଶ କରାଯିବ ।	0.92313755	True	True	ଏଥିରେ ପ୍ରାୟ ୧୦ କୋଟି ଟଙ୍କା ବିନିଯୋଗ ହେବ ।	0.0	tensor([0.9951])	0.6320224719101123
18598	[[0.9162512]]	She has worked in numerous films throughout her career.	ସେ ତାଙ୍କ ଅଭିନୟ କ୍ୟାରିୟର ମଧ୍ୟରେ ଅନେକ ଫିଲ୍ମରେ କାମ କରିଛନ୍ତି।	0.9162512	True	True	ସେ ତାଙ୍କ କ୍ୟାରିଅର୍ ମଧ୍ୟରେ ଅନେକ ଚଳଚ୍ଚିତ୍ରରେ କାମ କରିଛନ୍ତି।	0.0	tensor([0.9956])	0.6320224719101123
18649	[[0.9498147]]	Prime Minister Narendra Modi is likely to attend the swearing-in ceremony.	ଶପଥ ଗ୍ରହଣ ସମାରୋହରେ ପ୍ରଧାନମନ୍ତ୍ରୀ ନରେନ୍ଦ୍ର ମୋଦି ଯୋଗ ଦେବାର ସମ୍ଭାବନା ରହିଛି।	0.9498147	True	True	ପ୍ରଧାନମନ୍ତ୍ରୀ ନରେନ୍ଦ୍ର ମୋଦୀ ଶପଥ ଗ୍ରହଣ ସମାରୋହରେ ଉପସ୍ଥିତ ହେବେ ।	0.0	tensor([0.9875])	0.48888888888888893
18650	[[0.9274637]]	Chief Minister Yogi Adityanath condoled the deaths in the accident and expressed sympathies to the bereaved families.	ମୁଖ୍ୟମନ୍ତ୍ରୀ ଯୋଗୀ ଆଦିତ୍ୟନାଥ ଦୁର୍ଘଟଣା ପାଇଁ ଦୁଃଖପ୍ରକାଶ କରିବା ସହିତ ମୃତକଙ୍କ ପରିବାରବର୍ଗଙ୍କୁ ସମବେଦନା ଜଣାଇଛନ୍ତି।	0.9274637	True	True	ମୁଖ୍ୟମନ୍ତ୍ରୀ ଯୋଗୀ ଆଦିତ୍ୟନାଥ ଦୁର୍ଘଟଣାରେ ହୋଇଥିବା ମୃତ୍ୟୁକୁ ଶୋକ ପ୍ରକାଶ କରିଥିଲେ ଏବଂ ଶୋକସନ୍ତପ୍ତ ପରିବାରମାନଙ୍କୁ ସାନ୍ତ୍ୱନା ପ୍ରକାଶ କରିଥିଲେ।	0.0	tensor([0.9930])	0.23938572719060525
18652	[[0.9311616]]	Indonesia Separated by a mere 90 nautical miles in the Indian Ocean, India and Indonesia share a continuity of civilizational relationship that spans over two millennia.	ଇଣ୍ଡୋନେସିଆ ଭାରତ ମହାସାଗରରେ କେବଳ 90 ନଟିକାଲ ମାଇଲ ଦୂରତ୍ୱରେ ବିଚ୍ଛିନ୍ନ ହୋଇଥିବା ଭାରତ ଓ ଇଣ୍ଡୋନେସିଆ ଦୁଇ ସହସ୍ରାବ୍ଦୀରୁ ଅଧିକ କାଳ ଧରି ସଭ୍ୟତା ଆଧାରିତ ସମ୍ପର୍କର ନିରନ୍ତରତାରେ ଭାଗିଦାରୀ ଅଟନ୍ତି ।	0.9311616	True	True	ଭାରତ ଓ ଇଣ୍ଡୋନେସିଆ ଭାରତୀୟ ମହାସାଗରରେ ୯୦ ନଟିକାଲ ମାଇଲରେ ପୃଥକ୍ ହୋଇଥିବା ବେଳେ ଦୁଇ ସହସ୍ରାବ୍ଦୀ ପର୍ଯ୍ୟନ୍ତ ସଭ୍ୟତାଗତ ସମ୍ବନ୍ଧ ଭାଗିଦାରୀ କରିଥାନ୍ତି ।	0.0	tensor([0.9690])	0.2820785266140457
18657	[[0.9520233]]	But no action was taken by the police against the accused.	କିନ୍ତୁ ଦୋଷୀଙ୍କ ବିରୋଧରେ ପୁଲିସ କୌଣସି କାର୍ଯ୍ୟାନୁଷ୍ଠାନ ଗ୍ରହଣ କରି ନ ଥିଲା।	0.9520233	True	True	ଅଭିଯୁକ୍ତଙ୍କ ବିରୁଦ୍ଧରେ ପୁଲିସଙ୍କଦ୍ୱାରା କୌଣସି କାର୍ଯ୍ୟ ନେଇନଥିଲା।	0.0	tensor([0.9438])	0.05208333333333333
18737	[[0.9045104]]	Rainfall at many places very likely over north Andhra Pradesh and south Odisha during 7th to 9th December, 2017 with isolated heavy falls on 8th and 9th.	ଡ଼ିସେମ୍ବର 7 ତାରିଖ ଠାରୁ 9 ତାରିଖ 2017 ପର୍ଯ୍ୟନ୍ତ ଉତ୍ତର ଆନ୍ଧ୍ର ପ୍ରଦେଶ ଏବଂ ଦକ୍ଷିଣ ଓଡ଼ିଶାର ଅଧିକାଂଶ ସ୍ଥାନରେ ବର୍ଷା ଏବଂ ଡ଼ିସେମ୍ବର 8 ଏବଂ 9ରେ କେତେକ ସ୍ଥାନରେ ପ୍ରବଳ ବର୍ଷା ହେବାର ଆଶଙ୍କା ରହିଛି ।	0.9045104	True	True	୨୦୧୭ ଡିସେମ୍ବର ୭ରୁ ୯ରେ ଉତ୍ତର ଆନ୍ଧ୍ର ପ୍ରଦେଶ ଓ ଦକ୍ଷିଣ ଓଡ଼ିଶାରେ ଅନେକ ସ୍ଥାନରେ ବର୍ଷା ସମ୍ଭାବନା, ୮ରେ ଓ ୯ରେ ପୃଥକ୍ ସ୍ଥାନରେ ଭାରୀ ବର୍ଷା ସମ୍ଭାବନା।	0.0	tensor([0.9081])	0.2397077645051194
18738	[[0.9237852]]	No casualty, however, has been reported in the fire.	ତେବେ ଏହି ଅଗ୍ନିକାଣ୍ଡରେ କୌଣସି କ୍ଷୟକ୍ଷତି ହୋଇଥିବା ସୂଚନା ମିଳି ପାରି ନାହିଁ ।	0.9237852	True	True	ଅଗ୍ନିରେ କୌଣସି ହାନି ହୋଇନାହିଁ ।	0.0	tensor([0.8757])	0.09615384615384616
18825	[[0.91171354]]	Prime Minister's Office PM greets people of Telangana, on the Statehood Day Extends wishes to people of Andhra Pradesh PM greets people of Telangana, on the Statehood Day Extends wishes to people of Andhra Pradesh The Prime Minister, Shri Narendra Modi, has greeted the people of Telangana, on the Statehood Day.	Prime inister's Office ରାଜ୍ୟ ସ୍ଥାପନା ଦିବସରେ ତେଲଙ୍ଗାନା ଜନସାଧାରଣଙ୍କୁ ପ୍ରଧାନମନ୍ତ୍ରୀଙ୍କ ଶୁଭେଚ୍ଛା. ଆନ୍ଧ୍ରପ୍ରଦେଶକୁ ମଧ୍ୟ ଜଣାଇଲେ ଅଭିନନ୍ଦନ ପ୍ରଧାନମନ୍ତ୍ରୀ ଶ୍ରୀ ନରେନ୍ଦ୍ର ମୋଦୀ ରାଜ୍ୟ ସ୍ଥାପନା ଦିବସ ଅବସରରେ ତେଲଙ୍ଗାନାର ଜନସାଧାରଣଙ୍କୁ ଶୁଭେଚ୍ଛା ଜଣାଇଛନ୍ତି ।	0.91171354	True	True	ପ୍ରଧାନମନ୍ତ୍ରୀ କାର୍ଯ୍ୟାଳୟ: ପ୍ରଧାନମନ୍ତ୍ରୀ ତେଲଙ୍ଗାନାର ଲୋକଙ୍କୁ ରାଜ୍ୟତ୍ୱ ଦିବସରେ ଅଭିନନ୍ଦନ କରିଛନ୍ତି, ଆନ୍ଧ୍ରପ୍ରଦେଶର ଲୋକଙ୍କୁ ଶୁଭେଚ୍ଛା ଜଣାଇଛନ୍ତି ।	0.0	tensor([0.8622])	0.20666028144109633
