idx	las	src	tgt	las_score_dbl	src_gt_8_words	tgt_gt_8_words	ollama_trans	ollama_bleu_score	ollama_f1_score	ollama_meteor_score
28018	[[0.90065926]]	However, under the recent rule implemented by the Chinese administration, air travel from India stands indefinitely suspended.	କିନ୍ତୁ ଚୀନ ପ୍ରଶାସନ ଦ୍ଵାରା ବର୍ତ୍ତମାନ ଲାଗୁ ହୋଇଥିବା ନିୟମ ଆଧାରରେ ଭାରତରୁ ବିମାନ ଯାତ୍ରା ଅନିଶ୍ଚିତକାଳ ପର୍ଯ୍ୟନ୍ତ ସ୍ଥଗିତ ରହିଛି।	0.90065926	True	True	ତଥାପି, ଚୀନ ପ୍ରଶାସନର ନୂତନ ନିୟମ ଅନୁସାରେ, ଭାରତରୁ ବାୟୁ ଯାତ୍ରା ଅନିର୍ଦ୍ଦିଷ୍ଟ କାଳରେ ସ୍ଥଗିତ ରହିଛି।	0.0	tensor([0.9298])	0.26816911250873515
28037	[[0.9003622]]	The upcoming biopic on Prime Minister Narendra Modi will feature Vivek Oberoi in the titular role.	ପ୍ରଧାନମନ୍ତ୍ରୀ ନରେନ୍ଦ୍ର ମୋଦିଙ୍କ ବାୟୋପିକ୍ରେ ବିବେକ୍ ଓବରୟ ମୋଦିଙ୍କ ଭୂମିକାରେ ପରଦା ଉପରକୁ ଆସିବେ ।	0.9003622	True	True	ପ୍ରଧାନମନ୍ତ୍ରୀ ନରେନ୍ଦ୍ର ମୋଦୀଙ୍କ ଉପରେ ଆସନ୍ତୀ ଜୀବନୀ ଚଳଚ୍ଚିତ୍ରରେ ଭୂମିକାରେ ବିବେକ ଓବେରୟଙ୍କୁ ଦେଖାଯିବ ।	0.0	tensor([1.])	0.2630208333333333
28063	[[0.9329386]]	He said action would be taken after the inquiry.	ତଦନ୍ତ ପରେ ପଦକ୍ଷେପ ନିଆଯିବ ବୋଲି ସେ ସୂଚନା ଦେଇଛନ୍ତି ।	0.9329386	True	True	ସେ କହିଲେ ଅନୁସନ୍ଧାନ ପରେ କାର୍ଯ୍ୟ ନିଆଯାଇବ ।	0.0	tensor([0.9790])	0.17045454545454547
28114	[[0.9195862]]	Actress Pooja Bedi's daughter Alaia F and actor Saif Ali Khan have started shooting for Jawaani Jaaneman.	ଅଭିନେତ୍ରୀ ପୂଜା ବେଦୀଙ୍କ ଝିଅ ଆଲିଆ ଓ ଅଭିନେତା ସୈଫ୍‌ ଅଲ୍ଲୀ ଖାନ୍‌ ଅପକମିଙ୍ଗ ଫିଲ୍ମ ’ଜଓ୍ବାନୀ ଜାନେମାନ୍‌’ର ଶୁଟିଂ ଆରମ୍ଭ କରି ଦେଇଛନ୍ତି ।	0.9195862	True	True	ଅଭିନେତ୍ରୀ ପୂଜା ବେଦୀଙ୍କ ଝିଅ ଆଲାଇଆ ଏଫ ଏବଂ ଅଭିନେତା ସୈଫ ଆଲୀ ଖାନ ଜାୱାନୀ ଜାନେମାନରେ ଶୁଟିଂ ଆରମ୍ଭ କରିଛନ୍ତି।	0.16	tensor([0.9907])	0.3142284951363723
28130	[[0.92601776]]	She is also a member of the Institute of Chartered Accountants of India (ICAI).	ଏହାସହ ସେ ଇନ୍ଷ୍ଟିଚୁ୍ୟଟ୍ ଅଫ୍ ଚାର୍ଟର୍ଡ ଆକାଉଣ୍ଟାଣ୍ଟ ଅଫ୍ ଇଣ୍ଡିଆ (ଆଇସିଏଆଇ)ର ସଦସ୍ୟ ମଧ୍ୟ ଅଛନ୍ତି ।	0.92601776	True	True	ସେ ଭାରତର ଚାର୍ଟର୍ଡ ଆକାଉଣ୍ଟାଣ୍ଟସ୍ ଇନ୍‌ଷ୍ଟିଚ୍ୟୁଟର (ଆଇସିଆଇ) ଏକ ସଦସ୍ୟା ମଧ୍ୟ ଅଟନ୍ତି ।	0.0	tensor([0.9816])	0.19108280254777069
28150	[[0.9047843]]	No note has been recovered from the scene, the police said.	ଘଟଣାସ୍ଥଳରୁ କୌଣସି ସୁଇସାଇଡ୍ ନୋଟ୍‌ ଜବତ ହୋଇନଥିବା ପୋଲିସ କହିଛି ।	0.9047843	True	True	ଦୃଶ୍ୟରୁ କୌଣସି ନୋଟ୍ ଉଦ୍ଧାର ହୋଇନାହିଁ, ପୁଲିସ୍ କହିଲେ।	0.0	tensor([0.9470])	0.05617977528089887
28164	[[0.9516916]]	Thereafter the police arrived on the spot and sent the body for postmortem.	ଏହା ପରେ ଘଟଣାସ୍ଥଳରେ ପୋଲିସ୍ ପହଞ୍ଚି ଶବକୁ ପୋଷ୍ଟମର୍ଟମ୍ ପାଇଁ ପଠାଇଥିଲେ।	0.9516916	True	True	ତାପରେ ପୁଲିସ୍ ସ୍ଥାନରେ ଆସିଲେ ଏବଂ ମୃତଦେହକୁ ପୋଷ୍ଟମର୍ଟମ୍ ପାଇଁ ପଠାଇଲେ।	0.0	tensor([1.0000])	0.20833333333333331
28189	[[0.9113363]]	The Jammu and Kashmir Police has started investigating the case.	ଏନେଇ ଜାମ୍ମୁ ଓ କାଶ୍ମୀର ପୋଲିସ ଘଟଣାର ଯାଞ୍ଚ ଅାରମ୍ଭ କରିଛି।	0.9113363	True	True	ଜାମ୍ମୁ ଓ କାଶ୍ମୀର ପୁଲିସ ଏହି କେସର ତଦନ୍ତ ଆରମ୍ଭ କରିଛି।	0.0	tensor([1.0000])	0.41666666666666663
28227	[[0.9378451]]	1 prevented this site from opening a pop-up window. Would you like to show it?.#1 prevented this site from opening #2 pop-up windows. Would you like to show them?	1 ଏହି ସାଇଟକୁ ପପଅପ ୱିଣ୍ଡୋ ଖୋଲିବାରୁ ବାରଣ କରିଛି। ଆପଣ ଏହାକୁ ଦର୍ଶାଇବାକୁ ଚାହୁଁଛନ୍ତି କି?.#1 ଏହି ସାଇଟକୁ #2 ପପଅପ ୱିଣ୍ଡୋଗୁଡ଼ିକୁ ଖୋଲିବାରୁ ବାରଣ କରିଛି। ଆପଣ ସେଗୁଡ଼ିକୁ ଦର୍ଶାଇବାକୁ ଚାହୁଁଛନ୍ତି କି?	0.9378451	True	True	"""Here are the translations: 1. ଏହି ସାଇଟକୁ ଏକ ପପ୍-ଅପ୍ ୱିଣ୍ଡୋ ଖୋଲିବାକୁ ଆମେ ରୋକିଦେଲି । ଆପଣ ଏହାକୁ ଦେଖାଇବେ କି ? 2. ଏହି ସାଇଟକୁ #୨ ପପ୍-ଅପ୍ ୱିଣ୍ଡୋ ଖୋଲିବାକୁ ଆମେ ରୋକିଦେଲି । ଆପଣ ଏମାନଙ୍କୁ ଦେଖାଇବେ କି ?"""	0.0	tensor([0.8521])	0.42825838414634143
28259	[[0.9102955]]	The Union Cabinet chaired by Prime Minister Shri Narendra Modi has approved the proposal to allot land to Chandigarh Housing Board for construction of apartments for 3930 allottees under Self-Financing Housing Scheme for UT Employees.	ପ୍ରଧାନମନ୍ତ୍ରୀ ଶ୍ରୀ ନରେନ୍ଦ୍ର ମୋଦୀଙ୍କ ଅଧ୍ୟକ୍ଷତାରେ ଅନୁଷ୍ଠିତ କେନ୍ଦ୍ର କ୍ୟାବିନେଟ ଚଣ୍ଡିଗଡ଼ ପ୍ରଶାସନର 3930 କର୍ମଚାରୀଙ୍କ ପାଇଁ ସ୍ୱ-ଅର୍ଥ ଲଗାଣ ଆବାସ ଯୋଜନା ଅଧୀନରେ ବାସଗୃହ ନିର୍ମାଣ ଲାଗି ଚଣ୍ଡିଗଡ଼ ଆବାସ ବୋର୍ଡକୁ ଜମି ଆବଂଟନ ପ୍ରସ୍ତାବକୁ ମଞ୍ଜୁର କରିଛନ୍ତି ।	0.9102955	True	True	ପ୍ରଧାନମନ୍ତ୍ରୀ ଶ୍ରୀ ନରେନ୍ଦ୍ର ମୋଦୀଙ୍କ ଅଧ୍ୟକ୍ଷତାରେ କେନ୍ଦ୍ର ମନ୍ତ୍ରୀମଣ୍ଡଳ ଚାନ୍ଦୀଗଡ଼ ହାଉସିଂ ବୋର୍ଡ଼କୁ ୩୯୩୦ ଜଣ ଅଲଟିଙ୍କ ପାଇଁ ସ୍ୱ-ଆର୍ଥିକ ହାଉସିଂ ଯୋଜନା ଅନ୍ତର୍ଗତ ଅପାର୍ଟମେଣ୍ଟ ନିର୍ମାଣ ପାଇଁ ଜମି ଆବଣ୍ଟନ ପ୍ରସ୍ତାବକୁ ଅନୁମୋଦନ କରିଛି।	0.14	tensor([0.9638])	0.3237379941925396
28267	[[0.9243176]]	Ayushman Bharat, the world's largest healthcare scheme, today is giving Health Coverage to about 50 crore Indians for free treatment of up to Rs 5 lakh.	ଦୁନିଆର ସବୁଠାରୁ ବଡ଼ ସ୍ୱାସ୍ଥ୍ୟ ସୁରକ୍ଷା ଯୋଜନା ଆୟୁଷ୍ମାନ ଭାରତ ଆଜି ପ୍ରାୟ 50 କୋଟି ଭାରତୀୟଙ୍କୁ 5 ଲକ୍ଷ ଟଙ୍କା ପର୍ଯ୍ୟନ୍ତ ମାଗଣାରେ ସ୍ୱାସ୍ଥ୍ୟ ବୀମା ଦେଉଛି ।	0.9243176	True	True	ଆୟୁଷ୍ମାନ୍ ଭାରତ, ବିଶ୍ବର ସର୍ବବୃହତ୍ ସ୍ୱାସ୍ଥ୍ୟ ଯୋଜନା, ଆଜି ୫୦ କୋଟି ଭାରତୀୟଙ୍କୁ ମାଗଣାରେ ୫ ଲକ୍ଷ ରୁପେ ପର୍ଯ୍ୟନ୍ତ ସ୍ୱାସ୍ଥ୍ୟ ଆବରଣ ପ୍ରଦାନ କରୁଛି।	0.0	tensor([0.9470])	0.2901826484018264
28356	[[0.931015]]	The film was released in Hindi, Telugu, Tamil and Malayalam.	ହିନ୍ଦୀ, ତାମିଲ, ତେଲଗୁ ଏବଂ ଇଁରାଜୀରେ ରିଲିଜ୍ ହୋଇଛି ଫିଲ୍ମ ।	0.931015	True	True	ଚଳଚ୍ଚିତ୍ରଟି ହିନ୍ଦୀ, ତେଲୁଗୁ, ତାମିଲ ଏବଂ ମଲୟାଳମରେ ମୁକ୍ତିଲାଭ କରିଥିଲା।	0.0	tensor([0.9847])	0.34128440366972473
28361	[[0.9028199]]	Hence, you must forget what going out means for the next 21 days.	ତେଣୁ, ଆଗାମୀ 21 ଦିନ ପଦାକୁ ବାହାରିବାର ଅର୍ଥ କ’ଣ ତାହା ଆପଣମାନେ କଦାପି ଭୁଲିଯିବା ଉଚିତ ନୁହେଁ ।	0.9028199	True	True	ଏହାଦ୍ୱାରା, ଆଗାମୀ ୨୧ ଦିନ ପାଇଁ ବାହାରିବା କାହାକୁ ମାନେ ।	0.0	tensor([0.9184])	0.18350290697674418
28363	[[0.90081036]]	Rohit Sharma and Shikhar Dhawan out to bat for India.	ଭାରତ ପକ୍ଷରୁ ବ୍ୟାଟିଂ ଓପଡ଼ କରିଛନ୍ତି ରୋହିତ ଶର୍ମା ଓ ଶିଖର ଧାଓ୍ଵନ।	0.90081036	True	True	ରୋହିତ ଶର୍ମା ଏବଂ ଶିଖର ଧାୱାନ ଭାରତ ପାଇଁ ବ୍ୟାଟିଂରେ ଯାଉଛନ୍ତି।	0.0	tensor([0.9968])	0.3188131313131313
28365	[[0.90466547]]	Despite several complaints, no action has been taken.	ଏନେଇ ବହୁବାର ଅଭିଯୋଗ କରିବା ସତ୍ତେ୍ୱ ମଧ୍ୟ କୌଣସି ପଦକ୍ଷେପ ନିଆଯାଇନାହିଁ ।	0.90466547	False	True	ଅନେକ ଅଭିଯୋଗ ଥାଇ ମଧ୍ୟ କୌଣସି କାର୍ଯ୍ୟ ହୋଇନାହିଁ ।	0.0	tensor([0.9840])	0.32206632653061223
28418	[[0.9160762]]	The Prime Minister, Shri Narendra Modi, today addressed Company Secretaries at the inauguration of the Golden Jubilee Year of ICSI the Institute of Company Secretaries of India.	ପ୍ରଧାନମନ୍ତ୍ରୀ ଶ୍ରୀ ନରେନ୍ଦ୍ର ମୋଦୀ ଭାରତୀୟ କମ୍ପାନୀ ସେକ୍ରେଟାରୀ ପ୍ରତିଷ୍ଠାନ(ICSI)ର ସ୍ଵର୍ଣ୍ଣ ଜୟନ୍ତୀ ବର୍ଷ ଉଦ୍ଘାଟନୀ ସମାରୋହରେ କମ୍ପାନୀ ସେକ୍ରେଟାରୀମାନଙ୍କୁ ସମ୍ବୋଧିତ କରିଛନ୍ତି ।	0.9160762	True	True	ଆଜି ଭାରତର ପ୍ରଧାନମନ୍ତ୍ରୀ ଶ୍ରୀ ନରେନ୍ଦ୍ର ମୋଦୀ ଆଇସିଏସଆଇ ଭାରତର କମ୍ପାନୀ ସେକ୍ରେଟାରୀଙ୍କ ସ୍ୱର୍ଣ୍ଣ ଜୟନ୍ତୀ ବର୍ଷର ଉଦ୍‌ଘାଟନରେ କମ୍ପାନୀ ସେକ୍ରେଟାରୀଙ୍କୁ ସମ୍ବୋଧନ କରିଥିଲେ ।	0.13	tensor([0.9245])	0.32366071428571425
28447	[[0.9519645]]	Police registered a case into the incident and started investigation.	ଘଟଣାକୁ ନେଇ ପୋଲିସ ଏକ ମାମଲା ରୁଜୁ କରି ତଦନ୍ତ ଆରମ୍ଭ କରିଛି।	0.9519645	True	True	ପୋଲିସ୍ ଘଟଣାରେ ଏକ ମାମଲା ଦାୟର କରିଛି ଏବଂ ଅନୁସନ୍ଧାନ ଆରମ୍ଭ କରିଛି।	0.0	tensor([1.0000])	0.37500000000000006
28474	[[0.9324243]]	Hindus and Muslim both take part in it with zeal.	ହିନ୍ଦୁ ଓ ମୁସଲମାନ ଦୁହେଁ ଉତ୍ସାହ ସହିତ ଏଥିରେ ଭାଗ ନେଇ ଥାଉ।	0.9324243	True	True	ହିନ୍ଦୁ ଏବଂ ମୁସଲମାନ ଉଭୟେ ଉତ୍ସାହରେ ଏଥିରେ ଭାଗ ନିଅନ୍ତି।	0.0	tensor([0.9875])	0.32206632653061223
28483	[[0.91555583]]	Immediately locals informed the fire force.	ତୁରନ୍ତ ଏନେଇ ସ୍ଥାନୀୟ ଲୋକେ ଦମକଳ ବାହିନୀକୁ ଖବର ଦେଇଥିଲେ ।	0.91555583	False	True	ତତ୍‌କ୍ଷଣରେ ସ୍ଥାନୀୟମାନେ ଅଗ୍ନିଶକ୍ତିକୁ ସୂଚିତ କରିଥିଲେ।	0.0	tensor([0.9513])	0.0
28496	[[0.92401755]]	Be careful while driving and control the speed.	ଗାଡ଼ି ଚଲାଇବା ସମୟରେ ସାବଧାନ ରୁହନ୍ତୁ ଏବଂ ଗତିକୁ ନିୟନ୍ତ୍ରୀତ ରଖିବେ।	0.92401755	False	True	ଡ୍ରାଇଭିଂ କରିବା ବେଳେ ସାବଧାନ ହୁଅ ଏବଂ ବେଗ ନିୟନ୍ତ୍ରଣ କରନ୍ତୁ।	0.0	tensor([1.0000])	0.1111111111111111
28520	[[0.9310778]]	Bollywood actress Sonali Bendre who has been diagnosed with cancer is currently undergoing treatment in London.	ବଲିଉଡ ଅଭିନେତ୍ରୀ ସୋନାଲି ବେନ୍ଦ୍ରେ ଏବେ ଲଣ୍ଡନରେ କ୍ୟାନ୍ସରର ଚିକିତ୍ସା କରାଉଛନ୍ତି।	0.9310778	True	True	ବଲିଉଡ଼ ଅଭିନେତ୍ରୀ ସୋନାଲୀ ବେନ୍ଦ୍ରେ ଯାହାଙ୍କୁ କର୍କଟ ରୋଗ ନିର୍ଣ୍ଣୟ ହୋଇଛି, ସେ ବର୍ତ୍ତମାନ ଲଣ୍ଡନରେ ଚିକିତ୍ସା କରୁଛନ୍ତି।	0.0	tensor([0.9643])	0.20833333333333331
28543	[[0.91052467]]	ueen Maxima of the Netherlands Prime Minister Narendra Modi met Her Majesty ueen Maxima of the Kingdom of the Netherlands today.	Prime inister's Office ମହାମହିମ ରାଣୀ ମେକ୍ସିମାଙ୍କ ସହିତ ସାକ୍ଷାତ କଲେ ପ୍ରଧାନମନ୍ତ୍ରୀ ପ୍ରଧାନମନ୍ତ୍ରୀ ଶ୍ରୀ ନରେନ୍ଦ୍ର ମୋଦୀ ଆଜି ନେଦରଲାଣ୍ଡ ସାମ୍ରାଜ୍ୟର ମହାରାଣୀ ମହାମହିମ ମେକ୍ସିମାଙ୍କ ସହିତ ସାକ୍ଷାତ କରିଥିଲେ ।	0.91052467	True	True	ଆଜି ନେଦରଲ୍ୟାଣ୍ଡର ରାଣୀ ମାକ୍ସିମାଙ୍କୁ ଭାରତର ପ୍ରଧାନମନ୍ତ୍ରୀ ନରେନ୍ଦ୍ର ମୋଦୀ ଭେଟିଲେ ।	0.0	tensor([0.8681])	0.18144208037825058
28558	[[0.9266008]]	The cause of death will be known after the report is released, police said.	ରିପୋର୍ଟ ଆସିବା ପରେ ମୃତ୍ୟୁର କାରଣ ଜଣାପଡିବ ବୋଲି ପୁଲିସ କହିଛି।	0.9266008	True	True	ମୃତ୍ୟୁର କାରଣ ପ୍ରତିବେଦନ ପ୍ରକାଶିତ ହେବା ପରେ ଜଣାପଡିବ, ପୁଲିସ କହିଛି।	0.0	tensor([0.9563])	0.5616605616605616
28612	[[0.9203577]]	Congress chief Rahul Gandhi and UPA chairperson Sonia Gandhi also paid tribute to Mahatma Gandhi at Rajghat.	କଂଗ୍ରେସ ମୁଖ୍ୟ ରାହୁଳ ଗାନ୍ଧୀ ଏବଂ ଉପା ଅଧ୍ୟକ୍ଷା ସୋନିଆ ଗାନ୍ଧୀ ମଧ୍ୟ ରାଜଘାଟ ଠାରେ ମହାତ୍ମା ଗାନ୍ଧୀଙ୍କୁ ଶ୍ରଦ୍ଧାଞ୍ଜଳି ଜ୍ଞାପନ କରିଛନ୍ତି।	0.9203577	True	True	କଂଗ୍ରେସ ମୁଖ୍ୟ ରାହୁଲ ଗାନ୍ଧୀ ଏବଂ ୟୁପିଏ ଅଧ୍ୟକ୍ଷା ସୋନିଆ ଗାନ୍ଧୀ ମଧ୍ୟ ରାଜଘାଟରେ ମହାତ୍ମା ଗାନ୍ଧୀଙ୍କୁ ଶ୍ରଦ୍ଧାଞ୍ଜଳି ଦେଇଥିଲେ ।	0.25	tensor([0.9973])	0.6352388869871387
28614	[[0.9176513]]	Prime Minister will unveil the statue of Maharaja Bir Bikram Kishore Manikya Bahadur at Maharaja Bir Bikram Airport, Agartala.	ଅଗରତାଲାର ମହାରାଜ ବୀର ବିକ୍ରମ ବିମାନବନ୍ଦରରେ ପ୍ରଧାନମନ୍ତ୍ରୀ ମହାରାଜ ବୀର ବିକ୍ରମ କିଶୋର ମାଣିକ୍ୟ ବାହାଦୁରଙ୍କ ପ୍ରତିମୂର୍ତ୍ତି ଉନ୍ମୋଚନ କରିବେ ।	0.9176513	True	True	ପ୍ରଧାନମନ୍ତ୍ରୀ ମହାରାଜା ବିର ବିକ୍ରମ କିଶୋର ମାଣିକ୍ୟ ବାହାଦୁରଙ୍କ ପ୍ରତିମୂର୍ତ୍ତି ମହାରାଜା ବିର ବିକ୍ରମ ବିମାନବନ୍ଦର, ଆଗରତଳାରେ ଉନ୍ମୋଚନ କରିବେ।	0.26	tensor([0.9694])	0.43896484375
28626	[[0.90352285]]	Suman Kumari Becomes Pakistans First Hindu Woman Judge	ସୁମନ୍ କୁମାରୀ ହେଲେ ପାକିସ୍ତାନର ପ୍ରଥମ ହିନ୍ଦୁ ମହିଳା ଜଜ୍ !	0.90352285	False	True	ସୁମନ କୁମାରୀ ପାକିସ୍ତାନର ପ୍ରଥମ ହିନ୍ଦୁ ମହିଳା ଜଜ	0.33	tensor([0.9114])	0.5499999999999999
28635	[[0.9078174]]	Uttar Pradesh Chief Minister Yogi Adityanath was present on the occasion.	ଏହି କାର୍ଯ୍ୟକ୍ରମରେ ଉତ୍ତରପ୍ରଦେଶର ମୁଖ୍ୟମନ୍ତ୍ରୀ ଯୋଗୀ ଆଦିତ୍ୟନାଥ ଉପସ୍ଥିତ ଥିଲେ ।	0.9078174	True	True	ଉତ୍ତର ପ୍ରଦେଶ ମୁଖ୍ୟମନ୍ତ୍ରୀ ଯୋଗୀ ଆଦିତ୍ୟନାଥ ଉକ୍ତ ଅବସରରେ ଉପସ୍ଥିତ ଥିଲେ।	0.0	tensor([0.9956])	0.41666666666666663
28637	[[0.9117117]]	Locals, police and fire force personnel conducted the rescue operation.	ଉଦ୍ଧାର କାର୍ଯ୍ୟରେ ସ୍ଥାନୀୟ ଲୋକ, ପୋଲିସ ଓ ଅଗ୍ନିଶମ ବାହିନୀ ।	0.9117117	True	True	ସ୍ଥାନୀୟମାନେ, ପୁଲିସ ଓ ଅଗ୍ନିଶାମକ ବାହିନୀର କର୍ମୀମାନେ ଉଦ୍ଧାର ଅଭିଯାନ କରିଥିଲେ।	0.0	tensor([0.9497])	0.15
28639	[[0.93166465]]	The objective of the MoU is to promote cooperation in the fields of science and technology between India and Indonesia on the basis of equality and mutual benefit.	ବିଜ୍ଞାନ ଏବଂ ପ୍ରଯୁକ୍ତି କ୍ଷେତ୍ରରେ ସମାନତା ଏବଂ ପାରସ୍ପରିକ ଲାଭର ଆଧାରରେ ଭାରତ ଏବଂ ଇଣ୍ଡୋନେସିଆର ମଧ୍ୟରେ ସହଯୋଗ ବଢ଼ାଇବା ଏହି ଏମଓୟୁର ଉଦ୍ଦେଶ୍ୟ ।	0.93166465	True	True	ଭାରତ ଏବଂ ଇଣ୍ଡୋନେସିଆ ମଧ୍ୟରେ ବିଜ୍ଞାନ ଏବଂ ପ୍ରଯୁକ୍ତିବିଦ୍ୟା କ୍ଷେତ୍ରରେ ସମାନତା ଏବଂ ପରସ୍ପର ଲାଭର ଆଧାରରେ ସହଯୋଗିତା ପ୍ରଚାର କରିବା ଏହି ଏମୋଉର ଉଦ୍ଦେଶ୍ୟ ।	0.0	tensor([0.9990])	0.5257288020074972
28660	[[0.9069056]]	We have already provided free treatment worth 700 Crore rupees to 5 lakh families under this scheme within 10 weeks of its launch.	ଆମେ ଏହି ଯୋଜନା ଆରମ୍ଭ ହେବାର 10 ସପ୍ତାହ ମଧ୍ୟରେ ମାଗଣା ଚିକିତ୍ସା ଉପଲବ୍ଧ କରିବା ଲାଗି 700 କୋଟି ଟଙ୍କା 5 ଲକ୍ଷ ପରିବାରକୁ ଦେଇସାରିଛୁ ।	0.9069056	True	True	ଏହି ଯୋଜନାରେ ୧୦ ସପ୍ତାହ ମଧ୍ୟରେ ୫ ଲକ୍ଷ ପରିବାରଙ୍କୁ ୭୦୦ କୋଟି ଟଙ୍କାର ନିଃଶୁଳ୍କ ଚିକିତ୍ସା ପ୍ରଦାନ କରିଛୁ।	0.0	tensor([0.9221])	0.20901416122004354
28821	[[0.9248516]]	The film releases in Telugu, Tamil, Malayalam, Kannada and Hindi.	ଚଳଚ୍ଚିତ୍ରଟି କନ୍ନଡା, ତାମିଲ୍‌, ତେଲ୍‌ଗୁ, ହିନ୍ଦୀ ଏବଂ ମାଲାୟାଲାମ ଭାଷାରେ ତିଆରି କରାଯାଇଛି।	0.9248516	True	True	ଚଳଚ୍ଚିତ୍ରଟି ତେଲୁଗୁ, ତାମିଲ୍, ମଲଯାଲମ୍, କନ୍ନଡ଼ ଏବଂ ହିନ୍ଦୀରେ ମୁକ୍ତିଲାଭ କରିଛି।	0.0	tensor([0.9980])	0.19379844961240314
28851	[[0.9077892]]	Prime Minister's Office PM reviews performance of key infrastructure sectors The Prime Minister, Shri Narendra Modi, on Tuesday reviewed progress of key infrastructure sectors including roads, railways, airports, ports, digital, and coal.	Prime inister's Office ଗୁରୁତ୍ୱପୂର୍ଣ୍ଣ ଭିତ୍ତିଭୂମି କ୍ଷେତ୍ରର କାର୍ଯ୍ୟ ସମୀକ୍ଷା କଲେ ପ୍ରଧାନମନ୍ତ୍ରୀ ପ୍ରଧାନମନ୍ତ୍ରୀ ଶ୍ରୀ ନରେନ୍ଦ୍ର ମୋଦୀ ରାସ୍ତା, ରେଳ, ବିମାନବନ୍ଦର, ଡିଜିଟାଲ୍ ଏବଂ କୋଇଲା ଭଳି କ୍ଷେତ୍ରରେ ଗୁରୁତ୍ୱପୂର୍ଣ୍ଣ ଭିତ୍ତିଭୂମି ପ୍ରକଳ୍ପଗୁଡ଼ିକର ଅଗ୍ରଗତି ସମୀକ୍ଷା କରିଛନ୍ତି ।	0.9077892	True	True	ପ୍ରଧାନମନ୍ତ୍ରୀ କାର୍ଯ୍ୟାଳୟ ପ୍ରଧାନମନ୍ତ୍ରୀ ଶ୍ରୀ ନରେନ୍ଦ୍ର ମୋଦୀ ମଙ୍ଗଳବାର ରାସ୍ତା, ରେଳ, ବିମାନବନ୍ଦର, ବନ୍ଦର, ଡିଜିଟାଲ୍ ଏବଂ କୋଇଲା ଆଦି ମୂଖ୍ୟ ଅଟକଳୀନ୍ କ୍ଷେତ୍ରର ପ୍ରଗତି ସମୀକ୍ଷା କରିଥିଲେ ।	0.3	tensor([0.9048])	0.4550226573965955
28860	[[0.9139759]]	Following information, police reached the spot and retrieved the body.	ସୂଚନା ମିଳିବା ପରେ ଘଟଣାସ୍ଥଳରେ ପୁଲିସ ପହଞ୍ଚି ମୃତଦେହ ଉଦ୍ଧାର କରିଛି।	0.9139759	True	True	ତଥ୍ୟ ଅନୁସାରେ ପୁଲିସ୍ ସ୍ଥାନକୁ ପହଞ୍ଚି ଶବକୁ ଉଦ୍ଧାର କରିଥିଲେ ।	0.0	tensor([0.9956])	0.1111111111111111
28889	[[0.9103193]]	In a massive pro-freedom rally organised on the 117th birth anniversary of GM Syed, one of the founding fathers of modern Sindhi nationalism, protesters raised the placards of Indian Prime Minister Narendra Modi and other world leaders to seek their intervention for the freedom of Sindhudesh.	ଆଧୁନିକ ସିନ୍ଧି ଜାତୀୟତାର ଅନ୍ୟତମ ପ୍ରତିଷ୍ଠାତା ଜିଏମ୍ ସୟଦଙ୍କ ୧୧୭ ତମ ଜନ୍ମ ବାର୍ଷିକୀରେ ଆୟୋଜିତ ଏକ ବିରାଟ ସ୍ବାଧୀନତା ସମାରୋହରେ ବିକ୍ଷୋଭକାରୀମାନେ ସିନ୍ଧର ସ୍ବାଧୀନତା ପାଇଁ ଭାରତର ପ୍ରଧାନମନ୍ତ୍ରୀ ନରେନ୍ଦ୍ର ମୋଦୀ ଏବଂ ଅନ୍ୟ ବିଶ୍ୱ ନେତାଙ୍କ ପୋଷ୍ଟର ଧରିଥିବାର ନଜର ଆସିଥିଲେ।	0.9103193	True	True	ଜିଏମ୍ ସୟଦଙ୍କ ୧୧୭ତମ ଜନ୍ମଦିନ ଉପଲକ୍ଷେ ଆୟୋଜିତ ବିଶାଳ ସ୍ୱାଧୀନତା ରାଲୀରେ, ସିନ୍ଧୁଦେଶର ସ୍ୱାଧୀନତା ପାଇଁ ଭାରତୀୟ ପ୍ରଧାନମନ୍ତ୍ରୀ ନରେନ୍ଦ୍ର ମୋଦୀ ଓ ଅନ୍ୟାନ୍ୟ ବିଶ୍ୱ ନେତାଙ୍କ ପ୍ଲାକାର୍ଡ଼ଗୁଡ଼ିକ ଉତ୍ତୋଳନ କରି ତାଙ୍କ ହସ୍ତକ୍ଷେପ ଆହ୍ୱାନ କରିଥିଲେ ।	0.0	tensor([0.9749])	0.2595708221365425
28894	[[0.90337455]]	Nearly 300 companies from 25 countries will display their products in BES EPO 2018 directly or through their dealers and distributors in India.	25 ଟି ଦେଶର ପାଖାପାଖି 300 କମ୍ପାନୀ ବିଇଏସ ଏକ୍ସପୋ 2018 ରେ ସିଧାସଳଖ କିମ୍ବା ଭାରତରେ ଡିଲର ଏବଂ ବିତରକଙ୍କ ମାଧ୍ୟମରେ ନିଜର ଉତ୍ପାଦ ପ୍ରଦର୍ଶିତ କରିବେ ।	0.90337455	True	True	ବେସ୍ ଇପୋ ୨୦୧୮ରେ ୨୫ଟି ଦେଶର ୩୦୦ଟି ପ୍ରାୟ କମ୍ପାନୀ ଭାରତରେ ତାଙ୍କ ଡିଲର ଓ ଡିଷ୍ଟ୍ରିବ୍ୟୁଟରଙ୍କ ମାଧ୍ୟମରେ ପ୍ରତ୍ୟକ୍ଷ ବା ଅପ୍ରତ୍ୟକ୍ଷ ଭାବେ ତାଙ୍କ ଉତ୍ପାଦଗୁଡ଼ିକ ପ୍ରଦର୍ଶନ କରିବେ।	0.0	tensor([0.8888])	0.11363636363636365
28896	[[0.92343354]]	Hundreds of vehicles have been stranded due to highway blockade.	ରାଜପଥ ଅବରୋଧ ଯୋଗୁଁ ଶତାଧିକ ଗାଡି ମୋଟର ଅଟକି ରହିଥିଲା ।	0.92343354	True	True	ହାଇୱେ ଅବରୋଧ ଯୋଗୁଁ ଶହସ୍ରାଧିକ ଯାନ ଅଟକି ରହିଛି।	0.0	tensor([0.9951])	0.29040404040404044
28924	[[0.9139972]]	She was the defence minister in first Modi government.	ମୋଦି ସରକାରଙ୍କ ଗତ କାର୍ଯ୍ୟକାଳରେ ସେ ପ୍ରଥମ ମହିଳା ରକ୍ଷାମନ୍ତ୍ରୀ ହୋଇଥିଲେ ।	0.9139972	True	True	ସେ ପ୍ରଥମ ମୋଦୀ ସରକାରରେ ପ୍ରତିରକ୍ଷା ମନ୍ତ୍ରୀ ଥିଲେ।	0.0	tensor([0.9840])	0.19329896907216493
