idx	las	src	tgt	las_score_dbl	src_gt_8_words	tgt_gt_8_words	ollama_trans	ollama_bleu_score	ollama_f1_score	ollama_meteor_score
7611	[[0.9335408]]	The most recent date this add-on was installed (previous information about an uninstalled add-on is not kept).	ଏହି ଏଡ଼-ଅନକୁ ସ୍ଥାପନ କରାଯାଇଥିବା ନିକଟତମ ତାରିଖ (ସ୍ଥାପନ ହୋଇନଥିବା ଏଡ଼-ଅନ ବିଷୟରେ ପୂର୍ବ ସୂଚନା ରଖାଯାଇନଥାଏ)।	0.9335408	True	True	ଏହି ଆଡ଼-ଅନ୍ କିଣିଥିବା ସର୍ବଶେଷ ତାରିଖ (ଅନିସ୍ଥାପିତ ଆଡ଼-ଅନ୍ ବାବଦରେ ପୂର୍ବତଥ୍ୟ ରଖାଯାଏ ନାହିଁ)	0.0	tensor([0.9390])	0.20103503184713375
7645	[[0.92634284]]	The Prime Minister, said that with the new Civil Terminal in Hindon Airport, people of Ghaziabad can take air travel to other cities from Ghaziabad itself, instead of going to Delhi.	ପ୍ରଧାନମନ୍ତ୍ରୀ କହିଥିଲେ ଯେ ହିନ୍ଦୋନ ବିମାନ ବନ୍ଦରରେ ନୂଆ ବେସାମରିକ ଟର୍ମିନାଲ ଦ୍ୱାରା ଗାଜିଆବାଦର ଲୋକମାନେ ଦିଲ୍ଲୀ ନଯାଇ ଏଠାରୁ ହିଁ ଅନ୍ୟ ସହରକୁ ବିମାନଯାତ୍ରା କରିପାରିବେ ।	0.92634284	True	True	ପ୍ରଧାନମନ୍ତ୍ରୀ କହିଲେ ଯେ ହିନ୍ଦୋନ୍ ବିମାନବନ୍ଦରରେ ନୂଆ ସିଭିଲ୍ ଟର୍ମିନାଲ୍ ସହିତ ଘାଜିଆବାଦର ଲୋକମାନେ ଘାଜିଆବାଦରୁ ଅନ୍ୟ ସହରକୁ ବିମାନରେ ଯାତ୍ରା କରିପାରିବେ, ଦିଲ୍ଲୀ ଯିବାକୁ ନାହିଁ।	0.0	tensor([0.9708])	0.25334821428571425
7687	[[0.9394189]]	The President was scheduled to visit the Kargil War Memorial in Dras this morning, but the visit was called off due to inclement weather.	ରାଷ୍ଟ୍ରପତିଙ୍କର ଆଜି ସକାଳେ ଦ୍ରାସସ୍ଥିତ କାର୍ଗିଲ ଯୁଦ୍ଧ ସ୍ମାରକୀ ଗସ୍ତ କରିବାର କାର୍ଯ୍ୟକ୍ରମ ରହିଥିଲା, କିନ୍ତୁ ପାଗ ଭଲ ନରହିବା କାରଣରୁ ଏହି ଗସ୍ତକୁ ବାତିଲ କରାଯାଇଥିଲା ।	0.9394189	True	True	ରାଷ୍ଟ୍ରପତି ଆଜି ସକାଳେ ଡ୍ରାସରେ କାର୍ଗିଲ୍ ଯୁଦ୍ଧ ସ୍ମାରକକୁ ଯିବାକୁ ଥିଲେ, କିନ୍ତୁ ଅନୁକୂଳ ଆବହାବିକ ପରିସ୍ଥିତି ଯୋଗୁଁ ଏହି ଯାତ୍ରାକୁ ବାତିଲ୍ କରାଯାଇଥିଲା।	0.0	tensor([0.9961])	0.23553507424475165
7704	[[0.91624504]]	On being informed, police and fire personnel reached the spot and rescued the victims.	ଖବର ପାଇ ପୁଲିସ ଓ ଦମକଳ ଘଟଣାସ୍ଥଳରେ ପହଞ୍ଚି ଆହତମାନଙ୍କୁ ଉଦ୍ଧାର କରିଛନ୍ତି ।	0.91624504	True	True	ସୂଚନା ପାଇବାରେ ପୁଲିସ ଓ ଅଗ୍ନି କର୍ମୀମାନେ ସ୍ଥାନକୁ ପହଞ୍ଚି ପୀଡ଼ିତଙ୍କୁ ଉଦ୍ଧାର କରିଥିଲେ ।	0.0	tensor([0.9977])	0.33513513513513515
7722	[[0.9368988]]	A notification was issued by the state government in this regard.	ଏ ନେଇ ରାଜ୍ୟ ସରକାରଙ୍କ ପକ୍ଷରୁ ବିଜ୍ଞପ୍ତି ଜାରି କରାଯାଇଛି ।	0.9368988	True	True	ଏହି ସମ୍ବନ୍ଧରେ ରାଜ୍ୟ ସରକାରଙ୍କଦ୍ୱାରା ଏକ ଅଧିସୂଚନା ଜାରି କରାଯାଇଥିଲା।	0.0	tensor([1.])	0.11235955056179774
7727	[[0.9146601]]	Mumbai: Indrani Mukerjea, the key accused in the Sheena Bora murder case, has sought divorce from her husband Peter Mukerjea.	ମୁମ୍ବଇ : ସୀନା ବୋରା ହତ୍ୟା ମାମଲାର ମୁଖ୍ୟ ଅଭିଯୁକ୍ତ ଇନ୍ଦ୍ରାଣୀ ମୁଖାର୍ଜୀ ତାଙ୍କ ସ୍ୱାମୀ ପିଟର୍‍ ମୁଖାର୍ଜୀଙ୍କଠାରୁ ବିବାହ ବିଚ୍ଛେଦ ଘଟାଇବାକୁ ଚାହୁଛନ୍ତି।	0.9146601	True	True	ମୁମ୍ବାଇ: ଶୀନା ବୋରା ହତ୍ୟା କେସରେ ମୁଖ୍ୟ ଅଭିଯୁକ୍ତ ଇନ୍ଦ୍ରାଣୀ ମୁକର୍ଜୀ, ତାଙ୍କ ସ୍ୱାମୀ ପିଟର ମୁକର୍ଜୀଙ୍କଠାରୁ ଡିଭୋର୍ସ ଦାବୀ କରିଛନ୍ତି।	0.0	tensor([0.9717])	0.41666666666666663
7799	[[0.90109164]]	Foreign players including Eoin Morgan, Jason Roy, Chris Morris, Chris Woakes, Adam Zampa, Shaun Marsh, David Willey, Kane Richardson and Kyle Abbott have also been shortlisted at Rs1.5 crore.	ବିଦେଶୀ ଖେଳାଳିଙ୍କ ମଧ୍ୟରେ ଶନ୍‌ ମାର୍ଶ, କେନ୍‌ ରିଚାର୍ଡସନ୍‌, ଇଓନ୍‌ ମୋର୍ଗାନ୍‌, ଜାସନ ରୟ, କ୍ରିସ୍‌ ଓ୍ବକ୍‌ସ ଏବଂ ଡେଭିଡ୍‌ ଓ୍ବିଲୀ ମଧ୍ୟ ନିଜର ବେସ୍‌ ପ୍ରାଇସ୍‌ 1.5 କୋଟି ରଖିଛନ୍ତି ।	0.90109164	True	True	ଭିଦେଶୀ ଖେଳାଳିମାନେ ଯଥା ଇଓନ୍ ମର୍ଗାନ୍, ଜାସନ୍ ରାୟ, କ୍ରିସ୍ ମରିସ୍, କ୍ରିସ୍ ଉକ୍ସ୍, ଆଡାମ୍ ଜାମ୍ପା, ଶାନ୍ ମାର୍ଶ୍, ଡାଭିଡ୍ ୱିଲୀ, କେନ୍ ରିଚାର୍ଡସନ୍ ଓ କାଇଲ୍ ଆବଟ୍ ମାନଙ୍କୁ ମଧ୍ୟ ୧.୫ କୋଟି ଟଙ୍କାରେ ସର୍ଟଲିଷ୍ଟ୍ କରାଯାଇଛି।	0.0	tensor([0.9542])	0.10416666666666666
7836	[[0.9213301]]	The ceremony was attended by former presidents Barack Obama, George W Bush and Bill Clinton.	ଶପଥ ଗ୍ରହଣ ଉତ୍ସବରେ ଯୋଗ ଦେଇଥିଲେ ପୂର୍ବତନ ରାଷ୍ଟ୍ରପତି ବିଲ୍ କ୍ଲିଣ୍ଟନ, ଜର୍ଜ ଡବ୍ଲୁ ବୁଶ୍ ଓ ବାରାକ୍ ଓବମା ପ୍ରମୁଖ।	0.9213301	True	True	ସଭାକୁ ପୂର୍ବତନ ରାଷ୍ଟ୍ରପତି ବାରାକ ଓବାମା, ଜର୍ଜ ଡବ୍ଲ୍ୟୁ ବୁଶ ଏବଂ ବିଲ କ୍ଲିଣ୍ଟନ ଯୋଗ ଦେଇଥିଲେ।	0.0	tensor([0.9852])	0.3060545575515635
7874	[[0.9308119]]	Only 50 percent people had bank accounts four years ago, while now almost everyone has access to banking services.	ଚାରି ବର୍ଷ ପୂର୍ବେ ମାତ୍ର 50% ଲୋକଙ୍କର ବ୍ୟାଙ୍କ ଏକାଉଣ୍ଟ ଥିବା ବେଳେ ଏବେ ପ୍ରାୟ ସମସ୍ତଙ୍କୁ ବ୍ୟାଙ୍କ ସେବା ଉପଲବ୍ଧ ହୋଇପାରିଛି ।	0.9308119	True	True	ଚାରି ବର୍ଷ ପୂର୍ବେ ୫୦ ପ୍ରତିଶତ ଲୋକଙ୍କର ବ୍ୟାଙ୍କ ଆକାଉଣ୍ଟ ଥିଲା, ଏବେ ପ୍ରାୟ ସବୁ ଲୋକଙ୍କର ବ୍ୟାଙ୍କିଂ ସେବାକୁ ପ୍ରବେଶ ଅଛି।	0.0	tensor([0.9535])	0.33581686642911124
7896	[[0.90324754]]	The Prime Minister also inaugurated a 555-bed super speciality block in Safdarjung Hospital.	ପ୍ରଧାନମନ୍ତ୍ରୀ ସଫଦରଜଙ୍ଗ ହସ୍ପିଟାଲ୍‍ରେ ୫୫୫ ଶଯ୍ୟା ବିଶିଷ୍ଟ ସୁପର୍‍ ସ୍ପେଶାଲିଟି ବ୍ଲକ୍‍କୁ ମଧ୍ୟ ଲୋକାର୍ପିତ କରିଛନ୍ତି।	0.90324754	True	True	ସଫଦରଜଙ୍ଗ ହସ୍ପାତାଲରେ 555-ବେଡ଼ ସୁପର ସ୍ପେସିଆଲିଟି ବ୍ଲକକୁ ପ୍ରଧାନମନ୍ତ୍ରୀ ଉଦ୍ଘାଟନ କରିଥିଲେ ।	0.0	tensor([0.8953])	0.0847457627118644
7964	[[0.9165005]]	Warning: we can't confirm your connection to this website is secure.	ଚେତାବନୀ: ଏହି ୱେବସାଇଟ ସହ ଯୋଡୁଥିବା ଆପଣଙ୍କ ସଂଯୋଗ ନିରାପଦ କି ନାଁ ଆମେ ଥୟ କରିପାରିବୁ ନାହିଁ ।	0.9165005	True	True	ସତର୍କବାଣୀ: ଆମେ ଏହି ୱେବସାଇଟର ସହିତ ଆପଣଙ୍କର ସଂଯୋଗ ସୁରକ୍ଷିତ କି ନାହିଁ ତାହା ଆମେ ନିଶ୍ଚିତ କରିପାରୁନାହିଁ।	0.0	tensor([1.0000])	0.18867924528301888
7966	[[0.91856396]]	Prime Minister Narendra Modi hugs US President Donald Trump.	ପ୍ରଧାନମନ୍ତ୍ରୀ ନରେନ୍ଦ୍ର ମୋଦିଙ୍କୁ ଆମେରିକା ରାଷ୍ଟ୍ରପତି ଡ୍ରୋନାଲ୍ଡ ଟ୍ରମ୍ପ ଉପହାସ କରିଛନ୍ତି।	0.91856396	True	True	ପ୍ରଧାନମନ୍ତ୍ରୀ ନରେନ୍ଦ୍ର ମୋଦୀ ଆମେରିକୀ ରାଷ୍ଟ୍ରପତି ଡୋନାଲ୍ଡ ଟ୍ରମ୍ପଙ୍କୁ ଆଲିଙ୍ଗନ କରିଛନ୍ତି।	0.0	tensor([1.0000])	0.3506944444444444
7968	[[0.9273243]]	Terror organisation Jaish-e-Mohammad has claimed responsibility for the attack.	ଏହି ଆକ୍ରମଣ ଘଟଣାରେ ଆତଙ୍କବାଦୀ ସଂଗଠନ ଜୈଶ-ଇ-ମହମ୍ମଦ ନିଜକୁ ଦାୟୀ କରିଛି ।	0.9273243	True	True	ଆତଙ୍କବାଦୀ ସଂଗଠନ ଜୈଶେ ମୁହମ୍ମଦ୍ ଆକ୍ରମଣର ଦାୟିତ୍ୱ ନେଇଛି।	0.0	tensor([0.9363])	0.19329896907216493
7973	[[0.93151647]]	Many distinguished people of the city were present on the occasion.	ଏହି ଅବସରରେ ସହରର ବହୁ ମାନ୍ୟଗଣ୍ୟ ବ୍ୟକ୍ତି ବିଶେଷ ଯୋଗଦେଇଥିଲେ ।	0.93151647	True	True	ସେହି ଅବସରରେ ସହରର ଅନେକ ମାନ୍ୟବର ବ୍ୟକ୍ତି ଉପସ୍ଥିତ ଥିଲେ ।	0.0	tensor([1.])	0.3506944444444444
8011	[[0.9177697]]	The meeting was attended by senior officials from Department of Financial Services, Ministry of Health Family Welfare and New India Assurance Company Limited.	ଏହି ବୈଠକରେ ଅର୍ଥ ସେବା ବିଭାଗ, ସ୍ଵାସ୍ଥ୍ୟ ଓ ପରିବାର କଲ୍ୟାଣ ମନ୍ତ୍ରଣାଳୟ ଏବଂ ନ୍ୟୁ ଇଣ୍ଡିଆ ଆସ୍ୟୁରାନ୍ସ କମ୍ପାନୀ ଲିମିଟେଡର ବରିଷ୍ଠ ଅଧିକାରୀମାନେ ଅଂଶଗ୍ରହଣ କରିଥିଲେ।	0.9177697	True	True	ଆର୍ଥିକ ସେବା ବିଭାଗ, ସ୍ୱାସ୍ଥ୍ୟ ଓ ପରିବାର କଲ୍ୟାଣ ମନ୍ତ୍ରାଳୟ ଏବଂ ନୂଆ ଭାରତ ଆଶ୍ୱାସନ କମ୍ପାନୀ ଲିମିଟେଡର ସିନିଅର ଅଧିକାରୀଙ୍କଦ୍ୱାରା ଉକ୍ତ ବୈଠକରେ ଯୋଗଦେଇଥିଲେ ।	0.0	tensor([0.9944])	0.4464285714285714
8150	[[0.96531594]]	PDA ID is %ld, name is %s, owner is %s	PDA ID ହେଉଛି %ld, ନାମ ହେଉଛି %s, ମାଲିକ ହେଉଛି %s	0.96531594	True	True	ପିଡିଏ ଆଇଡି ହେଉଛି %ld, ନାମ ହେଉଛି %s, ମାଲିକ ହେଉଛି %s	0.85	tensor([0.9264])	0.8664694280078895
8169	[[0.90343946]]	ENERGY COOPERATION The two sides agreed that their cooperation in oil and gas exploration, thermal and hydroelectric power and renewable energy and energy conservation is registering remarkable progress.	ଶକ୍ତି ସହଯୋଗ ଉଭୟ ପକ୍ଷ ସହମତ ହୋଇଥିଲେ ଯେ ତୈଳ ଏବଂ ଗ୍ୟାସ ସନ୍ଧାନ, ତାପଜ ଏବଂ ଜଳବିଦ୍ୟୁତ ଶକ୍ତି ଏବଂ ନବୀକରଣଯୋଗ୍ୟ ଶକ୍ତି ଏବଂ ଶକ୍ତି ସଂରକ୍ଷଣ କ୍ଷେତ୍ରରେ ସେମାନଙ୍କ ସହଯୋଗରେ ଗୁରୁତ୍ୱପୂର୍ଣ୍ଣ ଅଗ୍ରଗତି ହୋଇଛି ।	0.90343946	True	True	ଶକ୍ତି ସହଯୋଗ ଦୁଇ ପକ୍ଷ ଏହି ଭଳି ତେଲ ଓ ଗ୍ୟାସ ଅନ୍ୱେଷଣ, ତାପବିଦ୍ୟୁତିକ ଓ ଜଳବିଦ୍ୟୁତିକ ଶକ୍ତି, ନବୀକରଣୀୟ ଶକ୍ତି ଓ ଶକ୍ତି ସଂରକ୍ଷଣରେ ତାଙ୍କର ସହଯୋଗ ଉଲ୍ଲେଖନୀୟ ପ୍ରଗତି କରୁଛି।	0.0	tensor([0.9873])	0.1393728222996516
8179	[[0.9097754]]	There is complete clarity and confidence about the pace and direction of economic reforms in India.	ଭାରତରେ ହେଉଥିବା ଅର୍ଥନୈତିକ ସଂସ୍କାର ଗତି ଏବଂ ଦିଗରେ ଏକ ସମ୍ପୂର୍ଣ୍ଣ ସ୍ପଷ୍ଟତା ଏବଂ ଆତ୍ମବିଶ୍ୱାସ ରହିଛି ।	0.9097754	True	True	ଭାରତରେ ଅର୍ଥନୀତି ସଂସ୍କାରର ଗତି ଓ ଦିଗରେ ସମ୍ପୂର୍ଣ୍ଣ ସ୍ପଷ୍ଟତା ଓ ଆତ୍ମବିଶ୍ୱାସ ଅଛି।	0.0	tensor([0.9953])	0.3112327656123276
8372	[[0.94874084]]	Police have lodged a case against them and started investigation.	ଏମାନେଙ୍କ ବିରୋଧରେ ପୁଲିସ ମାମଲା ରୁଜୁ କରି ତଦନ୍ତ ଆରମ୍ଭ କରିଛି।	0.94874084	True	True	ପୋଲିସ୍ ତାଙ୍କ ବିରୁଦ୍ଧରେ ଏକ ମାମଲା ଦାୟର କରିଛି ଏବଂ ଅନୁସନ୍ଧାନ ଆରମ୍ଭ କରିଛି।	0.0	tensor([0.9902])	0.27777777777777773
8428	[[0.90387094]]	Police reached the spot, seized the body and started investigation.	ଖବରପାଇ ପୋଲିସ ଘଟଣା ସ୍ଥଳରେ ପହଞ୍ଚି ଶବ ଜବତ କରିବା ସହ ତଦନ୍ତ ଆରମ୍ଭ କରିଛି।	0.90387094	True	True	ପୋଲିସ୍ ସ୍ଥାନକୁ ପହଞ୍ଚି, ଶବକୁ ଜବତ୍ କରି ଅନୁସନ୍ଧାନ ଆରମ୍ଭ କଲେ।	0.0	tensor([0.9320])	0.0847457627118644
8456	[[0.90143996]]	A drawing competition was held for the students.	ଏହି ଅବସରରେ ଛାତ୍ର ଛାତ୍ରୀଙ୍କୁ ନେଇ ଏକ ଚିତ୍ରାଙ୍କନ ପ୍ରତିଯୋଗିତା ଅନୁଷ୍ଠିତ ହୋଇଥିଲା।	0.90143996	False	True	ଛାତ୍ରଛାତ୍ରୀମାନଙ୍କ ପାଇଁ ଏକ ଅଂକନ ପ୍ରତିଯୋଗିତା ଅନୁଷ୍ଠିତ ହୋଇଥିଲା।	0.0	tensor([0.9712])	0.38659793814432986
8528	[[0.9073341]]	The Prime Minister, Shri Narendra Modi has paid tributes to former Prime Minister, Shri Chaudhary Charan Singh, on his birth anniversary.	ପୂର୍ବତନ ପ୍ରଧାନମନ୍ତ୍ରୀ ଚୌଧୁରୀ ଚରଣ ସିଂଙ୍କ ଜୟନ୍ତୀ ଅବସରରେ ପ୍ରଧାନମନ୍ତ୍ରୀ ଶ୍ରୀ ନରେନ୍ଦ୍ର ମୋଦୀ ତାଙ୍କ ସ୍ମୃତି ପ୍ରତି ଶ୍ରଦ୍ଧାଞ୍ଜଳି ଅର୍ପଣ କରିଛନ୍ତି ।	0.9073341	True	True	ପ୍ରଧାନମନ୍ତ୍ରୀ ଶ୍ରୀ ନରେନ୍ଦ୍ର ମୋଦୀ ତାଙ୍କ ଜନ୍ମଦିନରେ ପୂର୍ବତନ ପ୍ରଧାନମନ୍ତ୍ରୀ ଶ୍ରୀ ଚଉଧୁରୀ ଚରଣ ସିଂହଙ୍କୁ ଶ୍ରଦ୍ଧାଞ୍ଜଳି ଅର୍ପଣ କରିଛନ୍ତି।	0.27	tensor([0.9973])	0.503954802259887
8537	[[0.9263125]]	Fishermen Warning: Fishermen along off north Odisha and West Bengal coasts are advised not to venture into sea during next 24 hrs and along off south Odisha coast during next 12 hrs.	ଆଗାମୀ 24 ଘଣ୍ଟା ପର୍ଯ୍ୟନ୍ତ ଉପକୂଳ ଓ ଉତ୍ତର ଓଡ଼ିଶା ଏବଂ ପଶ୍ଚିମ ବଙ୍ଗ ଉପକୂଳରେ ବସବାସ କରୁଥିବା ମତ୍ସ୍ୟଜୀବୀମାନଙ୍କୁ ସମୁଦ୍ରକୁ ମାଛଧରି ନଯିବାକୁ ଏବଂ ଦକ୍ଷିଣ ଓଡ଼ିଶାର ମତ୍ସ୍ୟଜୀବୀମାନଙ୍କୁ ଆଗାମୀ 12 ଘଣ୍ଟା ପର୍ଯ୍ୟନ୍ତ ସମୁଦ୍ରକୁ ପ୍ରବେଶ ନକରିବାକୁ ଚେତାବନୀ ଦିଆଯାଇଛି ।	0.9263125	True	True	ମାଛୁଆରେ ସତର୍କବାଣୀ: ଉତ୍ତର ଓଡ଼ିଶା ଓ ପଶ୍ଚିମ ବଙ୍ଗର ଉପକୂଳରେ ଥିବା ମାଛୁଆମାନଙ୍କୁ ପରବର୍ତ୍ତୀ ୨୪ ଘଣ୍ଟା ଓ ଦକ୍ଷିଣ ଓଡ଼ିଶାର ଉପକୂଳରେ ଥିବା ମାଛୁଆମାନଙ୍କୁ ପରବର୍ତ୍ତୀ ୧୨ ଘଣ୍ଟା ସମୁଦ୍ରରେ ଯିବାକୁ ମନା କରାଯାଏ।	0.0	tensor([0.9614])	0.2184989222026259
8576	[[0.9131641]]	The pictures were shared by Angad's father Bishan Singh Bedi on Twitter.	ଫଟୋକୁ ଅଙ୍ଗଦ ସିଂହ ବେଦୀଙ୍କ ପିତା ବିଶନ ବେଦୀ ନିଜ ଟ୍ୱିଟର ଆକାଉଣ୍ଟରେ ସେୟାର କରିଛନ୍ତି ।	0.9131641	True	True	ଅଙ୍ଗଦଙ୍କ ପିତା ବିଶନ୍ ସିଂହ ବେଦୀ ଟ୍ୱିଟରରେ ଚିତ୍ରଗୁଡ଼ିକ ସାଝି କରିଥିଲେ।	0.0	tensor([0.9826])	0.11904761904761907
8582	[[0.90190434]]	Police and bomb disposal squad have reached the spot.	ଖବରପାଇ ଘଟଣାସ୍ଥଳରେ ପୋଲିସ ଓ ବୋମା ନିଷ୍କ୍ରିୟକାରୀ ଦଳ ପହଂଚିଥିଲେ ।	0.90190434	True	True	ପୋଲିସ ଏବଂ ବମ୍ ଡିସ୍ପୋଜାଲ୍ ସ୍କ୍ୱାଡ୍ ସ୍ପଟ୍ ରେ ପହଞ୍ଚିଛି ।	0.0	tensor([1.])	0.1111111111111111
8668	[[0.9240581]]	A special fund of Rs.7000 crores has also been created for modern infrastructure.	ଆଧୁନିକ ଭିତ୍ତିଭୂମି ପାଇଁ ସାଢ଼େ 7 ହଜାର କୋଟି ଟଙ୍କାର ବିଶେଷ ପାଣ୍ଠି ମଧ୍ୟ ଗଠନ କରାଯାଇଛି ।	0.9240581	True	True	ଆଧୁନିକ ଅବସ୍ତ୍ରଣ୍ଟିର ପାଇଁ ୭୦୦୦ କୋଟି ଟଙ୍କାର ଏକ ବିଶେଷ ତହବିଲ ସୃଷ୍ଟି କରାଯାଇଛି ।	0.0	tensor([0.9596])	0.41481810115350487
8686	[[0.9058177]]	He said the date symbolizes the willpower and ambition of the youth.	ସେ କହିଛନ୍ତି ଯେ ଏହି ତାରିଖ ଯୁବବର୍ଗଙ୍କ ଇଚ୍ଛାଶକ୍ତି ଓ ମହତ୍ୱାକାଂକ୍ଷାର ପ୍ରତୀକ ।	0.9058177	True	True	ସେ କହିଲେ ଯେ ଏହି ତାରିଖ ଯୁବକମାନଙ୍କର ଇଚ୍ଛାଶକ୍ତି ଓ ଆଶାର ପ୍ରତୀକ ଅଟେ ।	0.0	tensor([0.9977])	0.6327421171171171
8706	[[0.93593967]]	Chief Minister of Madhya Pradesh, Shri Shivraj Singh Chouhan was also present on the occasion.	ଏହି ଅବସରରେ ମଧ୍ୟପ୍ରଦେଶର ମୁଖ୍ୟମନ୍ତ୍ରୀ ଶ୍ରୀ ଶିବରାଜ ସିଂହ ଚୌହାନ ମଧ୍ୟ ଉପସ୍ଥିତ ଥିଲେ ।	0.93593967	True	True	ମଧ୍ୟ ପ୍ରଦେଶର ମୁଖ୍ୟମନ୍ତ୍ରୀ, ଶ୍ରୀ ଶିବରାଜ ସିଂହ ଚୌହାନ ମଧ୍ୟ ଉକ୍ତ ଅବସରରେ ଉପସ୍ଥିତ ଥିଲେ ।	0.38	tensor([0.9662])	0.7934426229508196
8708	[[0.9401369]]	Brothers and sisters, the work on several highway projects has been going on in Jammu Kashmir too.	ଭାଇ ଓ ଭଉଣୀମାନେ, ଜାମ୍ମୁ କାଶ୍ମୀରରେ, ଏଠାରେ ମଧ୍ୟ ରାଜପଥର ଅନେକ ପ୍ରକଳ୍ପ କାର୍ଯ୍ୟ ଚାଲୁଅଛି ।	0.9401369	True	True	ଭାଇ ଓ ଭଉଣୀ, ଜମ୍ମୁ କାଶ୍ମୀରରେ ମଧ୍ୟ ଅନେକ ହାଇୱେ ପ୍ରକଳ୍ପରେ କାମ ଚାଲିଛି।	0.0	tensor([0.9883])	0.2900604686318972
8716	[[0.9218774]]	The car struck a tree on the road side.	ରାସ୍ତା କଡରେ ଥିବା ଏକ ଗଛରେ ଗାଡି ପିଟି ହୋଇ ଯାଇଥିଲା।	0.9218774	True	True	ରାସ୍ତା ପାର୍ଶ୍ୱରେ ଗାଡି ଗଛକୁ ଆକ୍ରମଣ କରିଥିଲା ।	0.0	tensor([0.9614])	0.11363636363636365
8724	[[0.9053734]]	Ministry of Finance Income Tax Offices to Remain Open on 29th, 30th and 31st March, 2018 The last date for filing belated returns for Assessment Years 2016-17 and 2017-18 and revised returns for Assessment Year 2016-17 is 31st March, 2018.	ଅର୍ଥ ମନ୍ତ୍ରଣାଳୟ ମାର୍ଚ୍ଚ 29, 30 ଏବଂ 31 ଦିନ ଖୋଲା ରହିବ ଆୟକର ବିଭାଗ କାର୍ଯ୍ୟାଳୟ ଆକଳନ ବର୍ଷ (ଆସେସମେଣ୍ଟ ଇୟର) 2016-17 ଏବଂ 2017-18 ଲାଗି ବିଳମ୍ବିତ ରିଟର୍ଣ୍ଣ ଦାଖଲ କରିବାର ଶେଷ ତାରିଖ ଏବଂ ଆକଳନ ବର୍ଷ 2016-17 ଲାଗି ସଂଶୋଧିତ ରିଟର୍ଣ୍ଣ ଦାଖଲ କରିବାର ଶେଷ ତାରିଖ 31 ମାର୍ଚ୍ଚ, 2018 ଅଟେ ।	0.9053734	True	True	ଅର୍ଥ ମନ୍ତ୍ରାଳୟ ଆୟକର କାର୍ଯ୍ୟାଳୟ ୨୯ତମ, ୩୦ତମ ଏବଂ ୩୧ତମ ମାର୍ଚ୍ଚ, ୨୦୧୮ରେ ଖୋଲା ରହିବ । ମୂଲ୍ୟାଙ୍କନ ବର୍ଷ ୨୦୧୬-୧୭ ଏବଂ ୨୦୧୭-୧୮ ପାଇଁ ବିଳମ୍ବିତ ରିଟର୍ଣ୍ଣ ଏବଂ ମୂଲ୍ୟାଙ୍କନ ବର୍ଷ ୨୦୧୬-୧୭ ପାଇଁ ସଂଶୋଧିତ ରିଟର୍ଣ୍ଣର ଶେଷ ତାରିଖ ୩୧ତମ ମାର୍ଚ୍ଚ, ୨୦୧୮ ।	0.0	tensor([0.8202])	0.3012771739130435
8770	[[0.90296483]]	Mumbai: Bollywood actor Sushant Singh Rajput committed suicide at his home in Mumbai.	ମୁମ୍ବାଇ: ବଲିଉଡ୍ ଅଭିନେତା ସୁଶାନ୍ତ ସିଂହ ରାଜପୁତ ଆତ୍ମହତ୍ୟା କରିଛନ୍ତି ।	0.90296483	True	True	ମୁମ୍ବାଇ: ବଲିଉଡ଼ ଅଭିନେତା ସୁଶାନ୍ତ ସିଂହ ରାଜପୁତ ମୁମ୍ବାଇରେ ନିଜ ଘରେ ଆତ୍ମହତ୍ୟା କରିଥିଲେ।	0.26	tensor([0.9792])	0.6592637054821929
8839	[[0.9219285]]	Following the complaint, the police visited the village and started investigation.	ଅଭିଯୋଗ ଆସିବା ପରେ ପୋଲିସ ଗାଁରେ ପହଞ୍ଚି ତଦନ୍ତ ଆରମ୍ଭ କରିଛି।	0.9219285	True	True	ଅଭିଯୋଗ ପରେ, ପୁଲିସ୍ ଗାଁକୁ ଯାଇ ଅନୁସନ୍ଧାନ ଆରମ୍ଭ କଲେ।	0.0	tensor([0.9497])	0.16666666666666666
8881	[[0.9031191]]	The incident was reported to the police by a local.	ଏହି ଘଟଣା ସଂପର୍କରେ ଜଣେ ସ୍ଥାନୀୟ ବ୍ୟକ୍ତି ପୋଲିସକୁ ସୂଚନା ଦେଇଥିଲେ।	0.9031191	True	True	ଘଟଣାଟି ଏକ ସ୍ଥାନୀୟଙ୍କଦ୍ୱାରା ପୋଲିସକୁ ରିପୋର୍ଟ କରାଯାଇଥିଲା।	0.0	tensor([0.9614])	0.0574712643678161
8892	[[0.91503835]]	The motive behind the attack is not known and police are investigating the matter.	ଆକ୍ରମଣର କାରଣ ଜଣାପଡ଼ିନାହିଁ ଏବଂ ପୁଲିସ ଏହି ମାମଲାରେ ତଦନ୍ତ ଜାରି ରଖିଛି।	0.91503835	True	True	ଆକ୍ରମଣର ପଛରେ ଥିବା ଉଦ୍ଦେଶ୍ୟ ଜଣା ନାହିଁ ଏବଂ ପୁଲିସ ବିଷୟଟି ଅନୁସନ୍ଧାନ କରୁଛି ।	0.0	tensor([0.9977])	0.2505446623093682
9136	[[0.9147884]]	Supreme Court refuses to quash sexual assault charges against Tarun Tejpal	ତରୁଣ ତେଜପାଲ୍‌ଙ୍କ ବିରୋଧରେ ଥିବା ଯୌନନିର୍ଯାତନା ମାମଲା ପ୍ରତ୍ୟାହାର କରିବାକୁ ମନା କଲେ ସୁପ୍ରିମ୍‌ କୋର୍ଟ	0.9147884	True	True	ତରୁଣ ତେଜପାଳ ବିରୁଦ୍ଧରେ ଯୌନ ଆକ୍ରମଣ ଅଭିଯୋଗକୁ ଖାରଜ କରିବାକୁ ସୁପ୍ରିମ କୋର୍ଟ ଅସ୍ୱୀକାର କଲେ ।	0.0	tensor([0.9004])	0.16528925619834708
9148	[[0.90828365]]	Police reached spot on receiving information and began a probe into the incident.	ଖବର ପାଇ ପୋଲିସ ପହଞ୍ଚି ଘଟଣାର ତଦନ୍ତ ଆରମ୍ଭ କରିଛି ।	0.90828365	True	True	ପୁଲିସ୍ ସୂଚନା ପାଇବା ପରେ ସ୍ଥାନରେ ପହଞ୍ଚି ଘଟଣାର ଅନୁସନ୍ଧାନ ଆରମ୍ଭ କଲେ ।	0.0	tensor([0.9875])	0.34307065217391297
